Title,Date,sentiment,target_word_count,cost_of_living
Offering online organic chemistry tutoring,2024-12-03T22:05:15+00:00,0.0,0,93.0
Top 10 New York boys basketball players in Class of 2025,2024-12-02T22:02:24+00:00,0.2023,0,93.0
Organic chemistry tutoring,2024-11-21T20:48:36+00:00,0.0,0,93.0
Marquette v UW- Madison: Adult Student Edition,2024-11-20T22:40:54+00:00,0.0,0,93.0
"People with no car, where do you get your groceries?",2024-11-20T01:48:13+00:00,-0.296,0,93.0
Attach a resume or not attach a resume,2024-11-13T23:38:33+00:00,0.0,0,93.0
apartment recommendations?,2024-11-10T09:32:25+00:00,0.0,0,93.0
Did anyone take BUAD 2160?,2024-11-04T21:42:57+00:00,0.0,0,93.0
