Title,Date,sentiment,target_word_count,cost_of_living
Did anyone find a pair of black glasses near the scrf building/ place vanier?,2024-11-06T17:54:51+00:00,0.0,0,136.0
Do I need a supervisor for Project based MSc in Computer Science?,2024-11-06T15:35:51+00:00,0.0,1,136.0
preventing carpal tunnel,2024-11-06T11:13:30+00:00,-0.0258,0,136.0
Whistler opening weekend,2024-11-06T09:40:08+00:00,0.0,0,136.0
Election watch party was depressing,2024-11-06T07:50:02+00:00,0.0258,0,136.0
Trump won without doubt,2024-11-06T07:18:05+00:00,0.7013,0,136.0
UBC arts co op offer out!,2024-11-06T05:58:00+00:00,0.0,0,136.0
HEELP!! Academic Concession???,2024-11-06T05:08:18+00:00,0.0,0,136.0
The Pit Election Night Watch Party Request,2024-11-06T05:35:45+00:00,0.4019,0,136.0
wtf am i doing here??,2024-11-06T05:20:11+00:00,-0.6322,0,136.0
the ‘UBC’ on the basic twill hoodies is too large,2024-11-06T05:08:23+00:00,0.0,0,136.0
where can I print a single copy of a mini book?,2024-11-06T04:58:25+00:00,0.0,0,136.0
i’m about to fail a midterm and the entire class with it,2024-11-06T04:10:44+00:00,-0.5423,1,136.0
Able to register for the health plan yet?,2024-11-06T03:50:58+00:00,0.0,0,136.0
LFS Community Dinner Presents: WoodLand Harvest Dinner,2024-11-05T21:26:35+00:00,0.0,0,136.0
How to get involved with bio labs?,2024-11-05T20:36:53+00:00,0.0,0,136.0
Language exchange (Chinese/English),2024-11-05T18:09:51+00:00,0.0,0,136.0
Help finding registrar number!,2024-11-05T10:22:44+00:00,0.1511,0,136.0
Do I need my student ID to go to sports games at ubc?,2024-11-05T06:43:27+00:00,0.0,0,136.0
How do you guys do it??,2024-11-06T01:10:59+00:00,0.0,0,136.0
sometimes i wonder if my friends know my reddit account,2024-11-06T01:06:09+00:00,0.4767,0,136.0
Tips on how to be more productive,2024-11-06T00:41:25+00:00,0.0,0,136.0
Filling food options on campus?,2024-11-05T22:56:04+00:00,0.0,0,136.0
Let’s pretend I left a note in your lunch box 💗,2024-11-05T22:39:02+00:00,-0.1027,0,136.0
Lost my Compass Card😕 Anywhere close I could get a new one?,2024-11-05T21:56:36+00:00,-0.3182,0,136.0
Anyone in Exchange feel their unit is too warm and humid?,2024-11-05T21:51:47+00:00,0.2263,0,136.0
DAP Program Requirements,2024-11-05T21:50:03+00:00,0.0,0,136.0
Arts Co-op for Computer Science,2024-11-05T21:45:51+00:00,0.0,0,136.0
Help with procrastination.,2024-11-05T21:14:07+00:00,0.0,0,136.0
Cops on Marine Drive!!,2024-11-05T21:07:34+00:00,0.0,0,136.0
Exploring the Impact of Contraceptive Use on Female Sexual Fantasies (18+),2024-11-05T19:33:44+00:00,0.0,0,136.0
Smell near Bus Loop,2024-11-05T19:14:14+00:00,0.0,0,136.0
THEYRE REMOVING LEAVES,2024-11-05T19:07:51+00:00,0.0,0,136.0
THEYRE REMOVING LEAVES,2024-11-05T19:07:31+00:00,0.0,0,136.0
Switching faculty in third year,2024-11-05T18:22:09+00:00,0.0,0,136.0
2024 Statement of Financial Information including salaries,2024-11-05T17:24:40+00:00,0.0,0,136.0
"Internship Panel Discussion and Q&A with Asana, Microsoft, & Palantir Software Engineers",2024-11-05T16:43:17+00:00,0.0,0,136.0
I can’t fucking stand my dumb fucking major,2024-11-05T14:59:09+00:00,-0.552,0,136.0
Am I missing out by not living on campus?,2024-11-05T07:44:26+00:00,-0.296,0,136.0
Need syllabus for Econ 101 and Econ 102,2024-11-05T06:44:14+00:00,0.0,0,136.0
is it weird that chem profs posted student numbers and names?,2024-11-05T06:01:02+00:00,-0.1779,0,136.0
im so done with myself and my habits,2024-11-05T05:47:05+00:00,0.0,0,136.0
older asian man looking at explicit photos and videos in the nest,2024-11-05T05:16:34+00:00,0.0,0,136.0
UBC OT masters,2024-11-05T04:42:15+00:00,0.0,0,136.0
Lost and Found @ Calendar Halloween Event,2024-11-05T04:29:27+00:00,-0.3182,0,136.0
how does therapy work with ubc coverage,2024-11-05T01:58:13+00:00,0.0,0,136.0
Equivalent Courses to MECH 260?,2024-11-05T01:53:29+00:00,0.0,0,136.0
Should I take MATH200 and 221 for Economics?,2024-11-05T01:37:50+00:00,0.0,0,136.0
Will you choose to have a PhD,2024-11-04T22:58:41+00:00,0.0,0,136.0
Shoutout to everyone biking in the wind🫡,2024-11-04T22:56:07+00:00,0.0,0,136.0
what is happening in the nest,2024-11-04T22:48:01+00:00,0.0,0,136.0
Any known office spaces for a student film?,2024-11-04T22:46:14+00:00,0.0,0,136.0
It fuckin WIMDY,2024-11-04T22:41:49+00:00,0.0,0,136.0
Is it illegal for a Prof to show our faces and student numbers on the screen while having a lecture?,2024-11-04T22:30:24+00:00,-0.5574,0,136.0
Disaster Preparedness Survey,2024-11-04T22:23:17+00:00,-0.6249,0,136.0
Tallwood painting - receiving mail,2024-11-04T21:35:15+00:00,0.0,0,136.0
Carpool to Pacific Coliseum,2024-11-04T18:09:20+00:00,0.0,0,136.0
Tuition Hike Proposal,2024-11-04T20:43:35+00:00,0.0,0,136.0
Its sunny today!!,2024-11-04T20:34:05+00:00,0.5242,0,136.0
"If i only go to 2 tutorials out of 12, can they make me fail?",2024-11-04T20:33:47+00:00,-0.5423,0,136.0
Stats 200 midterm grade...,2024-11-04T20:21:19+00:00,0.0,1,136.0
[Rant] My roommate is giving me anxiety and I don’t know how to deal with it,2024-11-04T20:17:35+00:00,-0.1779,0,136.0
Collab on Stardew Valley anyone?,2024-11-04T19:44:47+00:00,0.0,0,136.0
How hard would it be to transfer here from America,2024-11-04T18:07:15+00:00,-0.1027,0,136.0
(HELP) Something about the Duo Authentication,2024-11-04T17:15:25+00:00,0.0,0,136.0
Are there any fitness clubs here similar to F45?,2024-11-04T17:15:17+00:00,0.2732,0,136.0
What A Heavy Rain this Morning,2024-11-04T15:58:24+00:00,0.0,0,136.0
Student debt stats,2024-11-04T14:46:43+00:00,-0.3612,0,136.0
being with an academic weapon in a group project is like winning the lottery,2024-11-04T09:58:56+00:00,0.5719,1,136.0
Tips for studying STEM subjects,2024-11-04T09:26:11+00:00,0.0,0,136.0
Does anyone else purposely walk in front of shit drivers on campus,2024-11-04T08:52:19+00:00,-0.5574,0,136.0
where can i test for my adhd,2024-11-04T08:06:48+00:00,0.0,1,136.0
How to view past grades as alumni since no more ssc?,2024-11-04T07:37:46+00:00,-0.296,0,136.0
UBC CS email is not working anymore(only outbound works),2024-11-04T07:06:21+00:00,0.0,0,136.0
Where to go for a cheap low taper near UBC or downtown?,2024-11-04T06:44:43+00:00,-0.2732,0,136.0
Is Hubbards at Vanier closed?,2024-11-04T06:32:28+00:00,0.0,0,136.0
how to check out a vacuum at ponderosa,2024-11-04T06:31:06+00:00,0.0,0,136.0
UBC Counselling hiring,2024-11-04T06:07:23+00:00,0.0,0,136.0
Victoria or Nanaimo for Christmas??,2024-11-04T05:52:42+00:00,0.0,0,136.0
Will UBC card lose magnetism?,2024-11-04T05:52:26+00:00,-0.4019,0,136.0
Are there frat parties every Friday?,2024-11-04T05:50:09+00:00,0.4019,0,136.0
Is it possible for me to get into UBC CS with my current grades?,2024-11-04T05:41:43+00:00,0.0,0,136.0
Short Reading Week,2024-11-04T05:28:29+00:00,0.0,0,136.0
Having Partners on Assignments SUCKS,2024-11-04T04:32:13+00:00,-0.4995,1,136.0
