Title,Date,sentiment,target_word_count,cost_of_living
Woodshop or metal shop at UVM?,2024-12-03T20:13:39+00:00,0.0,0,124.0
Free overnight parking by Redstone???,2024-12-02T16:01:25+00:00,0.5913,0,124.0
Lock out distracting websites when you are studying,2024-12-01T21:09:02+00:00,-0.296,0,124.0
Spring 25 parking permit question,2024-12-01T02:20:40+00:00,0.0,0,124.0
Nursing Acceptance Rate?,2024-11-30T23:07:00+00:00,0.4588,0,124.0
campus or off campus parking,2024-11-30T22:12:01+00:00,0.0,0,124.0
Chances of getting in?,2024-11-29T20:05:47+00:00,0.2023,0,124.0
"Looking for ""volunteers""",2024-11-27T01:26:06+00:00,0.0,0,124.0
hoping to connect to a dpt student,2024-11-26T05:07:06+00:00,0.4215,0,124.0
Daughter needs to store her car cheaply near Burlington,2024-11-25T16:37:31+00:00,0.0,0,124.0
Please chance me for Nursing,2024-11-24T05:09:27+00:00,0.5106,0,124.0
opinions on the ceramics co-op?,2024-11-21T20:31:58+00:00,0.0,0,124.0
Dana Library after hours access,2024-11-19T23:49:25+00:00,0.0,0,124.0
Join our online research study!! Earn up to $75 if you qualify.,2024-11-19T14:22:23+00:00,0.4184,0,124.0
The 126,2024-11-16T23:22:17+00:00,0.0,0,124.0
any places on campus with a soldering iron that is open to use for students?,2024-11-14T20:11:18+00:00,0.0,0,124.0
"Apartment for Rent 2BR + office, 2 floors in Burlington—help takeover lease",2024-11-11T22:25:31+00:00,0.0,0,124.0
"Be honest on my chances, and any options?",2024-11-11T18:46:31+00:00,0.6249,0,124.0
"Considering Applying From Newport Beach, CA (Coastal Orange County): What should I know?",2024-11-10T22:52:15+00:00,0.0,0,124.0
"Do You Think I'll Make It In For Biomedical Engineering? Also, How Do You Feel About Their Biomedical Department?",2024-11-10T22:43:49+00:00,0.0,0,124.0
UVM vs OSU vs UO for premed,2024-11-10T03:09:10+00:00,0.0,0,124.0
selling 2 tickets to slow pulp tonight,2024-11-09T14:33:54+00:00,0.0,0,124.0
Thoughts on BIOL 3105 (Community Ecology)?,2024-11-09T01:34:32+00:00,0.0,0,124.0
Howe Friday Hours,2024-11-09T01:25:59+00:00,0.0,0,124.0
Frats throwing tn?,2024-11-08T21:30:18+00:00,0.0,0,124.0
"the UVM pokemon go raid game has been weak lately, guys",2024-11-08T17:16:21+00:00,-0.4404,0,124.0
Middlebury or UVM- Sustainability program,2024-11-08T09:31:29+00:00,0.0,0,124.0
Easy class to take to fulfill Humanities requirement,2024-11-07T19:00:52+00:00,0.7003,0,124.0
"If you need Spring semester housing (off campus), go on Facebook",2024-11-07T17:23:47+00:00,0.0,0,124.0
Unique programs @ UVM??,2024-11-07T15:46:34+00:00,0.0,0,124.0
FUcking saxophone in billings,2024-11-06T20:06:22+00:00,0.0,0,124.0
Does SAT range depend on major?,2024-11-06T03:22:01+00:00,0.0,0,124.0
"Hoping to Apply, Wondering What My Chances Are",2024-11-05T20:21:40+00:00,0.5574,0,124.0
Parking for uvm gym?,2024-11-05T11:33:16+00:00,0.0,0,124.0
most fun/easy classes to take,2024-11-04T17:51:12+00:00,0.0,0,124.0
