Title,Date,sentiment,target_word_count,cost_of_living
BIOL 3240,2024-12-04T03:39:17+00:00,0.0,0,119.0
Lost all data in OneDrive after graduation,2024-12-04T02:38:53+00:00,-0.3182,0,119.0
Prospective transfer student asking for advice and stats,2024-12-04T02:25:14+00:00,0.0,0,119.0
is it possible to get in with a 3.6?,2024-12-04T01:34:11+00:00,0.0,0,119.0
Yen Single,2024-12-03T23:24:51+00:00,0.0,0,119.0
PSYC 3310:R or STAT 1601,2024-12-03T21:33:38+00:00,0.0,0,119.0
Do we get all our stuff out for winter break??,2024-12-03T20:42:34+00:00,0.0,0,119.0
Premed taking physics over the summer at GMU,2024-12-03T19:40:00+00:00,0.0,0,119.0
to the student i saw get hit by a car this morning,2024-12-03T18:14:00+00:00,0.0,0,119.0
Thoughts on Oxford Hills apartments?,2024-12-03T17:26:04+00:00,0.0,0,119.0
How many minors can I have?,2024-12-03T15:45:03+00:00,0.0,0,119.0
UVA Wifi recently,2024-12-03T15:12:02+00:00,0.0,0,119.0
The mail lady ran over my inflatable Santa Claus decoration. Can I sue?,2024-12-03T07:32:32+00:00,0.0,0,119.0
student orgs + info for first-year,2024-12-03T07:12:35+00:00,0.0,0,119.0
Improvement,2024-12-03T06:18:36+00:00,0.4588,0,119.0
Jefferson Scholarship,2024-12-03T05:23:28+00:00,0.0,0,119.0
Financial Aid for Summer Study Aboard,2024-12-03T03:21:40+00:00,0.0258,0,119.0
Anyone know when we will hear back for the transfer grant if we applied for it?,2024-12-03T02:40:32+00:00,0.3612,0,119.0
CAPS initial assessment,2024-12-03T00:46:16+00:00,0.0,0,119.0
BIOL 3010 final study tips,2024-12-02T21:08:09+00:00,0.0,1,119.0
UVA students,2024-12-02T19:41:31+00:00,0.0,0,119.0
Prospective transfer from lac,2024-12-02T19:00:59+00:00,0.0,0,119.0
Any artist alley/art market/vendor events on Grounds?,2024-12-01T22:39:51+00:00,0.0,0,119.0
Looking for a gift certificate idea for UVA student,2024-12-01T22:30:35+00:00,0.4404,0,119.0
UVA Past Early Decisions Dates,2024-12-01T21:13:18+00:00,0.0,0,119.0
"At Bond or any of the on grounds housing, are you able to leave mid year if you find someone to take over your lease for the second semester?",2024-12-01T20:07:32+00:00,-0.0516,0,119.0
UVA ED Date (Hey DeanJ),2024-12-01T18:01:45+00:00,0.0,0,119.0
UVA should fire Tony Elliot!,2024-12-01T04:54:05+00:00,-0.4003,0,119.0
Viewing admissions file,2024-12-01T01:12:52+00:00,0.0,0,119.0
Career center website advice,2024-11-30T22:27:03+00:00,0.0,0,119.0
Question about Placement Test as a 3rd Year,2024-11-30T21:36:45+00:00,0.0,1,119.0
Anyone know how I can get a free tshirt from UVA?,2024-11-30T21:07:38+00:00,0.5106,0,119.0
Econ final questions,2024-11-30T20:35:21+00:00,0.0,1,119.0
Who will win the UVA vs Virginia Tech football game today?,2024-11-30T18:55:14+00:00,0.5859,0,119.0
"Anyone interested in being in a video called ""first to leave the circle wins 500""?",2024-11-30T18:42:16+00:00,0.7351,0,119.0
It's Hard to Get into DRACULA in Fall or Spring So How About J-TERM?,2024-11-30T16:21:43+00:00,-0.1027,0,119.0
GAME DAY. FUCK TECH.,2024-11-30T14:15:16+00:00,-0.5423,0,119.0
UVA Math Placement Test: MATH 2310/APMA 2120,2024-11-29T19:30:02+00:00,0.0,1,119.0
Português Speaker at UVA?,2024-11-29T07:31:54+00:00,0.0,0,119.0
December Graduation Question,2024-11-29T07:22:46+00:00,0.0,0,119.0
"ED rejects/admits, what were your stats?",2024-11-29T05:13:52+00:00,0.0,0,119.0
Off-Grounds Housing 2025-2026 UVA,2024-11-28T21:40:43+00:00,0.0,0,119.0
Has anybody here transferred to McIntire from a traditional 4 year university?,2024-11-28T17:56:27+00:00,0.0,0,119.0
100$ Reward for lost iphone 8,2024-11-28T11:46:45+00:00,0.34,0,119.0
Academic Probation,2024-11-28T03:18:09+00:00,0.0,0,119.0
ECON 3020,2024-11-28T00:55:31+00:00,0.0,0,119.0
Food over break? (First year),2024-11-27T21:23:54+00:00,0.0,0,119.0
Questions as a prospective 2nd year trasnfer to Mcintire,2024-11-27T19:23:24+00:00,0.0,0,119.0
List Stuff for Sale to UVA students?,2024-11-27T18:24:29+00:00,0.0,0,119.0
What are your best memories at UVA?,2024-11-27T16:35:38+00:00,0.6369,0,119.0
Need help,2024-11-27T07:04:18+00:00,0.0,0,119.0
Grad school admission,2024-11-27T05:04:24+00:00,0.0,0,119.0
"SIS, you good bro?",2024-11-27T04:27:12+00:00,0.4404,0,119.0
Emergency Department Scribe Question,2024-11-27T01:36:05+00:00,-0.3818,0,119.0
Spring 2025 Transfer Roommates,2024-11-26T20:23:51+00:00,0.0,0,119.0
Math 3354 experiences,2024-11-26T15:21:39+00:00,0.0,0,119.0
ChatGPT trying to prove dividing by 0 is possible,2024-11-26T05:42:14+00:00,0.0,0,119.0
HELP DECIDE: Echols Interdisciplinary Major vs Mcintire(Commerce),2024-11-26T04:26:22+00:00,0.0,0,119.0
Nice company between Cornell and Dartmouth,2024-11-26T02:01:05+00:00,0.4215,0,119.0
Which consulting/finance clubs recruit in the spring?,2024-11-26T00:51:58+00:00,0.0,0,119.0
Application Portal,2024-11-25T23:00:08+00:00,0.0,0,119.0
Early Decision Numbers?,2024-11-25T21:30:37+00:00,0.0,0,119.0
Possible solution for the crumbling CS industry,2024-11-25T21:14:43+00:00,0.3182,0,119.0
CS or Math PhD to work on world's most limiting computational problems?,2024-11-25T20:52:17+00:00,-0.4522,0,119.0
quick survey for UVA CS majors,2024-11-25T19:05:49+00:00,0.0,0,119.0
CS + Linguistics/ CS + Poli sci,2024-11-25T18:03:05+00:00,0.0,0,119.0
Post-Grad housing,2024-11-25T17:06:32+00:00,0.0,0,119.0
Languages and transfer student,2024-11-25T12:37:49+00:00,0.0,0,119.0
How is DS 2004 Data Ethics?,2024-11-25T05:16:38+00:00,0.0,0,119.0
Financial aid package for spring transfer,2024-11-25T04:18:40+00:00,0.0,0,119.0
Coffee/caffeine yay or nay?,2024-11-25T03:32:41+00:00,0.5267,0,119.0
Does open enrollment open at midnight or 7 am tomorrow?,2024-11-24T23:11:52+00:00,0.0,0,119.0
Visiting - Where can I park?,2024-11-24T22:51:30+00:00,0.0,0,119.0
Looking For Gaston-Ramazani Roommate Group,2024-11-24T22:24:54+00:00,0.0,0,119.0
Got in as a spring transfer,2024-11-24T16:01:55+00:00,0.0,0,119.0
Football and Men's basketball average nearly 25 point losses this weekend,2024-11-24T14:34:20+00:00,-0.4019,0,119.0
How’s the med school here?,2024-11-24T04:58:51+00:00,0.0,0,119.0
Transfer question,2024-11-24T00:57:22+00:00,0.0,0,119.0
Drunk people,2024-11-24T00:45:03+00:00,-0.34,0,119.0
Transferring to UVA McIntire help..,2024-11-23T22:02:09+00:00,0.0,0,119.0
Phantom parking ticket,2024-11-23T15:06:34+00:00,0.0,0,119.0
"If everyone here is smart and hard working, how do you stand out in getting top grades and getting into clubs?",2024-11-23T07:00:23+00:00,0.4767,0,119.0
Got In Spring Semester,2024-11-23T06:25:36+00:00,0.0,0,119.0
How Do You Find Pre-Med Internships as a UVA Student?,2024-11-23T05:45:57+00:00,0.0,0,119.0
Rushing for a sorority.. questions,2024-11-23T05:11:04+00:00,0.0,0,119.0
UVA wifi taking a shit almost made me switch to EE,2024-11-23T03:02:18+00:00,-0.5574,0,119.0
GOT IN AS A SPRING TRANSFER!,2024-11-23T01:46:33+00:00,0.0,0,119.0
RA Alternate Offer,2024-11-22T23:39:44+00:00,0.0,0,119.0
SMU game,2024-11-22T20:50:06+00:00,0.0,0,119.0
Where do we get tickets for 4Y5K?,2024-11-22T20:37:54+00:00,0.0,0,119.0
roommate group,2024-11-22T16:23:51+00:00,0.0,0,119.0
Which dining hall has the best breakfast on campus?,2024-11-22T04:35:04+00:00,0.6369,0,119.0
Looking for roommate,2024-11-21T20:53:02+00:00,0.0,0,119.0
Looking for someone to sublet for spring 2025!,2024-11-21T17:07:37+00:00,0.0,0,119.0
Cost of auditing a class as part-time undergrad?,2024-11-21T14:11:30+00:00,0.0,0,119.0
It blows my mind secret societies are a thing here when most people can’t get into regular clubs or student organizations,2024-11-21T05:54:12+00:00,0.0,0,119.0
Contemplative Center Hours,2024-11-21T02:54:17+00:00,0.0,0,119.0
Organic chemistry tutoring,2024-11-21T01:15:48+00:00,0.0,0,119.0
Portal Update Gone Missing?,2024-11-21T01:03:17+00:00,-0.296,0,119.0
24/7 studying?,2024-11-21T00:52:58+00:00,0.0,0,119.0
I don’t feel hard work is enough to survive at UVA,2024-11-21T00:38:39+00:00,-0.1027,0,119.0
How is UVA so incompetent?,2024-11-20T19:06:46+00:00,-0.6113,0,119.0
Exam Tip: Bonus Question is Only Bones if You get Everything Else Right.,2024-11-20T16:27:15+00:00,0.5423,1,119.0
WGS 2100 discussion switch,2024-11-20T15:58:45+00:00,0.0,0,119.0
Looking for a photographer,2024-11-20T02:25:30+00:00,0.0,0,119.0
everything i wanted,2024-11-20T00:36:20+00:00,0.0,0,119.0
Best Social Place to Live for Incoming 2nd Year Spring Transfer,2024-11-19T23:50:29+00:00,0.6369,0,119.0
Why are on-grounds dining places so allergen/dietary restriction-unfriendly?,2024-11-19T23:43:25+00:00,0.0,0,119.0
Physics at Community College for prehealth,2024-11-19T23:39:42+00:00,0.0,0,119.0
What is the easy way out of physics 2 and physics 2 lab? Do any CCs offer it or does UVA have a summer class that is somewhat easier than taking it in the fall.,2024-11-19T22:59:11+00:00,0.6605,0,119.0
Is this courseload for E-school CS fine?,2024-11-19T22:07:34+00:00,0.2023,0,119.0
Are there any ATMs that accept deposits here?,2024-11-19T21:13:29+00:00,0.3818,0,119.0
DSA2 how to study?,2024-11-19T20:27:40+00:00,0.0,0,119.0
Past J-Term Students in Cville,2024-11-19T19:17:25+00:00,0.0,0,119.0
I need help with my application,2024-11-18T21:05:45+00:00,0.0,0,119.0
Paying for Off Grounds with a Private Student Loan,2024-11-18T20:58:48+00:00,0.0,0,119.0
UVA v. Louisville volleyball game,2024-11-18T20:47:22+00:00,0.0,0,119.0
Best Coffee on Grounds to buy as a gift?,2024-11-18T19:24:23+00:00,0.7964,0,119.0
Will my professor receive my voicemail?,2024-11-18T17:17:56+00:00,0.0,0,119.0
When to search for housing?,2024-11-18T16:20:01+00:00,0.0,0,119.0
getting into uva without gaa (nova),2024-11-18T15:41:31+00:00,0.0,0,119.0
ROOMMATE SEARCH,2024-11-18T04:32:18+00:00,0.0,0,119.0
ED Decision,2024-11-18T03:40:27+00:00,0.0,0,119.0
Liminal Spaces at UVA,2024-11-18T03:36:12+00:00,0.0,0,119.0
CS related clubs?,2024-11-18T03:06:01+00:00,0.0,0,119.0
does uva actually work on the rock’s fish pond?,2024-11-18T02:41:22+00:00,0.0,0,119.0
What’s the Econ 2010 final like?,2024-11-17T21:20:57+00:00,0.3612,1,119.0
ECON 3010: Westerfield or Kripalani?,2024-11-17T19:34:33+00:00,0.0,0,119.0
Acapella groups,2024-11-17T18:33:51+00:00,0.0,0,119.0
Mcintire transfer,2024-11-17T16:52:42+00:00,0.0,0,119.0
Spring Transfer Decisions,2024-11-17T16:09:57+00:00,0.0,0,119.0
Any opinions on Gaston/Ramazani or Bond House?,2024-11-17T15:37:07+00:00,0.0,0,119.0
Questions about rushing,2024-11-17T13:52:15+00:00,0.0,0,119.0
Did anybody get in with a 4.05W gpa into uva?,2024-11-17T12:42:26+00:00,0.0,0,119.0
What is the process of transferring from the college to E-school?,2024-11-17T04:28:13+00:00,0.0,0,119.0
anything to do after i apply for graduation?,2024-11-17T00:49:39+00:00,0.0,0,119.0
Elizabeth Orrico,2024-11-16T23:41:04+00:00,0.0,0,119.0
CS 1113,2024-11-16T21:07:42+00:00,0.0,0,119.0
UVA course enrollment pending,2024-11-16T21:03:21+00:00,0.0,0,119.0
"If frats and clubs are so hard to join, how do people get into the secret societies?",2024-11-16T19:52:03+00:00,0.1525,0,119.0
Is the food really that bad?,2024-11-16T19:43:25+00:00,-0.5829,0,119.0
Lost wallet,2024-11-16T15:51:41+00:00,-0.3182,0,119.0
How do I submit new SAT scores?,2024-11-16T03:07:02+00:00,0.0,0,119.0
Language classes at UVA for online learning,2024-11-15T23:45:48+00:00,0.0,0,119.0
RUNK DINING FOOD,2024-11-15T22:23:41+00:00,0.0,0,119.0
Cello lessons,2024-11-15T20:19:46+00:00,0.0,0,119.0
"So this is what they mean by ""curves"" being a part of the college experience",2024-11-15T19:29:20+00:00,0.0,0,119.0
Ap Submission as first year,2024-11-15T18:07:57+00:00,0.0,0,119.0
Bio STAT2020 - Maria Ferrara,2024-11-15T18:06:03+00:00,0.0,0,119.0
Interested in media production? There's a J-term class,2024-11-15T14:35:36+00:00,0.4019,0,119.0
Is the fevo-enterprise link for tickets promoted by Virginia sports a legit ticket site?,2024-11-15T13:52:25+00:00,0.4215,0,119.0
Flats at West Village,2024-11-15T02:58:02+00:00,0.0,0,119.0
"APARTMENT SPRING 2025 WERTLAND SQUARE-- GREAT LOCATION, FULLY FURNISHED",2024-11-15T01:20:07+00:00,0.7034,0,119.0
Warmest places on campus?,2024-11-14T22:16:31+00:00,0.4019,0,119.0
Where to meet new ppl as a 2nd year,2024-11-14T20:14:15+00:00,0.0,0,119.0
Study spots??,2024-11-14T17:00:19+00:00,0.0,0,119.0
SPRING 2025 SUBLET at GRANDMARC. AFFORDABLE PRICE (negotiable),2024-11-14T15:10:51+00:00,0.0,0,119.0
Spring 2025 Sublet at GrandMarc. Affordable rent and negotiable,2024-11-14T15:05:19+00:00,0.0,0,119.0
Casual Soccer at UVA?,2024-11-14T06:00:31+00:00,0.2023,0,119.0
Jealous of VT's food,2024-11-14T02:27:57+00:00,-0.4588,0,119.0
Spring Transfer,2024-11-13T23:37:28+00:00,0.0,0,119.0
Should I upload National Merit Commended to application portal?,2024-11-13T22:49:25+00:00,0.6908,0,119.0
Quick Survery!! Roomate UX App,2024-11-13T21:55:30+00:00,0.0,0,119.0
Where to get soup on grounds?,2024-11-13T21:46:24+00:00,0.0,0,119.0
School is so rigged because there are too many robots around campus and they don’t look when they cross the roads,2024-11-13T21:07:17+00:00,-0.5009,0,119.0
Looking for someone to takeover Lease for SPR2025,2024-11-13T20:31:29+00:00,0.0,0,119.0
J-Term PSYC 2150,2024-11-13T15:48:16+00:00,0.0,0,119.0
Male looking for housing for next year.,2024-11-13T07:20:39+00:00,0.0,0,119.0
Sorority + Fat Girl,2024-11-13T06:09:19+00:00,0.0,0,119.0
J Term Class,2024-11-13T04:01:43+00:00,0.0,0,119.0
CS2330 and ECE2330 Double Counting,2024-11-13T03:32:01+00:00,0.0,0,119.0
UVA vs NYU / Grad School,2024-11-12T21:37:15+00:00,0.0,0,119.0
Magic the Gathering Play Groups?,2024-11-12T20:54:35+00:00,0.34,0,119.0
Has anyone taken China and the Cold War?,2024-11-12T20:42:52+00:00,-0.5994,0,119.0
Has anybody got into uva as a spring transfer?,2024-11-12T20:11:50+00:00,0.0,0,119.0
Canvas not working?,2024-11-12T15:40:21+00:00,0.0,0,119.0
BA or BS in CS,2024-11-12T06:50:35+00:00,0.0,0,119.0
App for Instate Privileges for applicants to uva,2024-11-12T03:22:41+00:00,0.3818,0,119.0
How often do they restock the shelves at the little store in Croads?,2024-11-12T02:53:39+00:00,0.0,0,119.0
"I applied ED UVA , Hoping for good results",2024-11-12T01:18:43+00:00,0.6908,0,119.0
Market Research Question,2024-11-11T22:36:11+00:00,0.0,0,119.0
gay women fill out marriage pact,2024-11-11T19:21:38+00:00,0.0,0,119.0
Apartment Cleaning Service,2024-11-11T02:05:10+00:00,0.0,0,119.0
Sub-Lease Spring 2025,2024-11-10T19:25:59+00:00,0.0,0,119.0
Forge Launch Internship,2024-11-10T17:43:23+00:00,0.0,0,119.0
Hoopers when do yall play pick up games?,2024-11-10T16:55:23+00:00,0.34,0,119.0
Has anyone taken the DS 4002: Data Science Project Course over the J-Term?,2024-11-10T16:39:11+00:00,0.0,1,119.0
Hi incoming first-years and underclassmen! AMA about my UVA experience!!,2024-11-10T16:08:00+00:00,0.0,0,119.0
Wow,2024-11-10T06:25:39+00:00,0.5859,0,119.0
housing for fall and spring 2025,2024-11-09T23:53:59+00:00,0.0,0,119.0
UVA Student Research,2024-11-09T18:51:05+00:00,0.0,0,119.0
best practices for networking with alumni,2024-11-09T18:20:59+00:00,0.6369,0,119.0
Best spot for free camping somewhat near C-Ville,2024-11-09T16:39:50+00:00,0.8176,0,119.0
Jobs on Grounds,2024-11-09T04:46:13+00:00,0.0,0,119.0
PHYS 1425: Am I screwed?,2024-11-09T01:20:12+00:00,-0.4939,0,119.0
Wait listed for enrollment?,2024-11-08T18:50:08+00:00,0.0,0,119.0
"STAT 2120, thoughts on Jeffery Holt?",2024-11-08T18:50:03+00:00,0.0,0,119.0
No more free water at Newcomb Subway 😢,2024-11-08T18:40:14+00:00,-0.6364,0,119.0
How long do I usually wait for Pending courses?,2024-11-08T17:17:30+00:00,0.0,0,119.0
Hiring student sports journalists,2024-11-08T16:19:49+00:00,0.0,0,119.0
Has anyone taken LPPS 4730 (Impact Investing) with Prof Nolde?,2024-11-08T15:37:59+00:00,0.0,0,119.0
Taking STAT 1601 J Term,2024-11-08T15:31:19+00:00,0.0,0,119.0
"Phys 1425, how is Atshushi Yoshida?",2024-11-08T14:43:13+00:00,0.0,0,119.0
transferring from a community college,2024-11-08T06:46:37+00:00,0.0,0,119.0
PHYS 2415 and PHYS 2419,2024-11-08T02:58:46+00:00,0.0,0,119.0
Am I cooked,2024-11-07T21:46:36+00:00,-0.6369,0,119.0
Students who drink coffee?,2024-11-07T17:59:10+00:00,0.0,0,119.0
Anyone transfer to UVA spring semester? Were you are second year or third year? Any insights? Thanks!,2024-11-07T17:13:03+00:00,0.5764,0,119.0
DRAM 3050 - should i take?,2024-11-07T16:38:05+00:00,0.0,0,119.0
taking apma 3110 before apma 3140,2024-11-07T15:18:15+00:00,0.0,0,119.0
"VCCS guaranteed admission agreement students, what’s your story? And what should I expect?",2024-11-07T01:55:42+00:00,0.5514,0,119.0
Chances of getting off Defense waitlist?,2024-11-07T01:30:05+00:00,0.3182,0,119.0
Looking for one roommate,2024-11-07T01:26:35+00:00,0.0,0,119.0
Moves,2024-11-07T00:59:07+00:00,0.0,0,119.0
Ra interview,2024-11-07T00:14:29+00:00,0.0,0,119.0
Second year transfer into Kines,2024-11-06T23:09:34+00:00,0.0,0,119.0
Rooms in Fully Renovated Apartment!,2024-11-06T21:18:26+00:00,0.0,0,119.0
Genetics (BIOL 3010)in the fall vs. spring?,2024-11-06T21:08:27+00:00,0.0,0,119.0
Asking all Hoos: Clubs to join now?,2024-11-06T20:26:38+00:00,0.296,0,119.0
Professors to watch out for (Astronomy)?,2024-11-06T20:24:29+00:00,0.0,0,119.0
Volunteers for cognitive assessment,2024-11-06T19:26:34+00:00,0.0,0,119.0
Game day overalls,2024-11-06T19:33:54+00:00,0.0,0,119.0
student health & wellness contraceptives information,2024-11-06T19:00:36+00:00,0.4404,0,119.0
PSA: ID Lost & Found from Election Day [x/post to r/Charlottesville],2024-11-06T14:03:40+00:00,-0.3182,0,119.0
a trump presidency and political science major,2024-11-06T09:47:13+00:00,0.0,0,119.0
UVA college application: Accidentally submitted test scores,2024-11-06T03:17:21+00:00,-0.34,1,119.0
Biol 4310: Sensory Neurobiology,2024-11-06T00:05:50+00:00,0.0,0,119.0
Rushing,2024-11-05T19:41:38+00:00,0.0,0,119.0
Why go to UVA,2024-11-05T16:27:46+00:00,0.0,0,119.0
CHEM 4440 and BIOL 3030?,2024-11-05T16:26:31+00:00,0.0,0,119.0
waitlist while enrolled,2024-11-05T13:05:57+00:00,0.0,0,119.0
PSA: It's Election Day! [x/post to r/Charlottesville],2024-11-05T10:11:26+00:00,0.0,0,119.0
anyone have a uva commerce cohort mug?,2024-11-05T05:40:04+00:00,0.0,0,119.0
Looking for people to trial our business,2024-11-05T05:27:10+00:00,0.0,0,119.0
Slaughter line to vote,2024-11-05T02:11:09+00:00,0.0,0,119.0
Gradution Weekend and dinner reservations,2024-11-05T01:21:22+00:00,0.0,0,119.0
Any guesses as to time of UVA v Louisville basketball game (1/18),2024-11-05T00:05:11+00:00,0.0,0,119.0
Seeking student photographer for maternity shoot,2024-11-04T22:53:36+00:00,-0.34,0,119.0
Financial Aid,2024-11-04T22:49:48+00:00,0.0,0,119.0
can i vote in charlotteville,2024-11-04T21:06:41+00:00,0.0,0,119.0
ed applicant,2024-11-04T20:42:24+00:00,0.0,0,119.0
Where to take 4hr meeting,2024-11-04T20:33:21+00:00,0.0,0,119.0
Does KLPA 1300 Swimming actually teach you how to swim?,2024-11-04T20:05:48+00:00,0.0,0,119.0
Bio 2100,2024-11-04T18:30:13+00:00,0.0,0,119.0
First-year student: Fulfilling general education requirement first year follow ur heart?,2024-11-04T15:22:06+00:00,0.6369,0,119.0
Best / easy HSS credit classes for SEAS,2024-11-04T15:22:03+00:00,0.8658,0,119.0
PSA: NO EARLY VOTING TODAY! [x/post to r/Charlottesville],2024-11-04T13:42:03+00:00,-0.4981,0,119.0
