Title,Date,sentiment,target_word_count,cost_of_living
Typical,2024-11-30T23:56:08+00:00,0.0,0,128.0
Tailgating,2024-11-30T14:08:47+00:00,0.0,0,128.0
An officiating crew so bad that they make TV Teddy look good?!,2024-11-28T14:50:15+00:00,-0.4373,0,128.0
Does anyone else think that UNC with Davis&Co. Is overrated?,2024-11-28T05:05:47+00:00,0.0,0,128.0
Our size is going to kill us this year,2024-11-27T06:13:56+00:00,-0.6908,0,128.0
Does anyone else have someone in the house wondering what in the heck you're doing?,2024-11-27T05:40:50+00:00,0.0,0,128.0
Who Should We Go After?,2024-11-26T17:12:41+00:00,0.0,0,128.0
Mack Brown is gone.,2024-11-26T16:55:43+00:00,0.0,0,128.0
"Lost in the stress of last night, can we now acknowledge how epic that Seth-Roy dap was?",2024-11-26T14:26:44+00:00,-0.6249,0,128.0
UNC Men’s Basketball Calendar Posters - 2024/2025,2024-11-26T08:30:23+00:00,0.0,0,128.0
How do we feel about the officiating in the Dayton game?,2024-11-26T06:12:35+00:00,0.0,0,128.0
Kenan stadium open?,2024-11-24T02:35:12+00:00,0.0,0,128.0
Mack brown has got to go,2024-11-23T18:31:38+00:00,0.0,0,128.0
Whatever happened to Dawson Garcia? 🏀,2024-11-20T11:07:43+00:00,0.0,0,128.0
Cameo birthday present,2024-11-20T02:39:45+00:00,0.0,0,128.0
Organic chemistry tutoring,2024-11-19T17:00:59+00:00,0.0,0,128.0
UNC Ticket Gift Idea,2024-11-09T23:18:47+00:00,0.4404,0,128.0
Kansas fan's opinion on the KU/UNC game,2024-11-09T15:36:25+00:00,0.0,0,128.0
Should we talk about the game tonight?,2024-11-09T03:31:34+00:00,0.0,0,128.0
Top 10 men’s Wooden Award candidates for 2024-25 season,2024-11-08T23:44:24+00:00,0.6486,0,128.0
Looking for Tips for My First Game at Chapel Hill,2024-11-08T12:38:33+00:00,0.0,0,128.0
Best places to watch Tar Heels basketball game in Phoenix area?,2024-11-07T15:12:59+00:00,0.6369,0,128.0
Top 10 ACC basketball players entering 2024-25 season,2024-11-04T22:12:35+00:00,0.2023,0,128.0
