Title,Date,sentiment,target_word_count,cost_of_living
couldn't take chem 203 now i'm crashing out,2024-11-20T06:48:43+00:00,0.0,0,136.0
question about pharmacy,2024-11-20T06:31:20+00:00,0.0,0,136.0
Tree down at ponderosa,2024-11-20T06:04:36+00:00,0.0,0,136.0
How windy is it y'all?,2024-11-20T05:08:08+00:00,0.0,0,136.0
To the one who used ICICS toilet but don't flush and closed the lid,2024-11-20T04:51:09+00:00,0.0,0,136.0
Blue cross portal working!,2024-11-20T05:59:10+00:00,0.0,0,136.0
Funny profs appreciation,2024-11-20T05:58:06+00:00,0.7351,0,136.0
"Windy night, will we lose power?",2024-11-20T03:33:15+00:00,-0.4019,0,136.0
When are Scholarships are given to Students that received an offer?,2024-11-20T03:45:37+00:00,0.0,0,136.0
Friend never contribute in group project,2024-11-20T03:43:20+00:00,0.4939,1,136.0
Can you apply to UBC more than once?,2024-11-20T03:29:08+00:00,0.0,0,136.0
Eosc 116 Final exam with Louise Longbridge,2024-11-20T03:06:45+00:00,0.0,1,136.0
Can I withdraw my elective course after deadline,2024-11-20T01:55:34+00:00,0.0,1,136.0
Question relating to Financial Aid Disbursement due to early completion?,2024-11-20T02:10:06+00:00,0.0,0,136.0
Lights at Lee Square Cancelled 😭,2024-11-20T01:21:32+00:00,-0.25,0,136.0
MATH 220 techniques,2024-11-19T22:58:03+00:00,0.0,0,136.0
No idea what to do about issue with CPSC 110 midterm 2 and need help,2024-11-19T21:48:34+00:00,-0.296,1,136.0
What were the loud sirens going off outside Vanier today??,2024-11-19T14:10:02+00:00,0.0,0,136.0
too late to reach out to supervisors,2024-11-19T20:18:25+00:00,0.0258,0,136.0
Can someone motivate me to study for math 100 midterm,2024-11-19T23:32:14+00:00,0.3818,1,136.0
Noise Cancelling Headphone Recommendation,2024-11-19T23:51:01+00:00,-0.2023,0,136.0
econ 101 final with chapple,2024-11-19T23:30:30+00:00,0.0,1,136.0
why do i have no will to study biol200,2024-11-19T23:10:13+00:00,-0.296,0,136.0
LIFE building locked in the morning,2024-11-19T21:23:12+00:00,0.0,0,136.0
Workday says I Failed a class even though I have email confirmation from my prof saying I passed with an A,2024-11-19T21:15:05+00:00,-0.5106,0,136.0
How am I studying wrong,2024-11-19T20:22:16+00:00,-0.4767,0,136.0
Chem 233 online lectures,2024-11-19T19:40:49+00:00,0.0,0,136.0
Go Global Exchange Application Personal Statement,2024-11-19T07:47:56+00:00,0.0,0,136.0
Psyc Ra post graduation,2024-11-19T19:05:12+00:00,0.0,0,136.0
Cyclone Coming??,2024-11-19T18:24:26+00:00,0.0,0,136.0
I NEED MORE SNOWWWWW!!!!! ❄️☃️,2024-11-19T17:28:06+00:00,0.0,0,136.0
"Bruhhh gotta buy Legion 5i pro or alien ware with i7 14th gen and RTX 4060 or above, with display 100% dci-p3, 240hz+,,,, frickinnn asappppppp!!!!!!!!!broke rnn!!! Help me outtt!!!🙂‍↔️🙂‍↔️🙂‍↔️bois gotta help me out fr!!!!",2024-11-19T11:22:39+00:00,0.0,0,136.0
Probability of receiving an offer for one bedroom,2024-11-19T10:23:07+00:00,0.0,0,136.0
Starbucks cups and tumblers,2024-11-19T07:00:46+00:00,0.0,0,136.0
ITS SNOWWWWWINGGGGGGGG!!!!❄️☃️,2024-11-19T08:29:28+00:00,0.0,0,136.0
ITS SNOWINGGGG❄️,2024-11-19T08:02:50+00:00,0.0,0,136.0
Summer internships / jobs search,2024-11-19T06:27:10+00:00,0.0,0,136.0
Anyone else absolutely garunteed to miss at least 1 online quiz a semester and just tank 5%?,2024-11-18T20:50:43+00:00,-0.2177,0,136.0
UBC stoners/weed enthusiasts,2024-11-18T22:19:03+00:00,0.34,0,136.0
friend won't take their stuff back,2024-11-19T05:09:18+00:00,0.4939,0,136.0
How many of you give money to your parents?,2024-11-19T00:49:43+00:00,0.0,0,136.0
Is there anywhere on campus to buy cigarettes?,2024-11-19T04:19:43+00:00,0.0,0,136.0
Nest overpriced?,2024-11-19T04:33:45+00:00,0.0,0,136.0
UBC stoners/weed enthusiasts,2024-11-19T04:30:35+00:00,0.34,0,136.0
What is happening in nest these days?,2024-11-19T04:22:47+00:00,0.0,0,136.0
CPSC 210 Midterm 4 - wtf was that bug lol,2024-11-19T04:03:35+00:00,-0.25,1,136.0
about to fail a course,2024-11-19T03:10:58+00:00,-0.5423,0,136.0
Exploring the Impact of Contraceptive Use on Female Sexual Fantasies (18+),2024-11-19T03:14:43+00:00,0.0,0,136.0
Nest smells like poo,2024-11-19T02:59:09+00:00,0.3612,0,136.0
Applications open for nwHacks 2025,2024-11-19T02:42:31+00:00,0.0,0,136.0
Where can I see a doctor without 6 hour wait times?,2024-11-19T02:37:14+00:00,0.0,0,136.0
Residence damange...,2024-11-19T02:32:08+00:00,0.0,0,136.0
Is it just me or others also get scared when they hear elevator snaps ??,2024-11-19T00:52:17+00:00,-0.504,0,136.0
Stats 3 0 6 MT !!!,2024-11-19T00:47:03+00:00,0.0,0,136.0
Firetrucks outside Brock Commons?,2024-11-19T00:45:45+00:00,0.0,0,136.0
Anyone tried smoking weed or drinking before an exam,2024-11-19T00:24:15+00:00,0.0,1,136.0
Chemistry 233 exam timing,2024-11-18T23:47:50+00:00,0.0,1,136.0
Calories in blue chip?,2024-11-18T23:45:27+00:00,0.0,0,136.0
Intramural badminton & volleyball,2024-11-18T22:28:45+00:00,0.0,0,136.0
Intramural badminton & volleyball,2024-11-18T22:28:35+00:00,0.0,0,136.0
university experience between different generations,2024-11-18T22:18:01+00:00,0.0,0,136.0
"Chem 233 individual + group - 62%, individual 58% 💀",2024-11-18T22:06:23+00:00,0.0,0,136.0
Where can I get soup on campus,2024-11-18T20:01:21+00:00,0.0,0,136.0
I feel old lol,2024-11-18T17:11:00+00:00,0.4215,0,136.0
Can you see Dean’s List designation on Workday?,2024-11-18T16:36:00+00:00,0.0,0,136.0
Are you allowed to leave a Worklearn position after first semester?,2024-11-18T16:30:41+00:00,-0.0516,0,136.0
wrapping up the Anders kraal debate,2024-11-18T08:05:41+00:00,0.0,0,136.0
First Snowfall of the Season,2024-11-18T07:45:52+00:00,0.0,0,136.0
The UBC Sociology Students’ Association is having their annual Share Sociology event tomorrow!,2024-11-18T04:26:50+00:00,0.3595,0,136.0
Suspected illegal Sublessee who is a pain to live with. Should I report this?,2024-11-18T03:59:47+00:00,-0.8316,1,136.0
confused about graduation portraits,2024-11-17T21:35:52+00:00,-0.3182,0,136.0
What to do between moving out and flying?,2024-11-17T23:03:55+00:00,0.0,0,136.0
Scooter dom is weird right?,2024-11-18T03:00:21+00:00,-0.1779,0,136.0
Does UBCL2 not work on Dominos anymore?,2024-11-18T02:58:06+00:00,0.0,0,136.0
fight in the nest,2024-11-17T22:50:45+00:00,-0.3818,0,136.0
"Switching faculty, which advising should i go to?",2024-11-17T20:14:58+00:00,0.0,0,136.0
New Grads of English Lit - what are your jobs/salaries?,2024-11-17T15:56:54+00:00,0.0,0,136.0
35.5 hours left from CPSC 418 MT2,2024-11-17T09:24:50+00:00,0.0,0,136.0
FR: emotional damaged and urgent for help,2024-11-17T10:14:33+00:00,-0.128,0,136.0
chem lab final 😭🙏,2024-11-17T06:05:28+00:00,0.0,1,136.0
Location of Biochemistry and Chemistry class of 2020 composites?,2024-11-17T05:56:43+00:00,0.0,0,136.0
Open Kitchen Health Violation (?),2024-11-17T03:33:05+00:00,-0.4939,0,136.0
Which one are you?,2024-11-17T02:53:45+00:00,0.0,0,136.0
First Year Eng Rant,2024-11-17T00:48:06+00:00,-0.34,0,136.0
Visited UBC again after 5 years and found the experience so funny,2024-11-16T22:51:31+00:00,0.5777,0,136.0
How to see a sleep specialist,2024-11-16T22:28:13+00:00,0.0,0,136.0
UBC Planetary Health Club First Event!!,2024-11-16T21:35:16+00:00,0.0,0,136.0
Looking for ppl to drive up to Whistler with for ski season,2024-11-16T19:16:31+00:00,0.0,0,136.0
Library open times on weekends,2024-11-16T04:08:03+00:00,0.0,0,136.0
Being in a class that has a high avg is nothing to boast about and its not cool? QUESTION MARK? Need help solving,2024-11-16T04:02:21+00:00,0.2018,0,136.0
Why is makers market so cute ?,2024-11-17T02:00:35+00:00,0.5949,0,136.0
Clive MIDTERM 2 Results,2024-11-17T01:24:27+00:00,0.0,1,136.0
About the cube ubc cs,2024-11-16T16:26:58+00:00,0.0,0,136.0
recreational volleyball,2024-11-16T17:22:57+00:00,0.0,0,136.0
what constitutes asking a prof for a letter of recommendation?,2024-11-16T17:54:14+00:00,0.0,0,136.0
"Organic Chemistry Course Outlines? (2013, 2014, 2022)",2024-11-16T17:17:20+00:00,0.0,0,136.0
REMINDER: It's time to renew your U-Pass! [November 2024],2024-11-16T17:00:22+00:00,0.0,0,136.0
I despise my roomate,2024-11-16T07:16:41+00:00,-0.34,0,136.0
What’s the fastest and most optimal way to get diagnosed for a mental health issue like anxiety?,2024-11-15T23:28:45+00:00,0.5563,1,136.0
What is that damn beeping noise near my room,2024-11-16T02:57:21+00:00,-0.4019,0,136.0
Econ 102 midterm 2,2024-11-16T02:39:42+00:00,0.0,1,136.0
UBC project management online?,2024-11-16T02:14:49+00:00,0.0,1,136.0
Econ102 midterm,2024-11-16T02:08:39+00:00,0.0,1,136.0
GATEMAN ECON EXAM?,2024-11-16T02:08:35+00:00,0.0,1,136.0
I despise 49 with the burning passion of a billion suns,2024-11-16T01:59:15+00:00,0.1531,0,136.0
how do we calculate CGPA with workday??,2024-11-16T01:46:23+00:00,0.0,0,136.0
CNPS For Arts credits?,2024-11-16T01:42:26+00:00,0.3612,0,136.0
MICB 302 Midterm,2024-11-16T00:41:10+00:00,0.0,1,136.0
Are Flex Dollars frequently used?,2024-11-16T00:14:42+00:00,0.0,0,136.0
One class city?,2024-11-15T23:40:37+00:00,0.0,0,136.0
Chat how do we feel about biol 155 midterm results,2024-11-15T23:20:13+00:00,0.0,1,136.0
"Skipped classes due to poor mental health, how much is too much?",2024-11-15T23:07:40+00:00,-0.4767,0,136.0
UBC to replace Workday with new system of record ‘Itdoesn’twork day’,2024-11-15T23:01:15+00:00,0.0,0,136.0
Anyone received email abt MATH100 meeting?,2024-11-15T22:29:16+00:00,0.0,0,136.0
I thought we have the whole week off??!??!???!!!,2024-11-15T19:13:16+00:00,0.0,0,136.0
Question about ams health insurance coverage,2024-11-15T20:46:47+00:00,0.0,0,136.0
Have you ever clicked the wrong option in a quiz and realized it after submission,2024-11-15T21:23:32+00:00,-0.4767,0,136.0
Who’s the homeless guy on 4th floor IKB,2024-11-15T20:25:17+00:00,0.0,0,136.0
Where on campus has the best and most bang for buck chicken tenders,2024-11-15T19:22:04+00:00,0.7003,0,136.0
Chem 233 MT 2 avg around 61% 💀,2024-11-15T18:42:01+00:00,0.0,0,136.0
U-pass exemption for term 2,2024-11-15T17:26:25+00:00,0.0,0,136.0
apparently UBC grads are employable... so they say,2024-11-15T03:17:41+00:00,0.0,0,136.0
Application Service Center,2024-11-15T07:15:44+00:00,0.0,0,136.0
Almost 3 months into the semester with 0 friends,2024-11-15T10:08:55+00:00,0.4767,0,136.0
Where the bursaries at??,2024-11-15T16:11:01+00:00,0.0,0,136.0
Does Browns Crafthouse do chicken tenders?,2024-11-15T14:03:22+00:00,0.1531,0,136.0
Tips on relearning discrete math.,2024-11-15T08:59:07+00:00,0.0,0,136.0
Gifting Ideas for non-faculty mentors,2024-11-15T08:17:13+00:00,0.0,0,136.0
Econ 101 Midterm 2 Gateman,2024-11-15T07:15:18+00:00,0.0,1,136.0
New ECE Building,2024-11-15T07:12:12+00:00,0.0,0,136.0
Spring Graduation Schedule?,2024-11-15T03:01:24+00:00,0.0,0,136.0
Chem 121 how should I study for mt2?,2024-11-15T02:59:47+00:00,0.0,0,136.0
Cute barista(?) at Blue Chip,2024-11-15T02:53:29+00:00,0.4588,0,136.0
DSCI 310 vs CPSC 368,2024-11-15T02:50:30+00:00,0.0,0,136.0
Best/busiest bars for UBC students?,2024-11-14T23:45:15+00:00,0.0,0,136.0
"Do you ask for someone's phone number, Instagram, or Linkedin based on what kind of relationship you want to have with them?",2024-11-14T22:34:43+00:00,0.1531,0,136.0
making friends here is so hard,2024-11-14T21:58:57+00:00,0.3035,0,136.0
Call for students: ASTU 400G - GONZO CINEMA,2024-11-14T19:36:57+00:00,0.0,0,136.0
Help! Paid Extra Ticket Fall 2024 Graduation,2024-11-14T19:25:40+00:00,0.0,0,136.0
anyone in crwr 213?,2024-11-14T17:20:25+00:00,0.0,0,136.0
[Academic] Research Study: Eating Habits and Social Behaviours (Canadian Residents 18+),2024-11-14T15:46:20+00:00,0.0,0,136.0
[Academic] Research Study: Eating Habits and Social Behaviours (Canadian Residents 18+),2024-11-15T01:08:44+00:00,0.0,0,136.0
How to get research experience with low gpa?,2024-11-15T00:47:34+00:00,-0.2732,0,136.0
what’s that alarm sound at the nest rn,2024-11-15T00:07:21+00:00,-0.34,0,136.0
Who pulled the alarm at the nest,2024-11-15T00:07:17+00:00,-0.34,0,136.0
"Multiple UBC Campus Security & 3 University RCMP cars (including supervisor), & an ambulance… still at Marine Drive residence",2024-11-14T23:15:49+00:00,0.34,0,136.0
CHEM 121 lab final prep?????,2024-11-14T20:40:48+00:00,0.0,1,136.0
Best way to support Makers in makermarket,2024-11-14T20:02:52+00:00,0.7845,0,136.0
Fire at LSK building?,2024-11-14T19:10:08+00:00,-0.34,0,136.0
Giant Tiger - is it possible I was dreaming?,2024-11-14T14:47:02+00:00,0.0,0,136.0
Scooter Stolen outside The Nest,2024-11-14T09:33:49+00:00,-0.4939,0,136.0
What's the ideal major to date,2024-11-14T07:22:48+00:00,0.5267,0,136.0
Just found out about the GPA requirements in order to become an RA?,2024-11-14T07:14:59+00:00,0.0,0,136.0
Switching Faculties,2024-11-14T03:44:56+00:00,0.0,0,136.0
How is everyone's coop job search going?,2024-11-14T03:39:33+00:00,0.0,0,136.0
PSA: Reading break is for READING,2024-11-13T21:36:38+00:00,0.0,0,136.0
co-working clubs?,2024-11-14T01:17:31+00:00,0.0,0,136.0
CNPS 365 (Intro to counselling theories) Final exam,2024-11-14T01:11:36+00:00,0.0,1,136.0
whats a major u would never date,2024-11-14T00:35:57+00:00,0.0,0,136.0
"Did not get paid for work, is it because I didn't have direct deposit banking information set up on workday?",2024-11-13T22:36:28+00:00,0.0,0,136.0
reading break felt like 1 minute,2024-11-13T21:51:05+00:00,0.3612,0,136.0
are there any sample go global essays i can look at?,2024-11-13T21:13:01+00:00,0.0,1,136.0
Burnt out even on break,2024-11-13T21:09:20+00:00,-0.3246,0,136.0
PS5 Rental Request,2024-11-13T20:02:57+00:00,0.0,0,136.0
post daylight savings uni depression,2024-11-13T16:44:16+00:00,-0.5719,0,136.0
Happy Last Day of Midterm Break 🤓✨🎉,2024-11-13T17:36:12+00:00,0.5719,1,136.0
When do they turn the dorm heaters on?,2024-11-13T16:14:48+00:00,0.0,0,136.0
Can MLIS graduates at UBC find a DS/DA job?,2024-11-13T09:30:36+00:00,0.0,0,136.0
master of education in counselling psych,2024-11-12T17:19:38+00:00,0.0,0,136.0
Confused Sauder Student,2024-11-12T22:36:50+00:00,-0.3182,0,136.0
UBC does not care about its students,2024-11-12T22:38:08+00:00,-0.3875,0,136.0
"Open House Invitation (Nov 19, 2024) - MSc in Occupational and Environmental Hygiene",2024-11-13T00:19:15+00:00,0.0,0,136.0
Twitter API Access,2024-11-13T02:25:07+00:00,0.0,0,136.0
PHIL120 struggles,2024-11-13T05:11:28+00:00,-0.3612,0,136.0
The Kraal Anomaly,2024-11-13T04:14:17+00:00,0.0,0,136.0
Decent Japanese food on Campus?,2024-11-13T02:48:35+00:00,0.0,0,136.0
Cheers to an unproductive reading break 🥂🥰,2024-11-13T02:46:52+00:00,0.4767,0,136.0
worst food on campus?,2024-11-13T02:04:33+00:00,-0.6249,0,136.0
is there anywhere with rootbeer floats on campus,2024-11-13T00:39:37+00:00,0.0,0,136.0
cs program crisis,2024-11-12T21:32:57+00:00,-0.6249,0,136.0
Phil120 help/tutor,2024-11-12T21:02:16+00:00,0.0,0,136.0
Can I still take science courses if I major in computer engineering at UBC?,2024-11-12T18:34:03+00:00,0.0,0,136.0
Arts Co-op Questions,2024-11-12T18:13:25+00:00,0.0,0,136.0
How’s English program at UBC,2024-11-12T16:26:15+00:00,0.0,0,136.0
COMM 100 How is it?,2024-11-12T06:37:59+00:00,0.0,0,136.0
💪Let's get through this💪,2024-11-12T06:07:12+00:00,0.0,0,136.0
How to Learn 253?,2024-11-12T03:19:02+00:00,0.0,0,136.0
Smoke away from buildings please,2024-11-12T03:36:30+00:00,0.3182,0,136.0
HARVEST actively SCAMS its customers — don’t shop there unless you want to pay for something you didn’t buy,2024-11-12T00:05:17+00:00,-0.516,0,136.0
Anyone volunteered for UBC Tax clinic previously?,2024-11-11T23:58:21+00:00,0.0,0,136.0
Math 307 Midterm Prep,2024-11-11T23:50:56+00:00,0.0,1,136.0
Joining clubs as an exchange student 🥺,2024-11-11T23:13:03+00:00,0.0,0,136.0
Is Arts Advising Open during Reading Week?,2024-11-11T21:56:35+00:00,0.0,0,136.0
is ubc more academically rigorous than other top 50 schools?,2024-11-11T21:25:28+00:00,-0.1477,0,136.0
Questions about 300 level CHEM courses and a BIOL lab,2024-11-11T19:45:02+00:00,0.0,0,136.0
Lest We Forget.,2024-11-11T19:13:08+00:00,-0.2263,0,136.0
Quick Q about courses,2024-11-11T18:49:22+00:00,0.0,0,136.0
How to make friends,2024-11-11T09:24:37+00:00,0.4767,0,136.0
Is UBC a fun place to study?,2024-11-11T10:56:01+00:00,0.5106,0,136.0
HELP!! Forgot to submit iPEER,2024-11-11T11:24:19+00:00,0.0,0,136.0
Any experiences working at the Browns on campus???,2024-11-11T17:29:56+00:00,0.0,0,136.0
Question - Course Auditing opportunities,2024-11-11T16:31:19+00:00,0.3818,0,136.0
What mattresses do they use in exchange 1 bedroom apartments?,2024-11-11T15:01:15+00:00,0.0,0,136.0
fuck midterm break assignments,2024-11-11T13:26:40+00:00,-0.5423,1,136.0
Is UBC too studious or does it have a party side?,2024-11-11T11:24:53+00:00,0.4019,0,136.0
UBC people are so hot and have such good fashion taste,2024-11-11T11:02:05+00:00,0.4404,0,136.0
is ubcsecure still not working for y’all or is it just me?,2024-11-11T10:25:20+00:00,0.0,0,136.0
Introvert girl looking for Friends from Hong Kong,2024-11-11T08:19:05+00:00,0.4767,0,136.0
English 110 in summer,2024-11-11T08:08:10+00:00,0.0,0,136.0
Advice for getting research opportunities,2024-11-11T07:03:01+00:00,0.3818,0,136.0
Go Global Requirement Question,2024-11-11T05:59:49+00:00,0.0,0,136.0
Places to stay near UBC?,2024-11-11T05:51:13+00:00,0.0,0,136.0
is there a faculty-specific reception for fall graduates?,2024-11-11T04:20:43+00:00,0.0,0,136.0
Workday wouldn’t let me log in,2024-11-10T23:53:57+00:00,0.0,0,136.0
UBC has been absolutely dreadful for my mental health as a first term transfer student. Need advice or wisdom,2024-11-10T21:41:51+00:00,0.0534,0,136.0
Just wondering if anyone is going to today’s party at Levels..?,2024-11-10T20:35:56+00:00,0.4019,0,136.0
How’s UBC counselling?,2024-11-10T18:45:32+00:00,0.0,0,136.0
does grocery checkout in the nest sell flour?,2024-11-10T08:04:47+00:00,0.0,0,136.0
Ask for New Year Best Place,2024-11-10T05:21:26+00:00,0.6369,0,136.0
tarot cards and readings,2024-11-11T03:30:57+00:00,0.0,0,136.0
CPSC110 - how generous are the course team when it comes to regrading?,2024-11-11T03:20:40+00:00,0.5106,0,136.0
What is up with the cardboard chair scaling?? (APSC 100),2024-11-10T20:30:40+00:00,0.0,0,136.0
How do you all check if rentals are scams or not?,2024-11-10T22:07:54+00:00,-0.5859,0,136.0
bird coop gym worth it?,2024-11-10T07:05:53+00:00,0.2263,0,136.0
Followed by a old man,2024-11-10T06:26:31+00:00,0.0,0,136.0
Am I cooked? Cause my pork dumpling wasn't...,2024-11-10T00:11:50+00:00,-0.5859,0,136.0
Rotisserie Chicken?,2024-11-09T23:01:50+00:00,0.0,0,136.0
Typo on cpsc 110 mt2 completely screwed me. Can anything be done?,2024-11-09T23:00:00+00:00,-0.5413,0,136.0
Why are the squirrels so weird (wrong answers only),2024-11-09T22:56:55+00:00,-0.6828,0,136.0
Can I use UBCO student meal plan at UBCV?,2024-11-09T21:43:28+00:00,0.0,0,136.0
Friendly Support,2024-11-09T21:38:06+00:00,0.7096,0,136.0
Favorite memory at UBC?,2024-11-09T20:20:32+00:00,0.4588,0,136.0
Where can I buy onigiri near campus?,2024-11-09T18:08:05+00:00,0.0,0,136.0
Is wifi done?....,2024-11-09T17:27:51+00:00,0.0,0,136.0
Is there a fire alarm going off rn?,2024-11-09T15:43:52+00:00,-0.5859,0,136.0
"Paid Health & Dental fee, but Pacific Blue Cross says I have no coverage?",2024-11-09T15:07:45+00:00,-0.4215,0,136.0
Can someone explain to me like I’m 5 how to find the exam schedule?,2024-11-09T11:38:45+00:00,0.3612,1,136.0
Has anyone gotten phone calls from UBC from the number 236-246-5657,2024-11-09T09:48:23+00:00,0.0772,0,136.0
any good hair salons for girls?,2024-11-09T05:58:46+00:00,0.4404,0,136.0
Fair Pharmacare Registration,2024-11-09T05:46:10+00:00,0.3182,0,136.0
ubc played all of us,2024-11-09T05:02:41+00:00,0.34,0,136.0
Longshot: Does anyone on campus have SR920SW batteries,2024-11-09T04:15:52+00:00,0.0,0,136.0
this is your reminder to eat something today,2024-11-09T04:07:00+00:00,0.0,0,136.0
Any computers on campus have Unreal Engine?,2024-11-08T19:37:59+00:00,0.0,0,136.0
Question about Insurance (Can I get a better deal?),2024-11-09T00:44:26+00:00,0.4404,0,136.0
People who use tote bags or messenger bags,2024-11-09T00:37:24+00:00,0.0,0,136.0
chat gpt down? AAAA,2024-11-09T00:32:12+00:00,0.0,0,136.0
i need help idk how to ask,2024-11-09T00:32:08+00:00,-0.1027,0,136.0
seeing scooter dom around,2024-11-08T23:30:35+00:00,0.0,0,136.0
Courses to take at the graduate level in gender studies,2024-11-08T22:59:30+00:00,0.0,0,136.0
Do UBCO flex dollars work at UBC,2024-11-08T22:46:54+00:00,0.0,0,136.0
How many people can watch you grad (in person)?,2024-11-08T22:25:57+00:00,0.0,0,136.0
How to schedule emails with the UBC email?,2024-11-08T19:44:55+00:00,0.0,0,136.0
Women rights class suggestions,2024-11-08T19:07:44+00:00,0.0,0,136.0
Dining Hall Rules,2024-11-08T18:12:04+00:00,0.0,0,136.0
I’m unsure how to find a advisor for masters in stats,2024-11-08T18:31:34+00:00,-0.25,0,136.0
F on my transcript what should I do?,2024-11-07T22:18:35+00:00,0.0,0,136.0
Free bad advice,2024-11-08T18:41:06+00:00,-0.0516,0,136.0
UBC Counselling Psychology MA/MEd: What’s your experience?,2024-11-08T18:05:55+00:00,0.0,0,136.0
UBC Event: Woodland Harvest Dinner ✨🌱,2024-11-08T16:40:31+00:00,0.0,0,136.0
AI and misinformation club on campus?,2024-11-08T16:53:40+00:00,-0.3182,0,136.0
I'm literally failing right now!?,2024-11-08T15:46:16+00:00,-0.5562,0,136.0
Whats your experience skateboarding/scootering on campus,2024-11-08T11:32:52+00:00,0.0,0,136.0
When are summer session courses released?,2024-11-08T10:14:09+00:00,0.0,0,136.0
Things to do at UBC before I graduate in May,2024-11-08T07:37:42+00:00,0.0,0,136.0
"Grandmother Just Passed, Midterm Tomorrow",2024-11-08T07:18:53+00:00,0.0,1,136.0
Studentcare Blackout Period,2024-11-08T07:14:24+00:00,0.0,0,136.0
CHEM 233 Midterm 2,2024-11-08T06:52:05+00:00,0.0,1,136.0
CHEM 233 Midterm,2024-11-08T06:00:56+00:00,0.0,1,136.0
AAAAAAAAAAAAAAAAAAAAAAA,2024-11-08T04:44:51+00:00,0.0,0,136.0
CPSC 110 Midterm 2,2024-11-08T04:18:05+00:00,0.0,1,136.0
There are a lot of bad bitches roaming campus,2024-11-08T02:49:11+00:00,-0.8126,0,136.0
psyc 460 exam 2,2024-11-08T02:48:53+00:00,0.0,1,136.0
Withdraw from 6 credits course after finishing first final,2024-11-08T01:55:05+00:00,0.3612,1,136.0
Average Part Time Job Compensation?,2024-11-08T01:48:06+00:00,0.0,0,136.0
Suggestions for electives for a polisci major wanting to go to law school,2024-11-08T01:38:01+00:00,0.0,0,136.0
BC Achievement Scholarship anyone??,2024-11-08T00:42:24+00:00,0.0,0,136.0
"If you work at Koerner Library or at some other UBC library, could you please tell me how difficult it was to pass your interview? What questions were you asked? Were those regular job interview questions or something tricky? My potential position is related to circulation and information service.",2024-11-07T23:32:11+00:00,-0.327,0,136.0
Failing CPSC 110 midterm 2 with 35% weightage,2024-11-07T23:26:24+00:00,-0.5106,1,136.0
Why Tf do we get graded on homework,2024-11-07T23:25:58+00:00,0.0,0,136.0
did you have problems opting in to the AMS student benefits plan?,2024-11-07T23:14:04+00:00,-0.0258,0,136.0
Where do I find all the parties? What’s the best way to quickly make lots of friends at UBC?,2024-11-07T19:49:02+00:00,0.885,0,136.0
When your backpack studies harder than you,2024-11-07T22:12:08+00:00,0.0,0,136.0
What do international students do over Christmas break?,2024-11-07T18:53:21+00:00,0.0,0,136.0
Skiing on campus today!!,2024-11-07T18:39:50+00:00,0.0,0,136.0
Workday waitlist question,2024-11-07T18:21:31+00:00,0.0,0,136.0
How many of us actually came to UBC for the research?,2024-11-07T18:00:36+00:00,0.0,0,136.0
brown coat guy at bus loop,2024-11-07T16:47:37+00:00,0.0,0,136.0
How is UBC's current Film BFA?,2024-11-07T16:02:50+00:00,0.0,0,136.0
Did I Delete Someones Post? (w/ reply!),2024-11-07T05:18:03+00:00,0.0,0,136.0
Come join my d&d game!,2024-11-07T00:37:39+00:00,0.3595,0,136.0
Feeling depressed about the election results. Feels like we went backwards… Just was really strssed and anxious today sigh.,2024-11-07T07:25:06+00:00,-0.3535,0,136.0
How to visit a hospital,2024-11-07T06:58:01+00:00,0.0,0,136.0
Why is there such a stigma around being right wing?,2024-11-07T06:47:41+00:00,0.0,0,136.0
Camcorder Digitization,2024-11-07T06:15:45+00:00,0.0,0,136.0
How's everyone's outlook on the future?,2024-11-07T06:03:02+00:00,0.0,0,136.0
How to stay logged in PD Portal,2024-11-07T05:47:23+00:00,0.0,0,136.0
fairview weird noise,2024-11-07T04:58:05+00:00,-0.1779,0,136.0
Where to learn more about PhD programs?,2024-11-07T04:52:26+00:00,0.0,0,136.0
Alumni transcript order portal doesn't work...?,2024-11-07T04:01:00+00:00,0.0,0,136.0
Did anyone else get this CFA email? Is it a scam? I didnt get this email last year,2024-11-06T21:08:35+00:00,-0.6199,0,136.0
How has education become liberal?,2024-11-07T00:15:55+00:00,0.0,0,136.0
Why first year chem almost feel like physics?,2024-11-07T01:48:07+00:00,0.3008,0,136.0
Sociology courses,2024-11-07T02:09:57+00:00,0.0,0,136.0
Calculus in Accounting?,2024-11-06T22:59:17+00:00,0.0,0,136.0
HSP Studies for credits that's an Online Study?,2024-11-06T22:58:12+00:00,0.3612,0,136.0
Any Manga/Manhwa recommendations for the reading break?,2024-11-06T22:08:52+00:00,0.0,0,136.0
Which students fall under GSS?,2024-11-06T21:52:21+00:00,0.0,0,136.0
Drop out class with a W after the deadlines,2024-11-06T21:43:32+00:00,-0.2732,1,136.0
can i get reimbursed for therapy if my therapist is not in canada?,2024-11-06T21:06:42+00:00,0.0,0,136.0
Thrive by fire- happening rn till 2pm,2024-11-06T20:51:26+00:00,-0.34,0,136.0
Engl 110 final exam Stephen guy bray,2024-11-06T20:36:27+00:00,0.0,1,136.0
Where to get a poppy on campus?,2024-11-06T18:22:47+00:00,0.0,0,136.0
Is it weird to ask a professor if I’ll be ta’ing again next term?,2024-11-06T18:14:56+00:00,-0.1779,0,136.0
UBC Psych Program,2024-11-06T18:12:40+00:00,0.0,0,136.0
