Title,Date,sentiment,target_word_count,cost_of_living
Tallwood fire alarm,2024-12-03T08:23:05+00:00,-0.5859,0,136.0
wondering which way my MD room faces,2024-12-03T07:57:20+00:00,0.0,0,136.0
How is the Chem 233 Final,2024-12-03T05:58:28+00:00,0.0,1,136.0
The parking cost has been increased,2024-12-03T04:41:39+00:00,0.2732,0,136.0
im about to fail my phys 131 final im so cooked help me,2024-12-03T04:59:11+00:00,-0.871,1,136.0
Year-round housing - transitioning from undergrad to graduate student,2024-12-03T03:40:14+00:00,0.0,0,136.0
Finals while terminal parent is sick,2024-12-03T03:12:01+00:00,-0.5106,1,136.0
Was micb 211 difficult this year?,2024-12-03T02:57:41+00:00,-0.3612,0,136.0
gateman econ101 finals,2024-12-03T02:49:23+00:00,0.0,1,136.0
Feeling Overwhelmed by CPSC 110 Material and Looking for Advice,2024-12-03T02:16:50+00:00,0.1779,0,136.0
grieving… not sure what to do.,2024-12-03T01:38:12+00:00,-0.2411,0,136.0
Let out all your group assignment frustrations here,2024-12-03T01:07:51+00:00,-0.4588,1,136.0
Can people fit through the windows in Totem Park res,2024-12-03T00:31:23+00:00,0.3612,0,136.0
BC achievement Scholarship,2024-12-03T00:07:04+00:00,0.0,0,136.0
Too late for CFA? Any Advice?,2024-12-02T23:38:36+00:00,0.0,0,136.0
Is there a hiking club at UBC?,2024-12-02T23:04:38+00:00,0.0,0,136.0
never been able to book ikb study rooms,2024-12-02T22:39:34+00:00,0.0,0,136.0
Israel Booth In the Nest,2024-12-02T22:26:16+00:00,0.0,0,136.0
High Blood Pressure,2024-12-02T21:57:58+00:00,-0.296,0,136.0
Donation in Life,2024-12-02T21:39:53+00:00,0.0,0,136.0
nest sensory rooms,2024-12-02T21:26:42+00:00,0.0,0,136.0
Where can I meet some dogs in campus,2024-12-02T21:08:03+00:00,0.0,0,136.0
Colores printer,2024-12-02T21:03:08+00:00,0.0,0,136.0
Does anyone have experience working full-time while studying DAP?,2024-12-02T20:38:22+00:00,0.0,0,136.0
Missed the Second Midterm... Need Help,2024-12-02T19:23:34+00:00,-0.296,1,136.0
A Man Who Supports Terrorism And Sharia Law Is Speaking On Campus Tonight,2024-12-02T18:44:33+00:00,-0.4767,0,136.0
AI usage in class/assignment policies,2024-12-02T17:50:15+00:00,0.0,1,136.0
Annual UBC Tuition Hike Event,2024-12-02T14:33:34+00:00,0.0,0,136.0
Is ethical investment possible at UBC,2024-12-02T13:22:02+00:00,0.5106,0,136.0
LF Fellow Pinoys or Exchange Students,2024-12-02T11:36:35+00:00,0.0,0,136.0
FNH 313? How are yall feeling,2024-12-01T17:07:48+00:00,0.128,0,136.0
PharmD 2025W Discord,2024-12-01T19:06:47+00:00,-0.4019,0,136.0
New Academic Integrity book features the Math 100 midterm of 2020,2024-12-02T02:29:37+00:00,0.3818,1,136.0
I'm so lost right now,2024-12-02T02:33:20+00:00,-0.3804,0,136.0
ubc student hostel,2024-12-02T06:34:54+00:00,0.0,0,136.0
Does anyone smell something burning?,2024-12-02T09:22:06+00:00,0.0,0,136.0
Lost backpack and jacket,2024-12-02T09:09:17+00:00,-0.3182,0,136.0
Palestinian Rallies Affiliated with Samidoun?,2024-12-02T07:20:38+00:00,0.0,0,136.0
Question: registering for GitHub Education with UBC Card?,2024-12-02T00:41:07+00:00,0.0,0,136.0
Are my chances of being an RA ruined?,2024-12-02T06:17:52+00:00,-0.3182,0,136.0
Finals with medical condition flare up,2024-12-02T05:34:08+00:00,0.0,1,136.0
Is it possible to get a 97 on a final exam?,2024-12-02T05:26:44+00:00,0.0,1,136.0
i just want to sleep for a week straight :(,2024-12-02T05:26:35+00:00,-0.1779,0,136.0
Soci 328 Final Exam,2024-12-02T05:14:29+00:00,0.0,1,136.0
UBCsecure Acting Up?,2024-12-02T04:58:13+00:00,0.0,0,136.0
How do I pay for my MSP Premiums if I don't know my Account Number?,2024-12-02T03:07:38+00:00,-0.0258,0,136.0
Where can I dance,2024-12-02T00:06:34+00:00,0.0,0,136.0
exam hardship schedule,2024-12-01T23:54:30+00:00,-0.3182,1,136.0
Scholarship and Chances of getting into a graduate program.,2024-12-01T23:48:20+00:00,0.2023,0,136.0
PPGA 391 difficulty??,2024-12-01T23:06:40+00:00,-0.4137,0,136.0
Burnout even when I’m caught up,2024-12-01T22:02:41+00:00,0.0,0,136.0
GO OUT IN THE SUN WOOOOOOOOO🥳🤩,2024-12-01T20:50:28+00:00,0.0,0,136.0
CGS-M App Deadline,2024-12-01T20:32:36+00:00,0.0,1,136.0
have grades for sept 2023-april 2024 been posted on ubcgrades yet?,2024-12-01T20:24:18+00:00,0.0,0,136.0
Nothing but a waste of time,2024-12-01T20:22:11+00:00,0.4585,0,136.0
6 years to graduate,2024-12-01T18:16:57+00:00,0.0,0,136.0
learning the entirety of CPSC 421 in the next 9 days,2024-12-01T11:35:31+00:00,0.0,0,136.0
apostille - degree validation,2024-12-01T11:21:57+00:00,0.0,0,136.0
Getting Itchy whilst studying,2024-12-01T09:38:07+00:00,-0.2732,0,136.0
Rushing a Frat in 2nd Year,2024-12-01T08:25:45+00:00,0.0,0,136.0
Taking Time Away From Academics,2024-12-01T07:58:03+00:00,0.0,0,136.0
Deadline to submit graduate school applications?,2024-12-01T06:42:55+00:00,0.0,1,136.0
UBC tour with 13 year old,2024-12-01T05:35:53+00:00,0.0,0,136.0
I made an error on my application,2024-12-01T04:14:10+00:00,-0.4019,0,136.0
Why do Prof's turn off the grade calculator on canvas?,2024-12-01T02:39:11+00:00,0.0,0,136.0
urgent! how to get a doctor for a emergent illness exactly??,2024-12-01T00:08:26+00:00,-0.372,0,136.0
Hey UBC folks! How to find cash-in ATM points in campus? I get a scholarship via international card so withdrawal of cash and cashing it in my Scotia card is much cheaper for me than sending it via SWFT code to my Scotia card.,2024-12-01T00:49:10+00:00,0.1982,0,136.0
"Need urgent response, how to ship to orchard commons?",2024-12-01T00:56:06+00:00,0.2023,0,136.0
Hate towards those specific classes that give endless busy work,2024-12-01T00:45:10+00:00,-0.5719,0,136.0
Has anyone been to UBC downtown campus,2024-12-01T00:14:23+00:00,0.0,0,136.0
Courses for Arts Literature Requirement,2024-11-30T06:39:28+00:00,0.0,0,136.0
Go Global Application help,2024-11-30T21:55:50+00:00,0.0,0,136.0
I'm at my wits end,2024-11-30T13:17:57+00:00,0.0,0,136.0
"Minors with psych???? (not anthro, or soci)",2024-11-30T20:57:31+00:00,0.0,0,136.0
Broke student life,2024-11-30T21:36:56+00:00,-0.4215,0,136.0
Have you ever been asked to show your degree by presenting the official document to employers or do they take your word for it?,2024-11-30T21:49:29+00:00,0.0,0,136.0
Final exam tips,2024-11-30T20:53:52+00:00,0.0,1,136.0
Does UBC like alt people?,2024-11-30T20:49:58+00:00,0.3612,0,136.0
ok but whens the scooterdom lookalike contest,2024-11-30T12:26:42+00:00,0.1531,1,136.0
"""Surrey teen missing since October has been found dead: family""",2024-11-30T07:03:42+00:00,-0.7579,0,136.0
I feel like a failure,2024-11-30T06:38:53+00:00,-0.2023,0,136.0
Don’t be like me,2024-11-30T06:00:05+00:00,0.3612,0,136.0
Update your UPASS,2024-11-30T03:51:18+00:00,0.0,0,136.0
did anyone win INTERNATIONAL SCHOLARS? if so,2024-11-30T03:11:14+00:00,0.5859,0,136.0
Choosing course for Art History Major,2024-11-30T01:43:21+00:00,0.0,0,136.0
How do I get aid or scholarship,2024-11-30T00:32:01+00:00,0.0,0,136.0
Help Finding Vendor from Maker’s Market (Pomegranate Earrings) 💕,2024-11-29T23:01:17+00:00,0.0,0,136.0
I have not studied all semester,2024-11-29T22:45:43+00:00,0.0,0,136.0
Where’s all the tree at?,2024-11-30T04:41:56+00:00,0.0,0,136.0
Didn’t do almost all homework for a class. Is it worth it to reach out to the Prof?,2024-11-30T04:29:25+00:00,0.25,0,136.0
Are iPads really ideal note-taking devices?,2024-11-30T03:10:13+00:00,0.5709,0,136.0
Recreational Volleyball Clubs/Drop-ins,2024-11-30T02:58:01+00:00,0.0,0,136.0
dear god please just let me get hired (science co-op induced depression thread),2024-11-30T01:26:18+00:00,0.3182,0,136.0
MSc to Patent Law,2024-11-30T01:14:56+00:00,0.0,0,136.0
WHY AM I SO MEDIOCRE,2024-11-30T01:05:34+00:00,0.0,0,136.0
Questions About UBC MDS Admissions,2024-11-30T00:47:25+00:00,0.0,0,136.0
one of my registered courses disappeared from my term 2 schedule,2024-11-30T00:43:58+00:00,-0.2263,0,136.0
chem 205 recorded lectures,2024-11-29T23:27:40+00:00,0.0,0,136.0
First year accommodation preferences,2024-11-29T22:22:52+00:00,0.0,0,136.0
Master of Education without Bachelor in Ed?,2024-11-29T22:13:31+00:00,0.0,0,136.0
SUS Withdrawal from Palestine Bake Sale: Are They Really Supporting Student Equity?,2024-11-29T18:02:18+00:00,0.5095,0,136.0
Econ/Poli Sci double major,2024-11-29T22:06:34+00:00,0.0,0,136.0
high protein lunches on campus,2024-11-29T21:23:53+00:00,0.0,0,136.0
Last Week of Uni - how do I make the most of it?,2024-11-29T20:44:45+00:00,0.0,0,136.0
How do you convince your group members that they are wrong even though they think they are right?,2024-11-29T20:41:39+00:00,-0.2732,0,136.0
UBC ACCOMIDATIONS,2024-11-29T20:29:15+00:00,0.0,0,136.0
ubc housing and taking a semester off,2024-11-29T20:18:38+00:00,0.0,0,136.0
"What is a ""good"" and ""bad"" grade?",2024-11-29T08:35:08+00:00,-0.1531,0,136.0
the ventilation fan on the roof of MD6,2024-11-29T08:31:04+00:00,0.3182,0,136.0
is r/ubc considered really active?,2024-11-29T07:32:21+00:00,0.4576,0,136.0
Do profs really care if their students ask a stupid question?,2024-11-29T05:11:06+00:00,0.024,0,136.0
Anyone know a good way to stop light from auto closing when studying in a lecture hall.,2024-11-29T03:41:08+00:00,0.1779,0,136.0
which bio course should I take?,2024-11-29T03:34:11+00:00,0.0,0,136.0
Just failed 2 math 100 midterms.. am I cooked.,2024-11-29T02:41:40+00:00,-0.8176,1,136.0
Anyone successfully get their AMS Opt-out funds refunded?,2024-11-29T01:44:05+00:00,0.4939,0,136.0
IKB 24 hours…when?,2024-11-29T02:14:20+00:00,0.0,0,136.0
worst grade you’ve ever gotten on a final/midterm?,2024-11-29T01:22:43+00:00,-0.6249,1,136.0
Declaring majors and bad grades,2024-11-28T19:04:28+00:00,-0.5423,0,136.0
How many people from each faculty are nominated for the Wesbrook Scholarship?,2024-11-29T00:47:57+00:00,0.0,0,136.0
How many people from each faculty are nominated for the Wesbrook Scholarship?,2024-11-29T00:47:46+00:00,0.0,0,136.0
Professor wants to add a class session during exam period,2024-11-29T00:27:02+00:00,0.0,1,136.0
Jamjar Canteen vs. El Cartel???,2024-11-28T22:04:01+00:00,0.0,0,136.0
Should I even consider Co-op as someone in Arts planning on majoring in CS and Ling?,2024-11-28T22:50:44+00:00,0.0,0,136.0
is it normal to feel so depressed from school?,2024-11-28T22:46:06+00:00,-0.6418,0,136.0
Thunderbird vs Brock commons,2024-11-28T22:05:17+00:00,0.0,0,136.0
Winter Bursary Updates?,2024-11-28T21:33:34+00:00,0.0,0,136.0
Are arts co-op workshops just a waste of time?,2024-11-28T20:49:18+00:00,-0.4215,0,136.0
🔥chem lab🔥🧙🧪help,2024-11-28T19:40:53+00:00,0.0,0,136.0
Math100 meeting,2024-11-28T19:34:57+00:00,0.0,0,136.0
IMP/Med students - disability and/or chronic illness?,2024-11-28T19:25:10+00:00,-0.4019,0,136.0
CMS Coop Rejection,2024-11-28T19:20:06+00:00,-0.5423,0,136.0
Gas Leak in Hebb?,2024-11-28T19:03:54+00:00,-0.34,0,136.0
UBC's highest paid employee makes $1.08 million,2024-11-28T18:56:03+00:00,0.0,0,136.0
Fire light flashing but no alarm?,2024-11-28T07:20:59+00:00,0.2153,0,136.0
Advice on picking programs pls,2024-11-28T07:12:19+00:00,0.3182,0,136.0
Has any alumni ever asked for recommendation letters 2 years after graduation?,2024-11-28T06:49:25+00:00,0.0,0,136.0
How much do you pay to rent a room in 2024?,2024-11-28T16:40:34+00:00,-0.1027,0,136.0
does ikb have iphone chargers,2024-11-28T16:30:19+00:00,0.0,0,136.0
24 hr study spot with desktops?,2024-11-28T13:38:57+00:00,0.0,0,136.0
URO REX update?,2024-11-28T07:56:03+00:00,0.0,0,136.0
is being burnt out and depressed valid grounds for academic concession?,2024-11-28T06:18:47+00:00,-0.6838,0,136.0
Bachelor of design program,2024-11-28T05:32:17+00:00,0.0,0,136.0
"To those who got 95+ on a final, how did you do it?",2024-11-28T05:10:51+00:00,0.0,1,136.0
Having a difficult time making friends,2024-11-28T02:22:14+00:00,0.1531,0,136.0
Chem 121 midterm grade - devastated,2024-11-28T01:58:58+00:00,-0.6124,1,136.0
please don’t neglect personal hygiene,2024-11-28T01:05:51+00:00,-0.1779,0,136.0
cops in life building,2024-11-28T00:25:30+00:00,0.0,0,136.0
Failed both midterms… Am I done for?,2024-11-28T03:32:20+00:00,-0.5106,1,136.0
Can I pass Chem 121??,2024-11-28T02:51:42+00:00,0.0,0,136.0
Eng 110 notes please 🥺,2024-11-28T00:00:10+00:00,0.3182,0,136.0
MSc for International Students,2024-11-27T22:49:19+00:00,0.0,0,136.0
UBC AI Club Tutorial | Level Up Your Coding with AI! 🚀💻,2024-11-27T20:56:26+00:00,0.0,0,136.0
Are Math 221 Lectures usually recorded?,2024-11-27T22:38:08+00:00,0.0,0,136.0
Does student Healthcare cover my dental cost?,2024-11-27T22:34:33+00:00,0.0,0,136.0
Canadian Institute of Greece summer school program,2024-11-27T21:26:22+00:00,0.0,0,136.0
They should make exclusive merch for science scholars,2024-11-27T21:11:42+00:00,0.128,0,136.0
ECON101: Where do I find the solutions to Ragan Microeconomics 17th Edition study exercises?,2024-11-27T20:25:19+00:00,0.1779,0,136.0
Science 'with Distinction',2024-11-27T20:17:27+00:00,0.0,0,136.0
To whoever stole my nutritionbox meal at exchange,2024-11-27T20:01:51+00:00,0.0,0,136.0
Buchanan Bathrooms,2024-11-27T18:17:24+00:00,0.0,0,136.0
what are your experiences in lfs,2024-11-27T18:12:43+00:00,0.0,0,136.0
who do i email for stat 302 waitlist?,2024-11-27T17:45:16+00:00,0.0,0,136.0
Online courses,2024-11-27T16:35:45+00:00,0.0,0,136.0
Whaaaaat was going on last night outside exchange/ gage etc. Singing??,2024-11-27T15:43:24+00:00,0.0,0,136.0
did anyone get caught cheating for cpsc 110 this term,2024-11-27T07:54:05+00:00,-0.5574,0,136.0
"If you need something like a reference letter between now and New Years,, please ask for it today",2024-11-27T09:11:22+00:00,0.5859,0,136.0
Why is there machinery screaming at 1am outside my window,2024-11-27T09:18:12+00:00,-0.3818,0,136.0
How the fuck am I supposed to be happy around here?,2024-11-27T07:23:41+00:00,0.0516,0,136.0
"EOSC 112, EOSC 114, EOSC 116, CONS 127",2024-11-27T08:37:51+00:00,0.0,0,136.0
Biology composite photos,2024-11-27T07:19:06+00:00,0.0,0,136.0
11 month education program?,2024-11-27T06:31:28+00:00,0.0,0,136.0
Missed a required physics course. Can I take it later?,2024-11-27T06:45:27+00:00,-0.296,0,136.0
Office hours at a cafe,2024-11-27T06:54:08+00:00,0.0,0,136.0
guys what is happening down at university blvd in front of the flower shop lots of cop cars i can see it from exchange lol,2024-11-27T05:36:16+00:00,0.4215,0,136.0
"i have an exam on thursday, is this allowed?",2024-11-27T04:42:52+00:00,0.0,1,136.0
Ikb lifts......,2024-11-27T03:52:40+00:00,0.0,0,136.0
ENG 111 Question,2024-11-27T03:16:13+00:00,0.0,0,136.0
I think ubc should do a lookalike contest,2024-11-27T02:29:00+00:00,0.0,1,136.0
Super stressed and need to rant,2024-11-27T00:49:30+00:00,0.0258,0,136.0
Best fries in UBC?,2024-11-27T01:27:23+00:00,0.6369,0,136.0
Why does subway and fresh slice shops always smell so bad ?,2024-11-27T01:01:28+00:00,-0.4924,0,136.0
PSA: Next week will be your last chance to ask out your classroom crush,2024-11-27T00:19:03+00:00,0.1027,0,136.0
MY BATHROOM LIGHT KEEPS TURNING ON BY ITSELF,2024-11-27T00:13:11+00:00,0.0,0,136.0
"Dear UBC, Please maintain your buildings for f*cks sake",2024-11-26T23:50:57+00:00,0.5994,0,136.0
Credits from credit exclusion list on transcript,2024-11-26T23:36:28+00:00,0.4404,0,136.0
roommate help/advice,2024-11-26T22:40:59+00:00,0.0,0,136.0
Are UBC Bursaries coming out yet?,2024-11-26T21:09:23+00:00,0.0,0,136.0
International student health fee but im not international,2024-11-26T18:41:48+00:00,0.0,0,136.0
Participate in a Cannabis and Consciousness Study,2024-11-26T17:11:49+00:00,0.0,0,136.0
"fee waiver for ubc, and their email",2024-11-26T13:35:54+00:00,0.0,0,136.0
Econ102 mt is out! Average is a 27% lol (before curve),2024-11-26T04:21:14+00:00,0.4753,0,136.0
Everyday I go to the gym this happens,2024-11-26T21:25:50+00:00,0.0,0,136.0
Need the Law CANS 2024,2024-11-26T20:54:43+00:00,0.0,0,136.0
Ubyssey Micro-Influencers Survey,2024-11-26T18:31:05+00:00,0.0,0,136.0
Which perfume do you wear?,2024-11-26T18:02:54+00:00,0.0,0,136.0
place to stretch on campus?,2024-11-26T17:43:32+00:00,0.0,0,136.0
Putnam Exam Prep,2024-11-26T16:27:59+00:00,0.0,1,136.0
STRATEGIES FOR UNIVERSITY LIFE (Mainly ACADEMICS): Help needed 🥲🥺,2024-11-26T14:19:45+00:00,0.0,0,136.0
"Biochem majors, why did you chose this major?",2024-11-26T10:03:32+00:00,0.0,0,136.0
"Lost rn, considering transfer options",2024-11-26T06:57:17+00:00,-0.3182,0,136.0
Econ 102 Midterm 2 with gateman,2024-11-26T05:10:26+00:00,0.0,1,136.0
Econ101 gateman midterm 2,2024-11-26T03:57:39+00:00,0.0,1,136.0
Eyes are sore help,2024-11-26T02:40:28+00:00,-0.3612,0,136.0
masters deadline approaching,2024-11-26T01:36:35+00:00,0.0,1,136.0
Engl 110 with Guy-Bray Final?,2024-11-25T22:35:35+00:00,0.0,1,136.0
Biol 204 vs Micb 211,2024-11-26T01:32:39+00:00,0.0,0,136.0
Where to get hot water?,2024-11-25T23:42:53+00:00,0.0,0,136.0
anyone having trouble viewing the final exam schedule?,2024-11-25T22:47:52+00:00,-0.4019,1,136.0
How long did it take your new physical student card to be processed and ready for pick up?,2024-11-25T22:37:13+00:00,0.3612,0,136.0
How much does co-op cost for an international?,2024-11-25T22:30:41+00:00,0.0,0,136.0
Screaming in IKB MMA?,2024-11-25T20:33:06+00:00,-0.3818,0,136.0
Anyone done Hindi Challenge exam,2024-11-25T20:28:27+00:00,0.0772,1,136.0
How to do well for phys200,2024-11-25T21:14:08+00:00,0.2732,0,136.0
need AA battery asap!,2024-11-25T19:57:12+00:00,0.0,0,136.0
Anyone Not Receiving Letters/Packets Due To Canada Post Strike?,2024-11-25T19:34:22+00:00,-0.128,0,136.0
How to do well for neuro!!,2024-11-25T19:31:58+00:00,0.3987,0,136.0
Who's the best prof for PSYC 218?,2024-11-25T18:39:48+00:00,0.6369,0,136.0
Why is UBC cutting the grass every week? It's winter...,2024-11-25T17:40:19+00:00,-0.128,0,136.0
"It’s taking me 4 years to transfer into sauder from arts, this is my story, and I need help.",2024-11-25T05:55:56+00:00,0.0,0,136.0
Appendix 2 Student Aid BC,2024-11-25T05:48:31+00:00,0.0,0,136.0
May 2025 Graduation Info??,2024-11-25T02:24:57+00:00,0.0,0,136.0
CALLING OUT: Anyone affected by the Canada Post strike?,2024-11-25T01:51:45+00:00,-0.2732,0,136.0
Life could be a dream doo do do do sha boo,2024-11-25T00:43:49+00:00,0.25,0,136.0
Whoever keeps smoking darts out a door in Forestry,2024-11-25T19:03:53+00:00,0.0,0,136.0
POV : your neighbor is playing loud music during midnight but u don’t know which neighbor,2024-11-25T09:32:47+00:00,0.1027,0,136.0
Lost wallet 23/11,2024-11-25T03:14:19+00:00,-0.3182,0,136.0
Friend broke his foot,2024-11-25T11:16:29+00:00,0.1027,0,136.0
tallwood renovations,2024-11-25T09:24:55+00:00,0.0,0,136.0
Who else is sick rn,2024-11-25T08:04:24+00:00,-0.5106,0,136.0
Why does ubc have a bitcoin machine?,2024-11-25T06:10:24+00:00,0.0,0,136.0
How much do you guys study per week?,2024-11-25T05:17:50+00:00,0.0,0,136.0
"Failure fuels passion, stories and success: From a soon to be Grad.",2024-11-25T05:17:49+00:00,0.5267,0,136.0
Guidance on Navigating PhD Supervisor Capacity and Funding Constraints,2024-11-24T18:36:55+00:00,0.0,0,136.0
BIOL 200 final tips: how to improve mark,2024-11-24T23:09:21+00:00,0.4404,1,136.0
How many months are 9 credits?,2024-11-24T23:08:29+00:00,0.3612,0,136.0
Friendly Support *Repost*,2024-11-24T20:32:34+00:00,0.7096,0,136.0
"If I want to score higher on a term 1 course, can I retake it in term 2?",2024-11-24T19:20:42+00:00,0.0772,0,136.0
UBC: Amendments to the Naming Policy (GA6),2024-11-24T13:18:41+00:00,0.0,0,136.0
Police checkpoint at Commercial-Broadway skytrain,2024-11-24T17:29:26+00:00,0.0,0,136.0
Very Worried and Overwhelmed,2024-11-24T09:21:28+00:00,-0.2568,0,136.0
Where to find Engineering Physics graduating student portraits compilations,2024-11-24T06:41:11+00:00,0.0,0,136.0
any advise in leaning cpsc425 computer vision?,2024-11-24T09:56:00+00:00,0.25,0,136.0
Anyone that opted out from health & dental receive a refund yet?,2024-11-24T05:29:59+00:00,0.0,0,136.0
PSA: Translink officers ticketing on buses,2024-11-23T18:44:55+00:00,0.0,0,136.0
UBC Meal Share.,2024-11-23T23:21:05+00:00,0.296,0,136.0
Abnormal PSYC with Brian Thomas-Peter?,2024-11-24T03:04:20+00:00,0.0,0,136.0
thereotically if i just committed academic dishonesty but haven't been caught for it yet would it be possible for me to drop out of the course pre-emptively to avoid punishment,2024-11-23T23:03:46+00:00,-0.8481,0,136.0
Where is the snow,2024-11-24T01:00:46+00:00,0.0,0,136.0
For the cs majors,2024-11-24T00:02:15+00:00,0.0,0,136.0
urgent care wait times?,2024-11-22T23:11:35+00:00,0.6124,0,136.0
Taking final exam for classes I’m not registered in for fun,2024-11-23T08:08:23+00:00,0.5106,1,136.0
"""Destructive therapy"": let's smash some glass",2024-11-23T05:30:24+00:00,-0.6124,0,136.0
Giving away my ticket to UBC Sigma Chi frat party tonight,2024-11-22T22:49:49+00:00,0.6249,0,136.0
Pharmacology students,2024-11-23T04:15:37+00:00,0.0,0,136.0
I just found out my dad has cancer,2024-11-23T03:38:54+00:00,-0.6597,0,136.0
Workday transcript too long,2024-11-23T00:53:26+00:00,0.0,0,136.0
How have so many washroom users been failed by those who’ve raised them,2024-11-23T00:46:44+00:00,-0.5106,0,136.0
Dude kept getting in the way of my bike,2024-11-23T00:38:06+00:00,0.0,0,136.0
"Withdrawing my a class now, will this affect anything?",2024-11-22T23:38:17+00:00,0.0,0,136.0
Shout-out to the person driving unicycle in this wind 🫡,2024-11-22T23:27:46+00:00,0.0,0,136.0
Updates from UBC Senate,2024-11-22T21:16:34+00:00,0.0,0,136.0
"UBC Alumni Confession thread. Alumni of UBC, confess the cringey experiences you had here.",2024-11-22T20:09:46+00:00,0.0,0,136.0
Trek Excellence Scholarship,2024-11-22T20:07:59+00:00,0.6249,0,136.0
favorite christmas songs?,2024-11-22T19:24:57+00:00,0.4588,0,136.0
To whoever stole cigarettes from my locker,2024-11-22T18:59:05+00:00,0.0,0,136.0
Red crocs girl on BIKE,2024-11-22T18:48:51+00:00,0.0,0,136.0
Professors telling us what to think?,2024-11-22T18:16:03+00:00,0.0,0,136.0
Is Canvas down?,2024-11-22T17:24:24+00:00,0.0,0,136.0
is it doable???,2024-11-22T09:22:25+00:00,0.0,0,136.0
I can't find my former prof's contact info for a reference,2024-11-22T08:17:27+00:00,0.0,0,136.0
My bf is my Math TA,2024-11-22T08:05:12+00:00,0.0,0,136.0
Seasonal depression,2024-11-22T07:13:50+00:00,-0.5719,0,136.0
Have u ever felt like you're in a wrong major/program?,2024-11-22T03:24:47+00:00,-0.1531,0,136.0
Big accident on MacDonald and Broadway. Don’t see any busses going up to UBC,2024-11-22T03:23:19+00:00,-0.4767,0,136.0
Recommendations for psych tutors?,2024-11-21T02:31:08+00:00,0.0,0,136.0
just bombed a math 100 midterm and i’m devastated,2024-11-21T19:06:42+00:00,-0.6124,1,136.0
Math 100B Midterm,2024-11-21T23:52:16+00:00,0.0,1,136.0
Anyone know what happened at the Wesbrook and Univ Blvd Intersection?,2024-11-21T23:58:41+00:00,0.0,0,136.0
West 41st Accodent,2024-11-22T00:40:33+00:00,0.0,0,136.0
Police by Bus Loop,2024-11-22T00:31:16+00:00,0.0,0,136.0
Police Incident near UBC sign and bus loop,2024-11-22T00:01:38+00:00,0.0,0,136.0
Arts advising might have fucked me over,2024-11-21T23:32:17+00:00,-0.6597,0,136.0
how much hours should i study per week?,2024-11-21T21:59:38+00:00,0.0,0,136.0
Thoughts on Psych 361? (Motivation),2024-11-21T21:20:16+00:00,0.34,0,136.0
Instructor changed syllabus for quiz policy - any recourse?,2024-11-21T19:57:38+00:00,0.0,0,136.0
UBC Go global summer abroad (not exchange) is it competitive?,2024-11-21T18:47:53+00:00,0.1779,0,136.0
Anyone with a car want to take an injured bird to the wildlife rescue in burnaby?,2024-11-21T16:23:00+00:00,0.2263,0,136.0
Almost passed a midterm..??,2024-11-21T18:20:44+00:00,0.0,1,136.0
KORN 351 and 301,2024-11-21T18:04:31+00:00,0.0,0,136.0
Buchanan blockade,2024-11-21T16:45:21+00:00,0.0,0,136.0
Workday transcripts not showing class averages?,2024-11-21T05:03:46+00:00,0.0,0,136.0
help with comm 295,2024-11-21T02:17:49+00:00,0.0,0,136.0
math 200 final exam,2024-11-20T19:59:29+00:00,0.0,1,136.0
Any guy out there interested in fake dating?,2024-11-21T08:32:54+00:00,-0.1027,0,136.0
Question About Graduation Completion for May 2025,2024-11-21T09:15:33+00:00,0.0,0,136.0
Irving k barber,2024-11-21T07:57:11+00:00,0.0,0,136.0
Bioc 202 Midterm2,2024-11-21T05:39:53+00:00,0.0,1,136.0
Do students who work in retail and food services industry generally get promoted after they graduate?,2024-11-20T22:38:11+00:00,0.4215,0,136.0
CAN I WRITE ON A PROPER DESK!,2024-11-21T04:27:43+00:00,0.0,0,136.0
New rec centre looks like the Tesla cyber truck,2024-11-20T20:58:38+00:00,0.3612,0,136.0
got off waitlist and trying to accept the transaction but under tasks says 'canceled'--anyone know why?,2024-11-21T05:16:06+00:00,0.2023,0,136.0
Disillusioned by UBC,2024-11-21T03:24:57+00:00,-0.4404,0,136.0
cpsc311 midterm2 thoughts?,2024-11-21T04:38:04+00:00,0.0,1,136.0
Is there a club just to make more friends?,2024-11-21T04:46:32+00:00,0.5256,0,136.0
Econ102 final advice,2024-11-21T04:42:19+00:00,0.0,1,136.0
My ex is the TA for my class,2024-11-21T03:48:58+00:00,0.0,0,136.0
Chem 121 midterm 2?? Hello????,2024-11-21T03:28:51+00:00,0.0,1,136.0
how was the math 100 midterm today for those in A?,2024-11-21T03:15:07+00:00,0.0,1,136.0
NEED TO FIND FULL LENGTH MIRROR ON CAMPUS,2024-11-21T02:01:50+00:00,0.0,0,136.0
5pm 33 bus driver,2024-11-21T01:25:13+00:00,0.0,0,136.0
that emergency alert scared the shit out of me,2024-11-20T21:57:15+00:00,-0.7845,0,136.0
where to buy cigs on campus?,2024-11-20T21:31:49+00:00,0.0,0,136.0
What is the correct formatting for an MLA academic research paper,2024-11-20T20:49:12+00:00,0.0,0,136.0
Math 100A midterm,2024-11-20T20:28:00+00:00,0.0,1,136.0
What should I do now?,2024-11-20T11:21:38+00:00,0.0,0,136.0
The A & W pin code stops allowing the full pin.,2024-11-20T12:43:48+00:00,-0.1531,0,136.0
What's the reasoning behind the AMS prohibiting students who use the food bank from volunteering?,2024-11-20T09:03:02+00:00,0.0,0,136.0
