Title,Date,sentiment,target_word_count,cost_of_living
Premeds at uncw,2024-12-04T02:20:17+00:00,0.0,0,109.0
Plato's Lofts + General Questions,2024-12-03T01:29:21+00:00,0.0,0,109.0
Hidden Study/Hangout Spots,2024-12-02T03:31:03+00:00,0.0,0,109.0
Does anyone know when they reach out for regular decision?,2024-12-01T05:58:25+00:00,0.0258,0,109.0
UNCW Early Action Decision,2024-11-29T20:52:07+00:00,0.0,0,109.0
Best seafood in Wilmington?,2024-11-27T22:02:59+00:00,0.6369,0,109.0
"3.4uw 3.8w GPA, 1410 SAT, male applied early for pre-nursing out of state, chances for admission?",2024-11-25T17:29:33+00:00,0.2023,0,109.0
"3.66W gpa and 2 varsity sports, what do you guys think are the odds of me getting in?",2024-11-25T03:46:35+00:00,0.0,0,109.0
Anyone else be thinkin,2024-11-24T19:08:01+00:00,0.0,0,109.0
Anyone else’s power out?,2024-11-24T14:19:20+00:00,0.0,0,109.0
Disc golf club,2024-11-22T14:07:56+00:00,0.0,0,109.0
UNCW,2024-11-22T12:57:54+00:00,0.0,0,109.0
Need help starting a pro wrestling club,2024-11-20T16:22:14+00:00,0.0,0,109.0
wanting to transfer after getting AS degree at coastal ccc but worried about failing class,2024-11-20T06:46:34+00:00,-0.8047,0,109.0
Any debate clubs?,2024-11-14T23:49:58+00:00,0.0,0,109.0
What are overall thoughts on sea-hawk cove,2024-11-11T07:16:01+00:00,0.0,0,109.0
"Comp-Sci, 18 credit hours",2024-11-08T00:05:26+00:00,0.3818,0,109.0
Can visitors park wherever on weekends?,2024-11-05T14:34:18+00:00,0.0,0,109.0
Acting for non majors,2024-11-04T18:56:42+00:00,0.0,0,109.0
