Title,Date,sentiment,target_word_count,cost_of_living
Reward of $3K if you can help setup/turn Amazon FBA seller account into an Amazon Vendor account,2024-11-29T10:24:28+00:00,0.7269,0,172.0
UC Application small mistake,2024-11-29T08:50:33+00:00,-0.34,0,172.0
Film production summer institute 2025 + housing questions,2024-11-29T07:00:26+00:00,0.0,0,172.0
Need study spot as a non student,2024-11-29T06:45:23+00:00,0.0,0,172.0
LOOKING TO TRADE SPAN 7A W SPAN 2 🙏,2024-11-29T04:05:55+00:00,0.0,0,172.0
Housing over winter break,2024-11-29T04:00:01+00:00,0.0,0,172.0
please tell me study spots,2024-11-29T02:59:16+00:00,0.3182,0,172.0
"Love Self-Care, Self-Improvement, or Capybaras? Bruin Walk!!!",2024-11-29T01:02:05+00:00,0.7249,0,172.0
What are you thankful for this year?,2024-11-29T00:06:15+00:00,0.5719,0,172.0
How hard is transferring to Computer Engineering?,2024-11-28T23:11:04+00:00,-0.1027,0,172.0
Nachenberg CS32 discussions?,2024-11-28T22:40:01+00:00,0.0,0,172.0
anyone ever deal with jealous roommates?!,2024-11-28T22:15:37+00:00,-0.5093,0,172.0
Complaint filed against Cultural Affairs Commission alleging discrimination against Jews in hiring,2024-11-28T21:04:48+00:00,-0.296,0,172.0
Most frequent nationality of UCLA international students,2024-11-28T20:37:51+00:00,0.0,0,172.0
Where to study during holidays?,2024-11-28T20:23:59+00:00,0.3818,0,172.0
How to post in Facebook housing groups,2024-11-28T20:01:29+00:00,0.0,0,172.0
Looking for Sublet for this winter break!,2024-11-28T19:55:27+00:00,0.0,0,172.0
carpool from lax 12/2 7pm,2024-11-28T19:15:30+00:00,0.0,0,172.0
Best parking lot to park in to explore campus??,2024-11-28T18:33:30+00:00,0.6767,0,172.0
"What does UC financial aid look like? (-1500 SAI, homeless)",2024-11-28T18:25:33+00:00,0.3612,0,172.0
Looking for bruins living in the Bay Area,2024-11-28T18:19:38+00:00,0.0,0,172.0
20A with kavner,2024-11-28T17:33:11+00:00,0.0,0,172.0
First Generation UC application,2024-11-28T16:57:31+00:00,0.0,0,172.0
Need some reassurance (graduate electrical engineering),2024-11-28T10:15:02+00:00,0.3612,0,172.0
Red Drop,2024-11-28T08:38:25+00:00,-0.2732,0,172.0
Is UCLA Hyped up?,2024-11-28T08:19:10+00:00,0.0,0,172.0
Can I have your physics 5B spot PLS?,2024-11-28T07:33:56+00:00,0.2577,0,172.0
Can I Microwave the container?,2024-11-28T07:31:45+00:00,0.0,0,172.0
Anyone know where I can get 🐱 over here?,2024-11-28T07:01:09+00:00,0.0,0,172.0
153b or 153c while studying for the mcat???,2024-11-28T06:49:18+00:00,0.0,0,172.0
UC Application for International Students,2024-11-28T05:55:33+00:00,0.0,0,172.0
senioritis + pre-graduation existential dread hitting rn 🔥,2024-11-28T05:42:46+00:00,-0.6597,0,172.0
Thanksgiving dinner tmr,2024-11-28T05:41:25+00:00,0.0,0,172.0
Any recent ucla grads still living in LA?,2024-11-28T05:40:02+00:00,0.0,0,172.0
math 115a w yeong?,2024-11-28T05:29:25+00:00,0.0,0,172.0
Any parties or events nearby during Thanksgiving?,2024-11-28T05:25:22+00:00,0.4019,0,172.0
Where to eat on campus during break?,2024-11-28T04:43:00+00:00,0.0,0,172.0
first-gen confusion,2024-11-28T04:09:46+00:00,-0.296,0,172.0
Freshman here - I need some help,2024-11-28T04:06:18+00:00,0.0,0,172.0
Advice for someone seeking to transfer to UCLA,2024-11-28T03:58:35+00:00,0.0,0,172.0
What’s the rarest international student nationality you’ve encountered?,2024-11-28T03:25:21+00:00,0.0,0,172.0
Syllabus needed: Sociology 185 American Society,2024-11-28T02:19:43+00:00,0.0,0,172.0
Looking for admissions help urgently,2024-11-28T01:46:36+00:00,0.0,0,172.0
I'm cooked......,2024-11-28T01:25:22+00:00,-0.6369,0,172.0
How to start a new club on campus?,2024-11-28T00:26:54+00:00,0.0,0,172.0
Happy Thanksgiving,2024-11-28T00:13:45+00:00,0.5719,0,172.0
Star Wars Fan Club Discord,2024-11-28T00:08:48+00:00,-0.6124,0,172.0
academic dishonesty,2024-11-27T23:58:32+00:00,0.0,0,172.0
Star Wars Fan Club Discord Link,2024-11-27T23:54:03+00:00,-0.6124,0,172.0
Upper Div Chem Courses,2024-11-27T23:45:56+00:00,0.0,0,172.0
Best cafe to study at in Westwood & Stanta Monica,2024-11-27T23:32:02+00:00,0.6369,0,172.0
How do impacted majors work at UCLA?,2024-11-27T23:08:09+00:00,0.0,0,172.0
parking enforcement on landfair ave.,2024-11-27T22:51:06+00:00,0.0,0,172.0
if you’re looking for part of your suspension on your car,2024-11-27T22:06:04+00:00,0.0,0,172.0
Parking spot,2024-11-27T21:40:38+00:00,0.0,0,172.0
Ra application and interview advice,2024-11-27T20:41:29+00:00,0.0,0,172.0
"university of california, Los Angelos",2024-11-27T20:34:49+00:00,0.0,0,172.0
MatLab Help (specifically for AOS 135),2024-11-27T20:11:36+00:00,0.0,0,172.0
phlebotomy jobs,2024-11-27T19:58:07+00:00,0.0,0,172.0
Wtf is going on with eduroam???,2024-11-27T19:20:42+00:00,-0.6531,0,172.0
Change major to B.A,2024-11-27T19:01:18+00:00,0.0,0,172.0
Ls 7a Notes,2024-11-27T18:37:02+00:00,0.0,0,172.0
"out of state grad students, did you receive scholarship funding?",2024-11-27T17:46:22+00:00,0.0,0,172.0
Winter BruinBill,2024-11-27T16:48:40+00:00,0.0,0,172.0
Any Asian hotties looking for a non-Asian boyfriend,2024-11-27T16:13:23+00:00,0.0,0,172.0
r their any places on campus open on thanksgiving day?,2024-11-27T14:47:51+00:00,0.0,0,172.0
questions about double majoring as potential transfer,2024-11-27T10:21:04+00:00,0.0,0,172.0
chemical engineering options,2024-11-27T08:31:36+00:00,0.0,0,172.0
SPLIT A RIDESHARE TO LAX THANKSGIVING MORNING; ARRIVE BY 4:15AM 🫡,2024-11-27T08:12:46+00:00,0.0,0,172.0
To the girls waving at us from Saxon,2024-11-27T07:22:09+00:00,0.0,0,172.0
Life science 7A with Maloy professor. ucla (I NEED HELP STIDYING FOR MY FINAL PLEASE),2024-11-27T07:03:04+00:00,0.4648,1,172.0
OCH ——> UA,2024-11-27T06:43:20+00:00,0.0,0,172.0
who was the guy screaming in the holly stairs last night,2024-11-27T06:34:44+00:00,-0.3818,0,172.0
Anyone want to split an Uber off the edge of a cliff?,2024-11-27T05:09:32+00:00,0.0772,0,172.0
Anyone want to split an uber to lax Thursday morning?,2024-11-27T04:28:48+00:00,0.0772,0,172.0
Gym,2024-11-27T03:34:45+00:00,0.0,0,172.0
Animation Undergrad?,2024-11-27T03:02:33+00:00,0.0,0,172.0
Life Science 7A with Maloy ( I NEED HELP to PREPARE FOR THE FINAL),2024-11-27T02:25:49+00:00,0.0,1,172.0
update on the campus crush,2024-11-27T02:12:51+00:00,-0.1531,0,172.0
Can somone swipe me and my family in tomorrow (Wed)?,2024-11-27T00:44:19+00:00,0.0,0,172.0
Meal swipes,2024-11-27T00:33:29+00:00,0.0,0,172.0
Will Pay a Lot,2024-11-27T00:15:10+00:00,-0.1027,0,172.0
Please recommend,2024-11-27T00:03:15+00:00,0.5859,0,172.0
I don’t understand what to do with English Proficiency Test,2024-11-26T23:57:56+00:00,0.0,1,172.0
dropping cs31 this late into the quarter,2024-11-26T23:53:26+00:00,0.0,0,172.0
Never sharing again,2024-11-26T23:52:21+00:00,-0.3252,0,172.0
Uber to LAX 5AM tomorrow,2024-11-26T23:42:17+00:00,0.0,0,172.0
Uber from Gateway Plaza to LAX (4:15 PM Tmrw),2024-11-26T23:36:28+00:00,0.0,0,172.0
Urgent help for my friend,2024-11-26T23:07:48+00:00,0.6124,0,172.0
SPRING + WINTER SUBLETTING in WESTWOOD 1BD,2024-11-26T22:48:58+00:00,0.0,0,172.0
Business economics,2024-11-26T22:47:48+00:00,0.0,0,172.0
Someone lost their keys?,2024-11-26T21:51:43+00:00,-0.3182,0,172.0
THE RETURN OF THE PANDA EXPRESS SLURPING DUDE,2024-11-26T21:23:53+00:00,0.0,0,172.0
International student admit rate?,2024-11-26T21:05:13+00:00,0.2023,0,172.0
What are chances of being admitted?,2024-11-26T21:03:03+00:00,0.296,0,172.0
Potential Private APT options?,2024-11-26T20:44:59+00:00,0.0,0,172.0
APARTMENT - READ,2024-11-26T18:11:31+00:00,0.0,0,172.0
holiday mental health services,2024-11-26T17:48:27+00:00,0.4019,0,172.0
Physics 1B Petta past finals,2024-11-26T17:41:34+00:00,0.0,1,172.0
Holiday Uber,2024-11-26T16:44:39+00:00,0.4019,0,172.0
How to ask for a recommendation letter?,2024-11-26T15:54:24+00:00,0.0,0,172.0
uclagrades.com - all 2023-24 grade distributions just dropped (fka grades.natecation.xyz),2024-11-26T15:30:17+00:00,0.0,0,172.0
Is the dildo in Powell available for Loan or did someone lose it?,2024-11-26T15:06:46+00:00,-0.4019,0,172.0
is anybody currently living at 10938 Strathmore Dr ?? 😭,2024-11-26T12:46:09+00:00,0.0,0,172.0
What kind of students do UCLA and UCB like? Or what colleges are right for me?,2024-11-26T12:39:01+00:00,0.4329,0,172.0
Looking to rent a parking spot,2024-11-26T10:16:09+00:00,0.0,0,172.0
1919 ice cream,2024-11-26T08:54:15+00:00,0.0,0,172.0
Parking near University apartments north,2024-11-26T08:15:22+00:00,0.0,0,172.0
the women on campus are beautiful,2024-11-26T08:12:47+00:00,0.5994,0,172.0
M.A. in Cinema and Media Studies Admission,2024-11-26T07:57:49+00:00,0.0,0,172.0
Parking tips and best options to park for UCLA Basketball?,2024-11-26T07:49:14+00:00,0.6369,0,172.0
For anyone going home for Thanksgiving,2024-11-26T07:45:34+00:00,0.0,0,172.0
RELIGION 11 FINAL RESEARCH PAPER,2024-11-26T07:35:22+00:00,0.0,1,172.0
Food poisoning from the chicken tikka masala at the Drey?,2024-11-26T07:04:25+00:00,-0.5859,0,172.0
LAX City Bus Center Shuttle,2024-11-26T06:30:48+00:00,0.0,0,172.0
lost keys on campus 11/25,2024-11-26T06:13:17+00:00,-0.3182,0,172.0
Dabble free 25$- only have 2 days left,2024-11-26T06:06:49+00:00,0.5106,0,172.0
does anyone know how to do piercings?,2024-11-26T05:31:08+00:00,0.0,0,172.0
My wife is not at this school,2024-11-26T04:46:33+00:00,0.0,0,172.0
Changing major,2024-11-26T04:40:32+00:00,0.0,0,172.0
where is the carnesale commons cut out?,2024-11-26T04:27:59+00:00,-0.2732,0,172.0
Traffic estimate (Tuesday to LAX),2024-11-26T04:18:45+00:00,0.0,0,172.0
rideshare to LAX,2024-11-26T04:02:36+00:00,0.0,0,172.0
how would you feel if your roommate wanted to use room to have sex from 9-9:03pm,2024-11-26T03:55:18+00:00,0.0,0,172.0
Transfer from CSULB,2024-11-26T03:51:55+00:00,0.0,0,172.0
Material engineering,2024-11-26T03:33:43+00:00,0.0,0,172.0
Why not supplying water,2024-11-26T03:18:45+00:00,0.0,0,172.0
Drag Shows Near UCLA,2024-11-26T02:57:59+00:00,-0.2263,0,172.0
Yapper in Kerckhoff,2024-11-26T02:50:30+00:00,0.0,0,172.0
Any psych majors wanna swap classes?,2024-11-26T02:22:47+00:00,0.0,0,172.0
no research still I'm going to chew on concrete tn.,2024-11-26T02:15:32+00:00,-0.296,0,172.0
🚨 College Students Wanted: Get Paid to Test a AI Study Assistant App 🚨,2024-11-26T02:04:19+00:00,0.0,1,172.0
no thanksgiving-themed dinner at de neve this year?,2024-11-26T02:00:22+00:00,-0.296,0,172.0
first quarter as a transfer and im boutta drop a class,2024-11-26T01:41:34+00:00,-0.2732,0,172.0
Kiss of Life Concert 12/4?,2024-11-26T01:36:19+00:00,0.4215,0,172.0
"has anyone applied and gotten into uclas global internship program, specifically the hospital rotation ones?",2024-11-26T01:29:38+00:00,0.0,0,172.0
anyone need swipes?,2024-11-26T00:39:52+00:00,0.0,0,172.0
can you swipe someone into the dining hall without eating there yourself?,2024-11-26T00:36:38+00:00,0.0,0,172.0
Does the campus have any outpatient psych clinics?,2024-11-26T00:32:51+00:00,0.0,0,172.0
Anyone doing film?,2024-11-26T00:17:15+00:00,0.0,0,172.0
Whats my chance for Bioengineering at UCLA :),2024-11-26T00:12:39+00:00,0.6124,0,172.0
Apartment,2024-11-26T00:09:39+00:00,0.0,0,172.0
Extra dining hall swipes?,2024-11-26T00:02:40+00:00,0.0,0,172.0
Looking for 2 meal swipes!,2024-11-25T23:33:01+00:00,0.0,0,172.0
Turn your study materials into a Podcast!,2024-11-25T23:22:13+00:00,0.0,0,172.0
Lost Key Chain,2024-11-25T23:06:30+00:00,-0.3182,0,172.0
Why are my open book tests way worse than my closed book ones?,2024-11-25T22:40:56+00:00,-0.4767,1,172.0
Carpool to Norcal,2024-11-25T22:03:26+00:00,0.0,0,172.0
anyone want to split an uber to LAX tuesday 11/26 around 3:30pm,2024-11-25T21:59:55+00:00,0.0772,0,172.0
Vafaie Dermatology Internship,2024-11-25T21:39:33+00:00,0.0,0,172.0
"RANT WARNING: someone stole my footage from this sub, posted it to r/pics, and now has over 10,000 upvotes",2024-11-25T21:39:28+00:00,-0.7404,0,172.0
Gannon 33a midterm,2024-11-25T21:15:30+00:00,0.0,1,172.0
Star Wars Fan Anyone??,2024-11-25T20:43:35+00:00,-0.3939,0,172.0
Hardest psych classes?,2024-11-25T20:43:29+00:00,0.0,0,172.0
Ucpd,2024-11-25T20:39:06+00:00,0.0,0,172.0
Interning in NYC this Summer?,2024-11-25T20:31:34+00:00,0.0,0,172.0
Transfer Application Questions,2024-11-25T20:18:19+00:00,0.0,0,172.0
Table tennis ?,2024-11-25T20:08:00+00:00,0.0,0,172.0
chem 14cl lab switch,2024-11-25T17:22:16+00:00,0.0,0,172.0
"Guys, I’m cold",2024-11-25T17:21:56+00:00,0.0,0,172.0
how would you feel if your roommate wanted to use room to have sex from 9-10pm,2024-11-25T17:17:02+00:00,0.0,0,172.0
Applying For Housing Late,2024-11-25T16:14:44+00:00,0.0,0,172.0
7L Lab Switch,2024-11-25T15:17:23+00:00,0.0,0,172.0
Rieber noise,2024-11-25T09:57:28+00:00,0.0,0,172.0
High School Research Opportunities,2024-11-25T09:20:04+00:00,0.3818,0,172.0
Chat how do we feel about the ucla vs usc game,2024-11-25T09:00:00+00:00,0.0,0,172.0
Ls7C,2024-11-25T08:07:18+00:00,0.0,0,172.0
Night powell,2024-11-25T07:57:45+00:00,0.0,0,172.0
I’m not okay,2024-11-25T06:45:07+00:00,-0.1695,0,172.0
Smile Hotdog Line Now,2024-11-25T06:43:45+00:00,0.3612,0,172.0
how to mail large packages from mailroom,2024-11-25T06:43:29+00:00,0.0,0,172.0
Off-campus apartments,2024-11-25T05:41:42+00:00,0.0,0,172.0
why is having a campus crush so humbling,2024-11-25T05:36:26+00:00,-0.1531,0,172.0
Lost white earbud at rendez,2024-11-25T05:10:25+00:00,-0.3182,0,172.0
Lost Earbud at Rendez,2024-11-25T05:06:17+00:00,-0.3182,0,172.0
Stall CS32 Academic Dishonesty,2024-11-25T05:04:30+00:00,-0.2023,0,172.0
BDP Question- Prudential students,2024-11-25T04:12:15+00:00,0.0,0,172.0
"if you added a lived name (preferred name besides legal name), was there any inconvenience?",2024-11-25T03:02:53+00:00,-0.25,0,172.0
using someone else’s bruincard in dining,2024-11-25T02:35:20+00:00,0.0,0,172.0
thoughts on computational and systems biology major,2024-11-25T02:22:36+00:00,0.0,0,172.0
Do People Here Play Trading Card Games? Clubs?,2024-11-25T01:34:12+00:00,0.4137,0,172.0
Chicano studies 155B with Barreto,2024-11-25T01:17:22+00:00,0.0,0,172.0
Cheap insurance for UCSHIP waiver,2024-11-25T01:14:40+00:00,0.0,0,172.0
"Does the hitchen have basic cooking food supplies like salt, pepper, oil?",2024-11-25T01:13:44+00:00,0.3612,0,172.0
No way a GE is gonna be the thing that ruins my GPA😭,2024-11-25T00:48:47+00:00,-0.6249,0,172.0
Waive UCSHIP Winter Quarter,2024-11-25T00:33:33+00:00,0.0,0,172.0
Do you have friends?,2024-11-24T23:59:11+00:00,0.4767,0,172.0
7L Lab Switch,2024-11-24T23:31:03+00:00,0.0,0,172.0
UNDEFEATED NO MORE!!! UCLA WOMENS BASKETBALL JUST BEAT SOUTH CAROLINAS 40+ GAME WIN STREAK,2024-11-24T22:55:21+00:00,0.5386,0,172.0
Hospital/clinical Experience,2024-11-24T22:50:01+00:00,0.0,0,172.0
splitting uber to union station 11/27,2024-11-24T22:14:38+00:00,0.0,0,172.0
swapping stats 100a lecture (lec 2 to lec 1),2024-11-24T21:54:04+00:00,0.0,0,172.0
English 20W Application,2024-11-24T21:31:36+00:00,0.0,0,172.0
PIQ responses feedback,2024-11-24T20:37:56+00:00,0.0,0,172.0
Need Kitchen Will Pay,2024-11-24T20:36:15+00:00,-0.1027,0,172.0
Found Airpods,2024-11-24T20:10:16+00:00,0.0,0,172.0
The barefoot Asian girl,2024-11-24T20:05:06+00:00,0.0,0,172.0
Reader in UCLA,2024-11-24T19:34:35+00:00,0.0,0,172.0
challengers lookalike competetion,2024-11-24T19:31:40+00:00,0.1027,0,172.0
FEMBA scholarship?,2024-11-24T13:56:04+00:00,0.0,0,172.0
"Undergrad Major, Computer Science, Math, or Mathematics of Computation",2024-11-24T11:13:45+00:00,0.0,0,172.0
LS7C curved??,2024-11-24T09:48:09+00:00,0.0,0,172.0
who and why did yall wake everyone up,2024-11-24T09:03:48+00:00,0.0,0,172.0
Thanksgiving holiday kinda sucks,2024-11-24T08:24:40+00:00,0.1263,0,172.0
Comm 151,2024-11-24T07:16:15+00:00,0.0,0,172.0
LMFAO,2024-11-24T06:56:01+00:00,0.5423,0,172.0
Is there a long line for smile dog,2024-11-24T06:27:21+00:00,0.3612,0,172.0
Psych 121,2024-11-24T06:25:32+00:00,0.0,0,172.0
USC heritage.....,2024-11-24T06:02:16+00:00,0.0,0,172.0
de neve late night canceled,2024-11-24T06:02:02+00:00,0.0,0,172.0
How many abgs are at ucla,2024-11-24T05:53:56+00:00,0.0,0,172.0
Split Uber to campus now,2024-11-24T05:26:10+00:00,0.0,0,172.0
Halftime Thoughts,2024-11-24T04:57:39+00:00,0.0,0,172.0
What date and time do Enrollment restrictions drop?,2024-11-24T04:20:16+00:00,-0.2732,0,172.0
when they gonna shut the subway down,2024-11-24T03:12:21+00:00,0.0,0,172.0
Do I fold or do I let that 🥭,2024-11-24T03:00:13+00:00,0.0,0,172.0
Where’s flamin hot chicken?,2024-11-24T01:30:58+00:00,0.0,0,172.0
MCDB M140,2024-11-24T01:26:50+00:00,0.0,0,172.0
EXTRA ROOTER BUS TICKET,2024-11-24T01:19:45+00:00,0.0,0,172.0
usc vs ucla ticket,2024-11-24T00:38:37+00:00,0.0,0,172.0
Share Uber to rosebowl rn,2024-11-24T00:23:08+00:00,0.296,0,172.0
Poli Sci 40,2024-11-24T00:22:21+00:00,0.0,0,172.0
Looking to share an uber to the rose bowl now,2024-11-24T00:18:03+00:00,0.296,0,172.0
free my boy Fusion,2024-11-24T00:05:04+00:00,0.5106,0,172.0
fat sal's sandwich,2024-11-23T23:40:30+00:00,0.0,0,172.0
Want to Purchase: 1 Rooter Bus Ticket,2024-11-23T23:07:46+00:00,0.0772,0,172.0
USC ticket QR code?,2024-11-23T22:51:01+00:00,0.0,0,172.0
Uber 3:30 game tonight,2024-11-23T22:24:25+00:00,0.0,0,172.0
When to line up for usc rooter bus at pauley?,2024-11-23T22:00:27+00:00,0.0,0,172.0
uber to rose bowl,2024-11-23T21:50:55+00:00,0.0,0,172.0
FOR SALE: Lavender Vanilla Scented Bath & Body Works Aromatherapy Set,2024-11-23T20:54:08+00:00,0.0,0,172.0
Looking for two UCLA student section tickets,2024-11-23T20:42:39+00:00,0.0,0,172.0
split lyft/uber back to ucla from rose bowl,2024-11-23T20:37:22+00:00,0.0,0,172.0
Need UCLA v. USC Student Ticket,2024-11-23T20:20:19+00:00,0.0,0,172.0
How to transfer rooter bus pass,2024-11-23T20:01:10+00:00,0.0,0,172.0
Rooter bus ticket for today plz,2024-11-23T19:45:00+00:00,0.0772,0,172.0
I need a Rooter Pass for tonight Please and Thank You! :),2024-11-23T19:37:46+00:00,0.7959,0,172.0
Anyone have 2 rooter bus tickets !!,2024-11-23T19:32:49+00:00,0.0,0,172.0
How do I transfer a den pass ticket,2024-11-23T19:31:11+00:00,0.0,0,172.0
Any other freshman going to USC Game?,2024-11-23T19:15:31+00:00,0.0,0,172.0
rooter bus questions,2024-11-23T19:12:43+00:00,0.0,0,172.0
usc ucla game buddies,2024-11-23T18:58:21+00:00,0.0,0,172.0
Looking for a UCLA vs UC ticket,2024-11-23T18:54:13+00:00,0.0,0,172.0
To the girl who got into an accident on yesterday at 6:25pm,2024-11-23T18:47:24+00:00,-0.4767,0,172.0
Should I drop LS7C?,2024-11-23T18:34:09+00:00,-0.2732,0,172.0
Need Rooter Ticket to UCLA-USC Game - Will Pay Good Price-Message Me If Interested,2024-11-23T18:30:40+00:00,0.6369,0,172.0
LS 7c finals,2024-11-23T18:30:29+00:00,0.0,1,172.0
struggling senior,2024-11-23T18:22:11+00:00,-0.4215,0,172.0
are the westwood movie theaters open?,2024-11-23T18:17:26+00:00,0.0,0,172.0
need rooter bus ticket for usc ucla game!!,2024-11-23T17:59:41+00:00,0.0,0,172.0
reiber music rooms,2024-11-23T17:56:00+00:00,0.0,0,172.0
Lower Div Tutoring,2024-11-23T17:54:14+00:00,-0.296,0,172.0
MIMG 102 and MIMG 185,2024-11-23T17:19:42+00:00,0.0,0,172.0
Swipe now,2024-11-23T15:38:14+00:00,0.0,0,172.0
Finished arcane and my life is now complete,2024-11-23T12:03:55+00:00,0.0,0,172.0
marching band (?) outside of de neve,2024-11-23T11:55:50+00:00,0.0,0,172.0
Exploring steam tunnels,2024-11-23T11:47:45+00:00,0.0,0,172.0
Material Engineering vs Business Economics,2024-11-23T11:20:48+00:00,0.0,0,172.0
FOOTBALL GAME UBER/LFYT COST SPLIT,2024-11-23T10:02:40+00:00,0.0,0,172.0
Wtb rooter bus,2024-11-23T09:50:20+00:00,0.0,0,172.0
Ucla vs usc ticket,2024-11-23T06:40:16+00:00,0.0,0,172.0
interpol tmrw,2024-11-23T05:34:07+00:00,0.0,0,172.0
Mobile Order on R Meal Plan,2024-11-23T04:57:33+00:00,0.0,0,172.0
if someone can help me ace the psych 100a final i will literally give you a free ticket to disneyland,2024-11-23T04:44:25+00:00,0.5106,1,172.0
WHERE IS THE SCREAMING COMING FROM???,2024-11-23T04:35:48+00:00,-0.4836,0,172.0
dropping a class,2024-11-23T04:27:52+00:00,0.0,0,172.0
UCLA vs USC Football Game Ticket!!,2024-11-23T03:58:59+00:00,0.0,0,172.0
Rooter Bus,2024-11-23T03:51:49+00:00,0.0,0,172.0
bedroom in 2BR available in Westwood,2024-11-23T03:33:33+00:00,0.0,0,172.0
rooter bus ticket available for ucla vs usc game?,2024-11-23T03:33:06+00:00,0.0,0,172.0
Are dinning halls open today?,2024-11-23T02:03:03+00:00,0.0,0,172.0
Religion 11 final paper,2024-11-23T01:08:03+00:00,0.0,1,172.0
Looking for parking spot,2024-11-23T00:56:04+00:00,0.0,0,172.0
when i took the bus i tapped my card and it didnt go through and made a beeping sound. will i be fined or arrested?,2024-11-23T00:46:37+00:00,-0.4767,0,172.0
Swipes during Thanksgiving Week,2024-11-23T00:25:46+00:00,0.0,0,172.0
Partnership email,2024-11-23T00:06:04+00:00,0.0,0,172.0
Grad school letters of recommendation,2024-11-23T00:02:52+00:00,0.0,0,172.0
Internships,2024-11-23T00:01:37+00:00,0.0,0,172.0
Educ m108 disc switch,2024-11-22T23:26:14+00:00,0.0,0,172.0
looking to sublet a room winter and spring (maybe summer),2024-11-22T22:43:55+00:00,0.0,0,172.0
rooter bus ticket,2024-11-22T22:37:06+00:00,0.0,0,172.0
Doubling as Second Years?,2024-11-22T22:34:54+00:00,0.0,0,172.0
Splitting Uber to LAX 11/25 at 5pm,2024-11-22T22:21:39+00:00,0.0,0,172.0
buying rooter bus tickets,2024-11-22T22:10:13+00:00,0.0,0,172.0
Rooter bus ticket,2024-11-22T22:06:56+00:00,0.0,0,172.0
CSUDH trying to transfer to UC hopefully UCLA,2024-11-22T21:46:41+00:00,0.4019,0,172.0
Grad School Prereqs Help!,2024-11-22T21:38:08+00:00,0.0,0,172.0
Impromptu visit,2024-11-22T21:35:08+00:00,0.0,0,172.0
How dose tailgating work,2024-11-22T21:11:26+00:00,0.0,0,172.0
ucla/usc game,2024-11-22T20:54:52+00:00,0.0,0,172.0
UCLA mentioned in GNX by Kendrick Lamar???,2024-11-22T20:50:52+00:00,0.0,0,172.0
Transfer,2024-11-22T20:48:32+00:00,0.0,0,172.0
Working while going to UCLA,2024-11-22T20:41:53+00:00,0.0,0,172.0
EEB 100 and/or LS 107 disc swap,2024-11-22T20:28:17+00:00,0.0,0,172.0
Group study rooms at the geology library,2024-11-22T20:25:54+00:00,0.0,0,172.0
wtf was that chem110a exam,2024-11-22T20:07:31+00:00,-0.5859,1,172.0
to the people waiting behind me & my roommates at the study..,2024-11-22T20:06:41+00:00,0.0,0,172.0
Dropping Neuro 102,2024-11-22T19:25:35+00:00,0.0,0,172.0
UCLA vs USC Football Game Ticket,2024-11-22T19:24:29+00:00,0.0,0,172.0
exchange classes?,2024-11-22T19:00:26+00:00,0.0,0,172.0
Clear bag for the game,2024-11-22T18:59:23+00:00,0.3818,0,172.0
How feasible is it to find a subletter for spring quarter?,2024-11-22T18:07:30+00:00,0.0,0,172.0
LS30B Shevtsov,2024-11-22T17:47:52+00:00,0.0,0,172.0
A poem of encouragement…,2024-11-22T17:40:44+00:00,0.0,0,172.0
Bruin Learn down,2024-11-22T17:25:31+00:00,0.0,0,172.0
bruin learn,2024-11-22T17:20:15+00:00,0.0,0,172.0
Refund,2024-11-22T17:04:47+00:00,0.0,0,172.0
stress eating and weight gain in college?,2024-11-22T15:16:54+00:00,0.1531,0,172.0
It smell like dookie at 4am rieber,2024-11-22T12:21:41+00:00,0.3612,0,172.0
Looking to exchange Psych 124B for…,2024-11-22T10:43:25+00:00,0.0,0,172.0
"chorale vs chamber, symphony vs philharmonia vs symphonic band",2024-11-22T09:35:31+00:00,0.0,0,172.0
roommates snoring keeps me up at night,2024-11-22T08:59:45+00:00,0.0,0,172.0
looking for a rooter bus ticket willing to pay extra,2024-11-22T08:27:11+00:00,-0.1027,0,172.0
rivalry aside… fuck usc respect the custodians,2024-11-22T07:27:02+00:00,-0.1027,0,172.0
Any majors like industrial engineering?,2024-11-22T07:01:08+00:00,0.3612,0,172.0
anyone wanna ride motorcycles together?,2024-11-22T05:37:18+00:00,0.0,0,172.0
Need smoking buddies 🥲,2024-11-22T04:57:32+00:00,0.0,0,172.0
Why can’t I access my old google docs as an alumni,2024-11-22T04:54:06+00:00,0.0,0,172.0
Clubs for an 78 Y/O transfer student.,2024-11-22T04:47:32+00:00,0.0,0,172.0
Cheeked up Joe Bruin,2024-11-22T04:35:22+00:00,0.0,0,172.0
Physics 5A,2024-11-22T03:30:44+00:00,0.0,0,172.0
Bro this kid fell onto my face with his gargantuan backpack and broke my glasses,2024-11-22T03:13:35+00:00,-0.4215,0,172.0
Past astr 81 midterms/finals,2024-11-22T02:13:31+00:00,0.0,1,172.0
Looking for a single room (late Dec - late March),2024-11-22T02:01:00+00:00,0.0,0,172.0
would p/np benefit me?,2024-11-22T01:48:46+00:00,0.4588,0,172.0
Ncaa soccer,2024-11-22T01:43:32+00:00,0.0,0,172.0
Econ 145,2024-11-22T01:35:26+00:00,0.0,0,172.0
wafl?,2024-11-22T01:20:36+00:00,0.0,0,172.0
Is the Financial Wellness Training Mandatory (WIll They Put A Hold Tomorrow?),2024-11-22T00:55:22+00:00,0.4939,0,172.0
Pre-med math requirement,2024-11-22T00:33:07+00:00,0.0,0,172.0
Searching for Rooter Bus Ticket!,2024-11-22T00:26:57+00:00,0.0,0,172.0
ETHNMUS 30 w/ Taylor?,2024-11-22T00:20:26+00:00,0.0,0,172.0
I never want to hear yall complain about Rende wait times again,2024-11-22T00:20:08+00:00,-0.4063,0,172.0
Does UCLA Admit Based by Major,2024-11-21T23:56:53+00:00,0.2023,0,172.0
would we ever be able to load our bruincards to our phones?,2024-11-21T23:56:33+00:00,0.0,0,172.0
is anyone here knowledgeable with color grading I would love to learn (and pay) someone!,2024-11-21T23:53:31+00:00,0.6239,0,172.0
TWO UCLA vs USC Football Game Tickets!!!,2024-11-21T23:14:51+00:00,0.0,0,172.0
33A midterm 2 Shin :),2024-11-21T23:09:48+00:00,0.4588,1,172.0
3 Free Disneyland tickets to anyone who drops SOCIO 111,2024-11-21T22:44:20+00:00,0.5106,0,172.0
Mcat study part time enrollment + fee reduction,2024-11-21T22:39:34+00:00,0.0,0,172.0
Studying,2024-11-21T22:25:42+00:00,0.0,0,172.0
Late drop of a class. Any tips? Engineering,2024-11-21T22:24:17+00:00,-0.2732,0,172.0
Physics 5C Corbin,2024-11-21T21:57:10+00:00,0.0,0,172.0
Rooter Bus Ticket,2024-11-21T21:48:41+00:00,0.0,0,172.0
I feel like some people are against community college,2024-11-21T21:26:56+00:00,0.3612,0,172.0
Anyone want to buy my UCLA Vs. USC ticket for $50? Willing to negotiate.,2024-11-21T20:53:51+00:00,0.0772,0,172.0
FLO,2024-11-21T20:23:42+00:00,0.0,0,172.0
Declare a Major,2024-11-21T20:17:34+00:00,0.0,0,172.0
