Title,Date,sentiment,target_word_count,cost_of_living
Washington DC IQP Presentations?,2024-11-15T11:21:56+00:00,0.0,1,114.0
Help me chance,2024-11-14T18:38:59+00:00,0.25,0,114.0
Does anyone know what computers on campus have GraphPad Prism?,2024-11-14T17:35:38+00:00,0.0,0,114.0
HU Seminar E Term,2024-11-13T21:17:52+00:00,0.0,0,114.0
"Has anyone else gotten a letter in the mail about an ""event"" that compromised our information?",2024-11-13T20:53:52+00:00,0.0,0,114.0
Former WPI Prez Laurie Leshin Announces NASA JPL Mass Layoffs,2024-11-13T20:14:09+00:00,0.0,0,114.0
How do I drop a class?,2024-11-13T04:07:04+00:00,-0.2732,0,114.0
Where do you add first marking period grades?,2024-11-13T02:31:04+00:00,0.0,0,114.0
WPI needs to do better at supporting women.,2024-11-13T02:07:25+00:00,0.7003,0,114.0
Wpi Insurance,2024-11-12T18:39:34+00:00,0.0,0,114.0
Review of MA 511 Applied Statistics?,2024-11-12T06:39:44+00:00,0.0,0,114.0
CS 3013 vs CS 3431,2024-11-11T20:51:50+00:00,0.0,0,114.0
HUA Seminar,2024-11-11T19:42:50+00:00,0.0,0,114.0
Need Course Tea,2024-11-11T16:21:35+00:00,0.0,0,114.0
Rec Center Pool Heated?,2024-11-10T03:56:10+00:00,0.0,0,114.0
Current/former part time adjunct instructors at WPI- were you able to negotiate your pay? What was the process like for finding the position in your experience?,2024-11-09T04:29:31+00:00,0.3527,0,114.0
Professor accusing our group of using AI- What do I do?,2024-11-08T13:15:40+00:00,-0.1779,0,114.0
The WPI Subreddit Seem Clean Of Election Complaining,2024-11-07T22:59:06+00:00,0.2263,0,114.0
CS/ECE Double Major - Courses Help,2024-11-07T15:46:01+00:00,0.0,0,114.0
Help with applying to graduate school,2024-11-07T08:22:41+00:00,0.0,0,114.0
CS Majors: Systems Prog Concepts and Machine Org vs. Discrete Mathematics and Algorithms?,2024-11-06T17:43:26+00:00,0.0,0,114.0
Human Sexuality Survey,2024-11-05T20:08:52+00:00,0.0,0,114.0
Wishing You All The Best This Week!,2024-11-04T16:57:30+00:00,0.75,0,114.0
