name,location,subreddit,subscribers,cost_of_living
University of Delaware,"Newark, Delaware, United States",udel,6016,117.0
University of Denver,"Denver, Colorado, United States",denveru,1054,133.0
University of Florida,"Gainesville, Florida, United States",ufl,45658,95.0
University of Georgia,"Athens, Georgia, United States",UGA,32234,97.0
University of Guelph,"Guelph, Ontario, Canada",uoguelph,16469,97.0
University of Hartford,"West Hartford, Connecticut, United States",uhart,307,125.0
University of Hawaii,"Honolulu, Hawaii, United States",UniversityofHawaii,3022,185.0
University of Houston,"Houston, Texas, United States",UniversityOfHouston,40312,101.0
University of Houston-Downtown,"Houston, Texas, United States",uhd,1305,101.0
University of Idaho,"Moscow, Idaho, United States",uofi,1703,108.0
University of Illinois at Chicago,"Chicago, Illinois, United States",uichicago,15223,114.0
University of Illinois at Urbana-Champaign,"Urbana-Champaign, Illinois, United States",UIUC,97247,
University of Iowa,"Iowa City, Iowa, United States",uiowa,8226,104.0
University of Kansas,"Lawrence, Kansas, United States",UniversityofKansas,7408,98.0
University of Kentucky,"Lexington, Kentucky, United States",UniversityofKentucky,7392,
University of Louisiana-Lafayette,"Lafayette, Louisiana, United States",ragincajuns,1410,98.0
University of Louisville,"Louisville, Kentucky, United States",AllHail,3716,97.0
University of Manitoba,"Winnipeg, Manitoba, Canada",umanitoba,21225,78.0
University of Mary Washington,"Fredericksburg, VA, United States",UMW,1041,132.0
University of Maryland,"College Park, Maryland, United States",UMD,53678,133.0
University of Maryland-Baltimore County,"Baltimore, Maryland, United States",UMBC,9022,102.0
University of Massachusetts-Amherst,"Amherst, Massachusetts, United States",umass,22510,
University of Massachusetts-Dartmouth,"Dartmouth, Massachusetts, United States",umassd,394,
University of Massachusetts-Lowell,"Lowell, Massachusetts, United States",uml,4791,128.0
University of Memphis,"Memphis, Tennessee, United States",UofMemphis,1542,86.0
University of Miami,"Coral Gables, Florida, United States",UMiami,5138,187.0
University of Michigan,"Ann Arbor, Michigan, United States",uofm,58930,122.0
University of Minnesota,"Minneapolis, Minnesota, United States",uofmn,30522,108.0
University of Minnesota Duluth,"Duluth, Minnesota, United States",UofMnDuluth,411,100.0
University of Mississippi,"Oxford, Mississippi, United States",olemiss,8998,101.0
University of Missouri,"Columbia, Missouri, United States",mizzou,11906,98.0
University of Missouri: Kansas City,"Kansas City, Missouri, United States",UMKC,1354,94.0
University of Montana,"Missoula, Montana, United States",UMT,186,109.0
University of Montevallo,"Montevallo, Alabama, United States",Montevallo,340,93.0
University of Nebraska-Lincoln,"Lincoln, Nebraska, United States",UNLincoln,1767,98.0
"University of Nevada, Las Vegas","Paradise, Nevada, United States",UNLV,13522,106.0
"University of Nevada, Reno","Reno, Nevada, United States",unr,8844,123.0
University of New Hampshire,"Durham, New Hampshire, United States",unh,2763,134.0
University of New Mexico,"Albuquerque, New Mexico, United States",unm,3851,100.0
University of North Carolina Chapel Hill,"Chapel Hill, North Carolina, United States",tarheels,10313,128.0
University of North Carolina Charlotte,"Charlotte, North Carolina, United States",UNCCharlotte,17158,108.0
University of North Carolina Greensboro,"Greensboro, North Carolina, United States",UNCG,2392,93.0
University of North Carolina Wilmington,"Wilmington, North Carolina, United States",UNCW,3505,109.0
University of North Dakota,"Grand Forks, North Dakota, United States",und,1694,99.0
University of North Florida,"Jacksonville, Florida, United States",UNF,3678,98.0
University of North Texas,"Denton, Texas, United States",unt,25738,115.0
University of Northern British Columbia,"Prince George, British Columbia, Canada",UNBC,603,86.0
University of Northern Iowa,"Cedar Falls, Iowa, United States",UNI,1448,93.0
University of Notre Dame,"Notre Dame, Indiana, United States",notredame,16644,88.0
University of Oklahoma,"Norman, Oklahoma, United States",sooners,24959,94.0
University of Ontario Institute of Technology,"Oshawa, Ontario, Canada",uoit,3361,93.0
University of Ottawa,"Ottawa, Ontario, Canada",geegees,32427,92.0
University of Pennsylvania,"Philadelphia, Pennsylvania, United States",UPenn,28205,102.0
University of Pittsburgh,"Pittsburgh, Pennsylvania, United States",Pitt,30355,95.0
University of Redlands,"Redlands, California, United States",universityofredlands,319,140.0
University of Regina,"Regina, Saskatchewan, Canada",University_Of_Regina,1397,89.0
University of Rochester,"Rochester, New York, United States",URochester,5042,89.0
University of San Diego,"San Diego, California, United States",USD,1121,168.0
University of San Francisco,"San Francisco, California, United States",usfca,1923,237.0
University of Saskatchewan,"Saskatoon, Saskatchewan, Canada",usask,10121,90.0
University of Scranton,"Scranton, Pennsylvania, United States",universityofscranton,247,89.0
University of South Carolina,"Columbia, South Carolina, United States",Gamecocks,19858,100.0
University of South Florida,"Tampa, Florida, United States",USF,26415,107.0
University of Southern California,"Los Angeles, California, United States",USC,53789,172.0
University of Southern Indiana,"Vanderburgh County, Indiana, United States",USI,268,
University of St. Thomas,"Houston, Texas, United States",stthomas,282,101.0
University of Tennessee - Knoxville,"Knoxville, Tennessee, United States",UTK,17526,89.0
University of Texas - Austin,"Austin, Texas, United States",UTAustin,85940,120.0
University of Texas - Dallas,"Richardson, Texas, United States",utdallas,32565,125.0
University of Texas - El Paso,"El Paso, Texas, United States",UTEP,1976,89.0
University of Texas - Pan-American,"Edinburg, Texas, United States",UTPA,248,86.0
University of Texas - San Antonio,"San Antonio, Texas, United States",UTSA,23996,95.0
University of Toledo,"Toledo, Ohio, United States",UniversityOfToledo,503,87.0
University of Toledo,"Toledo, Ohio, United States",UniversityOfToledo,503,87.0
University of Toronto,"Toronto, Ontario, Canada",UofT,121902,114.0
University of Tulsa,"Tulsa, Oklahoma, United States",utulsa,1096,90.0
University of Utah,"Salt Lake City, Utah, United States",uofu,11521,122.0
University of Vermont,"Burlington, Vermont, United States",UniversityofVermont,6182,124.0
University of Victoria,"Victoria, British Columbia, Canada",uvic,35674,101.0
University of Virginia,"Charlottesville, Virginia, United States",UVA,28220,119.0
University of Washington,"Seattle, Washington, United States",udub,54401,180.0
University of Washington | Bothell,"Bothell, Washington, United States",uwb,2051,164.0
University of Waterloo,"Waterloo, Ontario, Canada",uwaterloo,99696,98.0
University of West Georgia,"Carrollton, Georgia, United States",UWG,614,95.0
University of Western Ontario,"London, Ontario, Canada",uwo,35719,93.0
University of Windsor,"Windsor, Ontario, Canada",UWindsor,5971,87.0
University of Wisconsin - Eau Claire,"Eau Claire, Wisconsin, United States",UWEauClaire,569,98.0
University of Wisconsin Green Bay,"Green Bay, Wisconsin, United States",uwgb,75,91.0
University of Wisconsin Madison,"Madison, Wisconsin, United States",UWMadison,39231,115.0
University of Wisconsin Milwaukee,"Milwaukee, Wisconsin, United States",UWMilwaukee,4863,93.0
University of Wisconsin Whitewater,"Whitewater, Wisconsin, United States",UWWhitewater,605,101.0
University of Wyoming,"Laramie, Wyoming, United States",uwyo,1042,101.0
University of the Fraser Valley,"Abbotsford, British Columbia, Canada",UFV,1895,101.0
University of the Pacific,"Stockton, California, United States",UoP,483,125.0
Utah Valley University,"Orem, Utah, United States",UVU,2410,114.0
Vancouver Island University,"Nanaimo, British Columbia, Canada",VIU,1376,94.0
Vanderbilt University,"Nashville, Tennessee, United States",Vanderbilt,9609,108.0
Vassar College,"Poughkeepsie, New York, United States",vassar,1245,113.0
Ventura County Community Colleges,"Ventura, California, United States",vcccd,54,
Villanova University,"Villanova, Pennsylvania, United States",villanova,6072,
Virginia Commonwealth University,"Richmond, Virginia, United States",vcu,14708,108.0
Virginia Tech,"Blacksburg, Virginia, United States",VirginiaTech,45839,114.0
Wake Forest University,"Winston-Salem, North Carolina, United States",wfu,2048,95.0
Wake Technical Community College,"Raleigh, North Carolina, United States",WakeTech,1498,111.0
Washington State University,"Pullman, Washington, United States",wsu,16174,114.0
Washington University in St. Louis,"St. Louis, Missouri, United States",washu,11529,90.0
Wayne State University,"Detroit, Michigan, United States",waynestate,4641,84.0
Wellesley College,"Wellesley, Massachusetts, United States",WellesleyCollege,727,242.0
Wentworth Institute of Technology,"Boston, Massachusetts, United States",WIT,2,166.0
Wesleyan University,"Middletown, Connecticut, United States",Wesleyan,1424,112.0
West Chester University,"West Chester, Pennsylvania, United States",wcupa,1084,130.0
West Liberty University,"West Liberty, West Virginia, United States",westliberty,41,99.0
West Texas A&M University,"Canyon, Texas, United States",wtamu,283,92.0
West Virginia University,"Morgantown, West Virginia, United States",WVU,13062,99.0
Western Carolina University,"Cullowhee, North Carolina, United States",WCU,1594,111.0
Western Connecticut State University,"Danbury, Connecticut, United States",Wcsu,123,128.0
Western Governors University,"Salt Lake City, Utah, United States",WGU,132154,122.0
Western Kentucky University,"Bowling Green, Kentucky, United States",WKU,2296,94.0
Western Michigan University,"Kalamazoo, Michigan, United States",WMU,3920,86.0
Western Washington University,"Bellingham, Washington, United States",WWU,13952,138.0
Westminster College SLC,"Salt Lake City, Utah, United States",WestminsterCollege,43,122.0
Westmont College In Santa Barbara,"Santa Barbara, California, United States",Westmont,99,221.0
Wheaton College,"Wheaton, Illinois, United States",Wheaton,328,127.0
Widener University,"Chester, Pennsylvania, United States",Widener,198,89.0
Wilfrid Laurier University,"Waterloo, Ontario, Canada",wlu,22695,98.0
Williams College,"Williamstown, Massachusetts, United States",WilliamsCollege,2061,123.0
Worcester Polytechnic Institute,"Worcester, Massachusetts, United States",WPI,9001,114.0
Wright State University,"Fairborn, Ohio, United States",wrightstate,911,92.0
Yale University,"New Haven, Connecticut, United States",yale,17665,112.0
York University in Toronto,"Toronto, Ontario, Canada",yorku,49417,114.0
