Title,Date
NATS 1560 Quiz 3 Help,2024-10-15T22:14:46+00:00
PSYC 4080 Course 2024,2024-10-15T21:55:43+00:00
"Took a long break from school to work on mental health and now their saying i cant rejoin, is there anything i can do?",2024-10-15T21:24:28+00:00
Can I still claim 3 convocation guest tickets if I only booked 1?,2024-10-15T21:10:48+00:00
Looking for Halloween Parties/Motives?,2024-10-15T20:36:24+00:00
Do they call the doctors office?,2024-10-15T20:27:53+00:00
On campus addiction help,2024-10-15T20:27:03+00:00
YMA First Year Case Comp,2024-10-15T20:23:22+00:00
POLS 3686 - Opinions.,2024-10-15T18:55:57+00:00
The whole campus smells like French fries,2024-10-15T14:51:36+00:00
Dumb question; am I supposed to use pen or pencils on exams?,2024-10-15T14:22:42+00:00
Is the human resource certificate program worth it?,2024-10-15T13:07:03+00:00
What are some good career options and degrees to do at York? So after undergrad I can get job,2024-10-15T12:41:08+00:00
PSYC3430: Behaviour In Groups - Help,2024-10-15T06:13:04+00:00
Hey veteran YorkU-er’s how long have you been in a/this post secondary institution for now?,2024-10-15T05:49:48+00:00
Is There any clubs in york?,2024-10-15T03:53:17+00:00
Halloween parties this year,2024-10-15T02:52:46+00:00
Chem1000 help (urgent),2024-10-15T02:42:41+00:00
Is there a whatsapp groupchat for ECON 2400 for this year?,2024-10-14T23:18:22+00:00
Biol 1000 Course Notes,2024-10-14T18:44:49+00:00
anyone else having trouble login into eclass/passport york,2024-10-14T18:18:46+00:00
Oct Grad - live broadcast?,2024-10-14T17:57:59+00:00
Does receiving a student ID mean I got accepted?,2024-10-14T17:53:52+00:00
Bcom at York with accounting major worth it ?,2024-10-14T17:49:31+00:00
LASSONDE SCHOLARSHIP,2024-10-14T16:35:45+00:00
Concurrent education options please help,2024-10-14T15:48:23+00:00
I have the most amazing idea,2024-10-14T10:04:55+00:00
"ISO convocation ceremony passes for Wed 16 , 10 30 am ceremony.",2024-10-14T06:16:39+00:00
ISO extra ceremony #3 grad tickets!! (October 17th 10:30AM) will pay!!,2024-10-14T03:58:18+00:00
Can I minor in Film while at Schulich?,2024-10-13T23:32:13+00:00
Still looking to buy 3 convocation tickets for October 16th ceremony at 10:30 AM,2024-10-13T23:13:01+00:00
Study for ADMS 1010 mid,2024-10-13T22:41:10+00:00
Teammate using ChatGPT,2024-10-13T21:37:10+00:00
How is the mental health counselling here at york?,2024-10-13T21:21:46+00:00
1019 Exam Help Section E,2024-10-13T19:01:57+00:00
this is the sign you've been waiting for,2024-10-13T16:29:44+00:00
biomedical sciences vs kinesiology vs psychology,2024-10-13T15:57:02+00:00
Looking for a tennis player,2024-10-13T06:12:02+00:00
Main convo of the year?,2024-10-13T05:19:20+00:00
Billed for textbook,2024-10-13T05:18:31+00:00
Deciding York Or TMU,2024-10-13T05:15:23+00:00
Can we do a phd in psychology with a BA in psychology?,2024-10-13T05:07:21+00:00
Looking to buy 2 tickets for October 16 Convocation at 10:30 AM,2024-10-13T02:36:53+00:00
ITEC 2620 or ADMS 2510?,2024-10-13T01:58:18+00:00
Assingment due during reading week,2024-10-12T21:06:46+00:00
Practice questions for 1028 with George Tourlakis,2024-10-12T19:55:09+00:00
Where can i find a halloween shop near york?,2024-10-12T19:50:38+00:00
Oct Graduation Tickets,2024-10-12T18:17:37+00:00
EECS Preq course code doesn't exist anymore??,2024-10-12T16:47:09+00:00
How to get an A in 1019,2024-10-12T14:25:57+00:00
anti/pro censorship posters?,2024-10-12T09:57:18+00:00
Advice Needed: RISK OF UNENROLLMENT at YorkU (Glendon),2024-10-12T06:41:03+00:00
Looking for someone to tag along with,2024-10-12T05:20:29+00:00
MATH 1019 Practice tests,2024-10-11T22:58:33+00:00
Any girls in bethune college interested in joining semi-comp VB?,2024-10-11T20:29:56+00:00
What are the best courses for a good job?,2024-10-11T20:16:25+00:00
Does anybody know if the posters they are selling at Vari hall take debit,2024-10-11T19:41:14+00:00
Global health & Biology,2024-10-11T18:19:23+00:00
6 credit course in a semester,2024-10-11T18:14:02+00:00
Trading 2 Coldplay tickets for 2 Taylor swift tickets (Toronto),2024-10-11T16:50:02+00:00
Looking for a cheap/secondhand vacuum,2024-10-11T15:44:12+00:00
First exam on linear algebra(math 1025),2024-10-11T14:53:10+00:00
MATH 1028 w George Tourlakis,2024-10-11T13:58:34+00:00
Lost Item Found in Scott,2024-10-11T13:02:49+00:00
What to do when encountering coyotes?,2024-10-11T12:59:26+00:00
Sciences for CS vs CS for Software Development,2024-10-11T09:18:05+00:00
Help With Financial Aid,2024-10-11T05:37:02+00:00
Course Credit Exclusion,2024-10-11T04:50:12+00:00
how to get with baddies and daddies from yorku,2024-10-11T04:28:11+00:00
Is the bookstore open during reading week?,2024-10-11T03:45:13+00:00
"Failed my midterm, idk what to do",2024-10-11T00:26:30+00:00
What is happening on keele campus rn?,2024-10-11T01:09:30+00:00
Need pic of posters from campus,2024-10-11T00:38:45+00:00
are there any kpop stans ?,2024-10-10T22:09:44+00:00
Is there a winter break?,2024-10-10T22:04:00+00:00
MATH 1019 Practice tests,2024-10-10T21:32:22+00:00
Switch Chem 2020 lab section,2024-10-10T18:12:07+00:00
Good physiotherapists and massage therapists near campus,2024-10-10T18:08:52+00:00
Will the campus buildings be accessible on thanksgiving day ?,2024-10-10T17:44:27+00:00
How to talk to girls?,2024-10-10T16:29:00+00:00
Course disappeared on eclass,2024-10-10T15:55:25+00:00
Missed midterm for MATH 1013,2024-10-10T15:51:05+00:00
Campus jobs?????????,2024-10-10T14:43:18+00:00
I failed the entirety of first year,2024-10-10T14:39:51+00:00
Winter 2025 Computer Engineering,2024-10-10T12:46:48+00:00
PHYS1510 Course Midterm 🥲,2024-10-10T12:39:01+00:00
Who to contract if you got scammed?,2024-10-10T08:23:40+00:00
Help!!!! Got accepted into Carleton and York for Cognitive Science undergrad degree,2024-10-10T07:56:10+00:00
Anyone taking bus route 939b to finch west station?,2024-10-10T04:45:49+00:00
york dental plan????,2024-10-10T04:07:30+00:00
how to stay up to study for a exam?,2024-10-10T03:23:40+00:00
Math1025 B- looking for class mates,2024-10-10T03:20:17+00:00
Is the courses in Winter 2025 Semester the same as the ones I can apply for in first semester?,2024-10-10T01:22:11+00:00
MATH1013 - TEST 1 REVIEWS,2024-10-10T00:16:16+00:00
all the profs for EECS 1520 are terrible,2024-10-10T00:11:11+00:00
thoughts on kine 2011 midterm 1,2024-10-10T00:01:37+00:00
Scholarships/ money for commute,2024-10-09T20:59:25+00:00
How do you apply for supplementary application for the York Design Program?,2024-10-09T20:51:22+00:00
CLTR 2610/HUMA 2230: Music in Human Experience,2024-10-09T20:45:13+00:00
Cats cats cats cats!,2024-10-09T20:38:10+00:00
Why does my YU card not have photo?,2024-10-09T20:15:41+00:00
kine 3020 midterm exam,2024-10-09T20:06:33+00:00
Can York Remove Me From A Course with Conflict?,2024-10-09T19:09:13+00:00
Internet being spotty,2024-10-09T19:04:00+00:00
AI searching skills and studying,2024-10-09T19:00:11+00:00
What date is the graduation ceremony for Kinesiology students in June 2025?,2024-10-09T18:07:55+00:00
Is eclass down right now?,2024-10-09T17:03:08+00:00
So is this Dan the Man stuff all over?,2024-10-09T16:16:13+00:00
Math1025 linear algebra,2024-10-09T14:48:32+00:00
Lost pencil case and notebook,2024-10-09T14:34:43+00:00
Heating in Stong res?,2024-10-09T12:49:40+00:00
Math 2030 section B-lecture notes,2024-10-09T12:27:29+00:00
From the screen 💻 to the ring 🥊 to the PEN 🖊️ to the king 🤴 wheres my crown 👑 thats my bling 💎 always trouble when i reign 😈,2024-10-09T11:27:51+00:00
Is it easy to get in to the masters program for psychology?,2024-10-09T06:35:13+00:00
Study Tips for psychology majors please,2024-10-09T06:34:00+00:00
College Transfer Credits?,2024-10-09T05:56:08+00:00
I'm sick. Can't attend mandatory workshop 'artist in residence' (I'm a music student). Will I fail my class because of it?,2024-10-09T05:31:19+00:00
Money minded friends,2024-10-09T04:09:08+00:00
ECLASS INACCESSIBILITY,2024-10-09T03:41:53+00:00
how to ace chem 1000 exam worth 55%,2024-10-09T03:37:13+00:00
Help to sign up for WeChat,2024-10-09T03:15:54+00:00
What was the math2930 midterm,2024-10-09T03:05:26+00:00
What should my next move be,2024-10-09T02:22:45+00:00
are overnight guests allowed over reading week,2024-10-09T01:49:49+00:00
What’s up with York’s Bursary/Scholarship portal?,2024-10-09T00:25:39+00:00
Lassonde Program Change,2024-10-08T23:53:51+00:00
calc 1 test 1,2024-10-08T23:31:50+00:00
help with making changes on OSAP,2024-10-08T22:57:50+00:00
IB Admission at YorkU?,2024-10-08T22:45:10+00:00
Engineering mature student prerequisite credit acquisition deadlines,2024-10-08T22:21:14+00:00
Printing on Keele Campus,2024-10-08T17:46:24+00:00
Anyone know where I could get flowers close to Keele campus?,2024-10-08T16:09:41+00:00
I really need friends. ( Engineering),2024-10-08T15:17:32+00:00
is the william small tim hortons actually closed?,2024-10-08T14:29:22+00:00
How do I find guys at York,2024-10-08T13:57:57+00:00
How to do well in statistics? Stats 1 and stats 2 of psyc2020,2024-10-08T10:58:32+00:00
How long does it take to mark midterms?,2024-10-08T10:43:39+00:00
Young Alumni Fall Mixer,2024-10-08T10:03:12+00:00
