Title,Date
Complementary Studies,2024-11-02T18:38:58+00:00
Res gardening girlie,2024-11-02T18:26:52+00:00
very urgent drop course,2024-11-02T18:09:32+00:00
NATS 1745 Group Chat,2024-11-02T17:59:49+00:00
I do not know what to do..,2024-11-02T17:33:39+00:00
EECS 2030 prof which is better marzieh ahmadzadeh or petros faloutsos. Which one has easier labtest in specific.,2024-11-02T17:01:11+00:00
Are there any York alumni who ended up going to grad school at a prestigious university?,2024-11-02T16:23:25+00:00
Dropping out and Cancelling Osap application,2024-11-02T16:20:26+00:00
can i major in something like health studies/public health and pivot to nursing later,2024-11-02T14:07:16+00:00
Internship Opportunities,2024-11-02T09:02:34+00:00
OCD and Accommodations,2024-11-02T06:29:11+00:00
Anyone wanna play animal crossing with me??,2024-11-02T04:26:28+00:00
"Starting Bsc cs hons in january, God willing.",2024-11-02T01:52:37+00:00
"Just Applied to Graduate, What Now?",2024-11-02T00:28:27+00:00
Which Business course to take as an elective,2024-11-02T00:20:18+00:00
Accepted into beD program at york already?,2024-11-02T00:16:55+00:00
Can I still attend the York University Open House Campus Day tomorrow if I didn't sign up?,2024-11-02T00:14:11+00:00
psychology bsc math requirement,2024-11-01T22:37:59+00:00
Are we allowed to get a copy of a previous final exam,2024-11-01T22:09:40+00:00
Death of Banana Man?,2024-11-01T21:36:47+00:00
The Joys of Parking at York,2024-11-01T21:25:12+00:00
2nd entry nursing schedules??,2024-11-01T20:48:11+00:00
Chem 1000 Section A!!!,2024-11-01T20:41:26+00:00
Med school research,2024-11-01T20:29:23+00:00
Continued Education - Questions as a Career Path Change,2024-11-01T19:11:08+00:00
"Prospective Students, Think Twice About York University’s Accounting Program (LA&PS)",2024-11-01T19:05:42+00:00
"If you took Math 1310, did you get a curve or flat boost?",2024-11-01T18:18:40+00:00
June 2025 Grad Portrait,2024-11-01T17:18:25+00:00
Are the any other professors that teach EECS 1022?,2024-11-01T16:56:33+00:00
Mentally tired of getting below average,2024-11-01T15:56:38+00:00
Im thinking about switching my major. HOW😭🙏🏾,2024-11-01T15:49:21+00:00
Osgoode Admission Question,2024-11-01T15:33:05+00:00
A New Way to Order Food on Campus! 🍔🍕🍣 yorku.orderyaha.com,2024-11-01T15:24:54+00:00
York MATH 1505 2020-21,2024-11-01T11:59:33+00:00
Phil2100 intro to logic help,2024-11-01T04:08:26+00:00
Accepted to CS (BSc) Lassonde,2024-11-01T03:39:56+00:00
Applied Mathematics vs Mathematics double major,2024-11-01T03:20:38+00:00
Math and Chem help on campus.,2024-11-01T03:14:26+00:00
Motorcycle Idiots Doing Laps,2024-11-01T01:49:15+00:00
Advice for Contracts class (Swan),2024-11-01T00:11:09+00:00
Those in the MHIA program,2024-10-31T23:09:03+00:00
What is counted as a Mathematics program？,2024-10-31T23:00:45+00:00
Anywhere to buy poppies on campus?,2024-10-31T22:52:30+00:00
Is BJJ here beginner friendly and casual?,2024-10-31T22:51:46+00:00
Why can't specialized honours student have a minor?,2024-10-31T22:42:24+00:00
"Who to put for ""Verifier"" for Academic Awards?",2024-10-31T22:11:18+00:00
Math 2271 York University,2024-10-31T21:50:28+00:00
Art Students! Does campus offer you anything?,2024-10-31T21:39:21+00:00
Business and psychology double major?,2024-10-31T20:29:55+00:00
Single room in founders available,2024-10-31T20:16:35+00:00
Please help me decide what steps to take,2024-10-31T18:27:36+00:00
Im building an online platform for students in tech & Ai that want to build and collaborate on innovative projects !,2024-10-31T18:16:02+00:00
How hard is work/school balance?,2024-10-31T17:01:36+00:00
Gordon Freeman where are you..,2024-10-31T16:29:34+00:00
any current osgoode students willing to glance over my personal statement before its due tmrw?,2024-10-31T16:21:04+00:00
GDIP ACCOUNTING WINTER 2025,2024-10-31T15:03:03+00:00
DANC 1900 or THEA 2060,2024-10-31T09:05:35+00:00
LSAT Prep Study Group,2024-10-31T07:23:15+00:00
Econ 1000 make up exam,2024-10-31T05:49:11+00:00
There's a real gnome war under Vari Hall,2024-10-31T03:35:58+00:00
adms 1500 whatsapp gc,2024-10-31T03:21:59+00:00
Adding a Chem 1001 to Winter Term,2024-10-31T01:55:05+00:00
Markham campus building hours,2024-10-31T01:49:48+00:00
Worlds of Ancient Greece and Rome,2024-10-31T01:47:04+00:00
r people wearing their costumes tmrrw?,2024-10-31T01:45:57+00:00
Missed volunteer fair,2024-10-31T01:37:52+00:00
Soccer community at uni ⚽️,2024-10-31T01:30:56+00:00
May we have a public sand bath at YorkU???,2024-10-31T00:33:41+00:00
Psyc 2120 professors,2024-10-31T00:04:55+00:00
Anyone throwing any Halloween parties this weekend?,2024-10-30T23:56:33+00:00
"Hi, I’m lonely and need friends",2024-10-30T23:20:25+00:00
Horrible ITEC 2610 midterm,2024-10-30T22:28:02+00:00
bergeron room 317 !?,2024-10-30T22:25:38+00:00
"What's the fastest PC at York? (I know that all students can use the engineering labs, nursing labs, and some others.)",2024-10-30T21:58:05+00:00
Why does my term project mark say 0,2024-10-30T21:42:48+00:00
Parking Ticket Yorku,2024-10-30T21:12:26+00:00
AI and related stuff,2024-10-30T20:44:09+00:00
Chem1000 midterm test1,2024-10-30T20:31:14+00:00
Turn the AC on for exams …..,2024-10-30T20:01:10+00:00
Anyone hear back from admissions yet for winter semester?,2024-10-30T19:52:10+00:00
Missed midterm essay,2024-10-30T04:22:27+00:00
The Quad at York questions,2024-10-30T01:49:03+00:00
EECS 1520 test weight,2024-10-30T19:02:50+00:00
Transfer to TMU Business Management from York Bcom,2024-10-30T18:02:23+00:00
Past exams for 1014 and 1019?,2024-10-30T17:58:23+00:00
Any study space recommendations at keele campus?,2024-10-30T17:27:17+00:00
dming girls = no rizz,2024-10-30T16:44:46+00:00
Curtis Hall Starbucks Scam,2024-10-30T16:25:00+00:00
I need help with understanding acedemic warnings,2024-10-30T16:19:50+00:00
third or fourth year bird courses?,2024-10-30T15:48:36+00:00
Selling MacBook Pro i5,2024-10-30T14:47:29+00:00
Does anyone know any psychology related volunteer opportunities,2024-10-30T14:18:14+00:00
Prof asked for meeting about exam,2024-10-30T14:00:39+00:00
Social events at york,2024-10-30T07:46:16+00:00
Willow reader only reading out title,2024-10-30T07:00:10+00:00
Zotero - References List,2024-10-30T06:43:26+00:00
overcoming depression around pre med,2024-10-30T05:13:33+00:00
Halloween parties in toronto?,2024-10-30T02:45:50+00:00
Keele-Glendon Shuttle,2024-10-30T02:15:32+00:00
Duo mobile verification,2024-10-30T01:14:02+00:00
"Missed a lab, now what?",2024-10-30T00:19:02+00:00
Graduation appication,2024-10-30T00:01:23+00:00
Tried talking to a girl on campus and failed,2024-10-29T23:26:21+00:00
Is it possible to transfer to different university after completing few semesters of bcom ?,2024-10-29T23:20:29+00:00
What to do after I missed an exam?,2024-10-29T22:26:15+00:00
PSYC 2030 w/ Prof Rebecca Jubis - HOW TO DO WELL IN HER EXAMS AND IN-CLASS ASSIGNMENT,2024-10-29T20:48:39+00:00
How Hard is it to Get Into Trent or Western for the BEd Program?,2024-10-29T20:17:25+00:00
Blow your nose PLEASE,2024-10-29T19:48:16+00:00
Computer science or software engineering?,2024-10-29T19:42:51+00:00
Halloween parties on campus,2024-10-29T19:12:07+00:00
Has anyone taken HH/PSYC 2220 3.00 - Sensation and Perception I?,2024-10-29T18:45:12+00:00
How Do I Get an Official Digital Letter Confirming My Enrollment in My Current Program?,2024-10-29T17:06:08+00:00
deakins uni - australia,2024-10-29T16:59:51+00:00
Where can I park my car for cheap at Keele campus,2024-10-29T16:50:10+00:00
Psychology Course Enrollment Questions,2024-10-29T16:38:20+00:00
Loud people in the Scott library,2024-10-29T16:29:33+00:00
ICC (cult) on campus (Rise Ministries),2024-10-29T16:20:49+00:00
Midterm id troubles.,2024-10-29T16:01:23+00:00
do i have to pay for hot water at central square?,2024-10-29T15:50:57+00:00
Part/Full time job available at California Sandwiches on Chesswood,2024-10-29T15:49:08+00:00
How did you ask for reference letters?,2024-10-29T15:35:14+00:00
What degree are you working towards/did you get and what made you choose that?,2024-10-29T15:32:20+00:00
Proof of Citizenship,2024-10-29T14:42:51+00:00
Am i cooked for kine 2031,2024-10-29T13:49:36+00:00
ADMS 4536 or ADMS 4537,2024-10-29T13:40:05+00:00
*Still recruiting* for research study: Are you considering starting the birth control pill?,2024-10-29T13:15:31+00:00
"who hurt you, what did this prof do",2024-10-29T11:06:30+00:00
Taking courses at another institution,2024-10-29T06:02:43+00:00
Any chess fans at York?,2024-10-29T04:41:59+00:00
Yorku’s Social Club 💗,2024-10-29T03:48:48+00:00
Biology Research Practicum,2024-10-29T01:57:10+00:00
receiving deliveries on campus from penguin pickup?,2024-10-28T22:57:38+00:00
Econ 1530 Study Sessions at Scott Library - Exam Prep for Nov 2nd!,2024-10-28T22:42:20+00:00
Any BADMINTON Players?,2024-10-28T22:09:53+00:00
accessibility services have just postponed my exam??,2024-10-28T20:48:09+00:00
Dropped a course but still on eclass,2024-10-28T20:40:16+00:00
Second degree student questions,2024-10-28T19:37:14+00:00
Regenesis Borrowing Centre,2024-10-28T19:31:35+00:00
What’s your favourite small business in/around campus?,2024-10-28T19:03:20+00:00
colleges cafeteria / food spots,2024-10-28T18:04:56+00:00
Is there no Halloween party going on bro,2024-10-28T17:53:21+00:00
Is it just me or is the Wifi incredibly slow and keeps disconnecting?,2024-10-28T17:44:51+00:00
Wtf is going on with awards and bursaries,2024-10-28T17:33:59+00:00
geog 3900 with prof joshua?,2024-10-28T17:24:49+00:00
Lassonde Co-op Discord?/Question about the eclass,2024-10-28T16:38:29+00:00
Bro changed shoes for extra torque,2024-10-28T16:16:14+00:00
Is anyone here into sewing garments as a hobby? I wanted to make an informal group of seamstresses/seamsters! For learning and socializing purposes :),2024-10-28T15:47:30+00:00
Bcomm current standing,2024-10-28T15:37:14+00:00
Do I have to pay winter semester now,2024-10-28T15:16:18+00:00
What are some good evening courses for non science,2024-10-28T14:52:58+00:00
Past exams for 1014 and 1019?,2024-10-28T05:06:10+00:00
Housing at York university,2024-10-28T04:53:37+00:00
Dorm halloween parties,2024-10-28T02:55:17+00:00
How will the first year schedule work if I'm transferring with credits ?,2024-10-28T02:12:38+00:00
Is there anything I can do?,2024-10-28T02:06:54+00:00
Graduate Application Help,2024-10-27T22:24:06+00:00
Kine 2049 text book note!!,2024-10-27T21:05:01+00:00
Changing major requirements,2024-10-27T18:33:13+00:00
Struggling with Discrete Math 1019 with Andy - Any Advice to Just Pass?,2024-10-27T14:25:25+00:00
Eecs3405 - fundamentals of machine learning,2024-10-27T08:05:34+00:00
YorkU Funding HELP!!,2024-10-27T02:10:48+00:00
Econ 1000 midterm tomorrow,2024-10-26T22:58:02+00:00
To do final worth 50% or just take my chances with the midterm?,2024-10-26T21:53:09+00:00
Help For Assignment 2 Konstantinos Section Math 1090,2024-10-26T20:46:32+00:00
Professor Jennifer Ruttle,2024-10-26T20:33:01+00:00
Selling NOTES for anatomy KINE 2031,2024-10-26T17:25:28+00:00
Econ 1000 questions: Help :(,2024-10-26T04:48:08+00:00
How to feasibly do a second degree?,2024-10-26T04:47:35+00:00
Those who've gotten a 90+ in Psych1010?,2024-10-26T03:15:48+00:00
is there anyone in SOSC 1801 can share their notes😭,2024-10-26T03:05:42+00:00
Look for past EECs 1300 test,2024-10-26T02:48:02+00:00
textbook payment interest fees,2024-10-26T01:57:59+00:00
Likelihood of enrolling in chem 2021,2024-10-25T22:06:03+00:00
Can I Pay Part of My Tuition with a credit card,2024-10-25T21:11:15+00:00
Lost Drivers License 💀,2024-10-25T21:02:03+00:00
Need help with 2025 schoolyear schedule-making,2024-10-25T20:52:47+00:00
Statistics Assistance,2024-10-25T20:40:18+00:00
Switching Program (3 year undergrad),2024-10-25T17:18:23+00:00
Does the University’s insurance cover crutches and a boot?,2024-10-25T16:46:30+00:00
POLS 1000 Oct 24 lecture notes,2024-10-25T16:36:25+00:00
How can I get my physically student card?,2024-10-25T16:32:07+00:00
BIOL 3120 - Immunology,2024-10-25T16:01:01+00:00
How long does it take for refund cheques to get to you?,2024-10-25T15:58:50+00:00
Not getting any attention from my prof,2024-10-25T15:56:33+00:00
When do Final exam dates come out,2024-10-25T05:33:58+00:00
Has anyone seen my friend mungus I've been worried sick. please privately message me if you see him :),2024-10-25T04:22:45+00:00
Issues with Eclass right now,2024-10-25T04:07:34+00:00
KEEP kissing in Scott’s 5th floor please!,2024-10-25T03:15:15+00:00
consider using notebooks over laptops/ipads in lectures,2024-10-25T00:43:21+00:00
Is the Bcom program any good?,2024-10-25T00:30:45+00:00
Is there anywhere on or near campus to have a little bonfire,2024-10-24T23:15:51+00:00
Exam Schedule is Out,2024-10-24T20:42:58+00:00
PSA for all you inbreds speeding on campus and not following road safety rules.,2024-10-24T20:15:34+00:00
CHEM4024 @ York University,2024-10-24T19:04:22+00:00
How is Jeffrey Edmonds for EECS 2101 Data Structures?,2024-10-24T18:29:26+00:00
English TA Yorku Undergrad EN courses,2024-10-24T17:33:00+00:00
This is my life. Help!,2024-10-24T15:42:53+00:00
Strong personal letter?,2024-10-24T13:22:15+00:00
MATH 1019 w/ Andy Test 2,2024-10-24T04:32:46+00:00
Minimum payment due on York account,2024-10-24T03:27:45+00:00
Student Works Painting/Window Cleaning,2024-10-24T02:51:36+00:00
Typical First Year Courses at York Bio Program,2024-10-24T02:50:22+00:00
Business and Econ students gp,2024-10-24T02:15:03+00:00
Advice on adding a Business course as an elective to a Biomedical student's timetable,2024-10-24T01:58:35+00:00
Need help with Grad petitions link for booking -,2024-10-24T01:56:54+00:00
"Philosophy, English, or History",2024-10-24T00:54:24+00:00
Computer Crashed during my Exam,2024-10-24T00:39:47+00:00
"Textbook help, please",2024-10-23T23:49:34+00:00
Anyone joining in as an undeclared?,2024-10-23T22:31:27+00:00
The poutine from the break room slaps,2024-10-23T21:41:58+00:00
Any advice on writing centre,2024-10-23T21:19:12+00:00
No record of me writing Calculus midterm when I remember handing it in 100% with my name and student ID,2024-10-23T18:40:19+00:00
Professers Handwriting,2024-10-23T18:01:48+00:00
Interested in a PhD in Health - Health System Management & Health Data Analytics (HM & HDA),2024-10-23T17:44:20+00:00
i was feeling sick yesterday and i missed my math midterm what should i do?,2024-10-23T17:15:56+00:00
Anyone wants to exchange courses?,2024-10-23T16:48:19+00:00
Graduate Bursury Amount,2024-10-23T16:39:48+00:00
CHEM 1000 - Section A,2024-10-23T15:54:49+00:00
Do you have to request a refund after dropping a course?,2024-10-23T15:54:22+00:00
please someone put the ac on,2024-10-23T15:31:40+00:00
I think I didn’t enrol for a course,2024-10-23T14:34:39+00:00
Is anyone taking ap/sosc 1009,2024-10-23T13:54:12+00:00
Things I’ve learned as a commuter student,2024-10-23T13:26:57+00:00
TurnItIn submissions,2024-10-23T13:18:40+00:00
Math 2030 midterm on Saturday,2024-10-23T12:38:00+00:00
Any 3/4000 course without prerequisite?,2024-10-23T04:35:16+00:00
"Psyc major who got into masters program, can you review my letter of intent?",2024-10-23T04:06:57+00:00
Stage Clip from Graduation,2024-10-23T03:46:42+00:00
The cars that drive around campus while revving their engines.,2024-10-23T03:32:20+00:00
"Cooked, fried and everything in between",2024-10-23T03:21:59+00:00
EECS1520 Fall Term 2024,2024-10-23T03:13:03+00:00
Getting into a masters degree program without the relevant undergrad courses,2024-10-23T03:08:08+00:00
What is SGPA?_______,2024-10-23T02:28:48+00:00
did bad on my midterms feeling scared,2024-10-23T01:10:32+00:00
Dropping out of YU due,2024-10-23T00:52:30+00:00
Do some courses not have winter Term options? Im on the visual schedule builder and it lets me pick winter term but it says there isn't any for example sc-chem 1000,2024-10-23T00:51:54+00:00
Professional Certificate in Actuarial Science,2024-10-22T22:57:27+00:00
Is Sunila Akbar a good proff for 2101,2024-10-22T22:15:57+00:00
DO NOT take a course with Professor Yvonne Su,2024-10-22T22:01:54+00:00
is 77 a good mark in uni?,2024-10-22T21:56:17+00:00
Stuck choosing between Computer Science and Computer Security,2024-10-22T21:50:59+00:00
Is anyone reading this?,2024-10-22T20:39:09+00:00
Math 1506 Youtube videos,2024-10-22T20:14:58+00:00
what is ur secret way to study courses like accounting without SNOOZING,2024-10-22T20:00:01+00:00
How is the ECON 1000 Midterm?,2024-10-22T19:16:52+00:00
dropping a gen ed course in NATS as a first year?,2024-10-22T19:02:34+00:00
Stop kissing in Scott’s 5th floor please!,2024-10-22T18:34:40+00:00
Can i still sign up for winter courses in the middle of the year or is it too late?,2024-10-22T18:12:11+00:00
How to improve writing? And write good essays?,2024-10-22T17:59:39+00:00
Potential scammers driving around,2024-10-22T17:26:21+00:00
Dropping a course this late?,2024-10-22T14:58:53+00:00
Osap probation questions,2024-10-22T13:36:49+00:00
MATH/1190 Midterm/test1,2024-10-22T11:45:41+00:00
"Hello, what are are some good or easy classes to take for the Gen Ed’s requirement for psyc?",2024-10-22T05:09:00+00:00
Biology or biomed for premed/dental???,2024-10-22T04:45:18+00:00
This maybe the semester that kills my career pathway,2024-10-22T04:31:54+00:00
BEST entrance award winner,2024-10-22T03:29:09+00:00
2nd Entry Prerequisites,2024-10-22T02:54:24+00:00
Do I need to inform OSAP if i drop a course?,2024-10-22T02:23:08+00:00
Cumulative balance on york student account !,2024-10-22T02:14:24+00:00
When is the last day to switch tutorials??,2024-10-22T01:54:06+00:00
BEST award(Burgeron Entrepreneurship Award),2024-10-22T01:44:29+00:00
MATH/EECS 1019 Prof?,2024-10-22T01:18:05+00:00
Swear if I see another post about stop being racist to Indians. Y’all need to hear this,2024-10-22T00:58:38+00:00
Anyone know TTC bus 939b in morning rush hour situation?,2024-10-22T00:58:18+00:00
Advice??? I'm literally panicking rn,2024-10-22T00:34:20+00:00
"To anyone in electrical, software, or computer engineering second year or beyond",2024-10-22T00:13:12+00:00
PSYS 1010 Test 1 help me,2024-10-21T23:57:02+00:00
Calumet double in a 6 person suite,2024-10-21T23:29:48+00:00
Thoughts on Itec 2610 E midterm?,2024-10-21T23:24:46+00:00
Organic chemistry help,2024-10-21T23:23:23+00:00
How long was your guy's winter break last year?,2024-10-21T22:48:06+00:00
5th year and mental health,2024-10-21T22:08:03+00:00
Some guy asked me to watch his stuff in Scott and has been gone for at least 30 min!,2024-10-21T21:44:09+00:00
Questions regarding Gap year,2024-10-21T21:00:06+00:00
Retroactive pay for former employees,2024-10-21T20:47:15+00:00
Would YorkU care if i retake biology in semester 2 of high school?,2024-10-21T20:17:50+00:00
Can you guys stop please STOP FARTING DURING THE EXAM!!,2024-10-21T19:42:35+00:00
URGENT advice needed on Petition,2024-10-21T18:58:59+00:00
Silent Study Zone at Scott,2024-10-21T18:10:44+00:00
"Coping with Stress, Lack of Motivation, and Falling Behind",2024-10-21T17:53:04+00:00
ChatGPT+ - w/ school account,2024-10-21T17:51:45+00:00
Opinions on HH/HLST 2040,2024-10-21T17:39:29+00:00
Fall 2025 admission deadline,2024-10-21T17:23:29+00:00
MATH 1025 - Midterm Advice?,2024-10-21T17:02:22+00:00
How can anyone workout at tait?,2024-10-21T16:06:33+00:00
Is there a gc for MATH 1510 C?,2024-10-21T15:48:24+00:00
is the schewpid wifi down?,2024-10-21T15:29:33+00:00
1st year electives with mcq,2024-10-21T14:32:16+00:00
Looking for 3000/4000 courses,2024-10-21T14:27:30+00:00
Good social clubs or sports teams,2024-10-21T07:01:07+00:00
Humanities 1900 midterm,2024-10-21T04:03:06+00:00
RN109G alternate exam,2024-10-21T03:46:25+00:00
Biol1000 - Test 2 Material,2024-10-21T03:07:38+00:00
ADMS 2400 midterm thoughts ?,2024-10-21T02:54:43+00:00
ADMS 2500 midterm thoughts ?,2024-10-21T02:49:46+00:00
Free mental health services,2024-10-21T02:07:03+00:00
ECON1000 Testbanks Prof Sadia Malik,2024-10-21T01:23:07+00:00
Coloured printer at York,2024-10-21T00:59:48+00:00
Urgent tutoring needed,2024-10-21T00:24:30+00:00
how tf do u apply to be a pass leader,2024-10-21T00:09:26+00:00
Why are some TA’s so ughhh,2024-10-21T00:01:20+00:00
Is Academic Comeback real?,2024-10-20T22:00:07+00:00
Psyc 2260 A Exam 1. Prof Vinod Goel. Unfair testing who to contact?,2024-10-20T21:32:05+00:00
Tests for for Amirali Amirsoleimani,2024-10-20T21:09:28+00:00
To the person who borrowed my pencil in clh L adms 1010 exam this morning,2024-10-20T19:46:53+00:00
Winter - Base Layers,2024-10-20T18:52:12+00:00
When do we get to know the schedule for December exam?,2024-10-20T18:17:18+00:00
How is the physics department at York?,2024-10-20T18:05:32+00:00
Reading week coming to an end,2024-10-20T17:14:03+00:00
Computer science requirement,2024-10-20T16:28:06+00:00
Vari Hall VH C???????,2024-10-20T15:22:29+00:00
Concurrent Ed admission from high school,2024-10-20T12:57:37+00:00
Anyone planning to skip the arms 2500 midterm and take the comprehensive final exam?,2024-10-20T05:48:43+00:00
What is the difference between courier and Mail option for delivery of transcripts?,2024-10-20T01:40:54+00:00
What do clubs even need,2024-10-19T23:16:27+00:00
bird courses for winter 2025,2024-10-19T22:28:57+00:00
Late course enrollment,2024-10-19T20:55:08+00:00
any club still hiring for exec team?,2024-10-19T17:38:57+00:00
Biol 1000 test 1 marks,2024-10-19T17:33:01+00:00
EECS3451 situation this fall,2024-10-19T14:57:08+00:00
Economics Major Groupchat?,2024-10-19T07:16:52+00:00
Need help picking science requirements,2024-10-19T00:02:41+00:00
"pdf version of Tro, Fridgen, Shaw; Chemistry: A Molecular Approach (4th Canadian edition)",2024-10-18T22:33:51+00:00
I feel like most of the class is gonna fail the midterm for 1028 💀,2024-10-18T21:37:36+00:00
How's the party life at York?,2024-10-18T21:22:11+00:00
1019 Valery Michinkie,2024-10-18T20:50:54+00:00
GC for Math 1507? Looking,2024-10-18T20:16:59+00:00
Wanted to post this yesterday but just wanted to say congrats to the class of 2024!,2024-10-18T19:22:39+00:00
Transferring university and changing major help,2024-10-18T18:51:45+00:00
Sc/Biol 2900 - Microbiology for Nurses,2024-10-18T18:28:15+00:00
Upper-year Transfer Co-Op (CS),2024-10-18T15:10:32+00:00
How do I get her attention,2024-10-18T13:57:31+00:00
(ENGINEERING) Is it possible for me to major in a engineering and then minor in business?,2024-10-18T03:53:56+00:00
Math 1019 and 1300 Past Notes/Midterms,2024-10-18T03:16:04+00:00
is yorku msa open to non religious folks?,2024-10-18T02:53:07+00:00
Question to the YORKU Muslim community,2024-10-18T02:39:49+00:00
Current CS students what was your avg in gr12?,2024-10-18T01:12:29+00:00
"Grandmother passed, is there any accommodation I can get?",2024-10-18T00:31:33+00:00
selling crochet purses,2024-10-17T23:37:48+00:00
What’s a restaurant y’all want on campus?,2024-10-17T23:27:37+00:00
ECON 1000 Sadia Malik,2024-10-17T23:23:45+00:00
Chem 2080 (with dr. Chen),2024-10-17T23:13:32+00:00
How’s your reading week going so far?,2024-10-17T23:11:22+00:00
"Current undergraduate business students, would you switch to engineering if you could?",2024-10-17T21:59:46+00:00
commercial banking interview,2024-10-17T21:46:23+00:00
Admission possiblity,2024-10-17T21:35:08+00:00
York students (I need help),2024-10-17T21:18:40+00:00
When will summer courses be offered?,2024-10-17T20:32:59+00:00
Dental hygiene student offering a dental cleaning at an affordable price,2024-10-17T19:49:12+00:00
YFS Dental and Health Program,2024-10-17T18:56:57+00:00
Practice tests/midterms for Discrete Math,2024-10-17T18:01:53+00:00
Any halloween functions,2024-10-17T17:03:31+00:00
Does anyone know when the doors lock at night in the CFA?,2024-10-17T16:09:46+00:00
How Should I study for the ADMS 2200 midterm?,2024-10-17T13:24:55+00:00
is York good for a study year abroad?,2024-10-17T12:58:41+00:00
stolen parking ticket??,2024-10-17T04:40:21+00:00
"🌿✨ Join ""Spirituality ~ Finding Path"" Club! A Journey of Exploration, Truth, and Growth ✨🌿",2024-10-17T02:51:35+00:00
Textbooks Used in the Following Courses?,2024-10-17T02:39:39+00:00
YFS Heath insurance and eye glasses,2024-10-17T02:11:23+00:00
Is this program worth applying for and can I ger feedback?,2024-10-17T01:47:20+00:00
How can i find my TA's email?,2024-10-17T01:34:14+00:00
Where can I buy galvanized square steel and eco freindly wood vaneers on campus?,2024-10-17T01:32:31+00:00
Anybody here in CRIM 1650?,2024-10-17T01:30:19+00:00
Needa Noise-Free Zone to Practice My Vocals,2024-10-16T23:24:36+00:00
EEC1028 DISCRETE SC/MATH,2024-10-16T22:13:21+00:00
does request completed mean its been accepted? on the myprogram page?,2024-10-16T20:58:08+00:00
student loans excluding me from financial need/FAAS scholarships,2024-10-16T20:36:05+00:00
Easy 4000 Level ADMS courses,2024-10-16T20:33:43+00:00
How to ask for references,2024-10-16T19:33:49+00:00
Winter commuting to the uni,2024-10-16T18:05:31+00:00
HELP WITH STUDY ON MKTG RESEARCH ON DEODORANT PREFERENCES,2024-10-16T16:03:59+00:00
HELP WITH SURVEY FOR MKTG CLASS ON DEODORANT PREFERENCES,2024-10-16T15:56:29+00:00
Math 1506 Help!!!!!!,2024-10-16T15:13:13+00:00
How do you feel about true crime in the media? (story callout for student newspaper),2024-10-16T14:54:20+00:00
"Lost my grandmother, what to do next?",2024-10-16T14:44:34+00:00
Need advice for academic dishonesty,2024-10-16T13:53:36+00:00
Serious question for the girls out there,2024-10-16T01:56:43+00:00
Convocation buddies,2024-10-16T01:45:51+00:00
eecs 2001 ruth urner,2024-10-16T01:11:44+00:00
Look up and around before you start walking at a stop sign,2024-10-16T00:08:48+00:00
ADMS 2200 -Introductory Marketing - Test Bank,2024-10-15T23:58:00+00:00
Best approach for honours degrees,2024-10-15T23:47:58+00:00
Suggestions for good notes app for iPad,2024-10-15T22:32:35+00:00
