Title,Date
Seeking alumni advice on the Lassonde BEST certificate. Is it worth it to pursue it as someone who is in their 3rd year of CS now? Most importantly: Have you benefitted from it in your career?,2024-11-20T02:47:58+00:00
"What are your thoughts on consumerism, overconsumption, and spending during the holidays?",2024-11-20T02:39:28+00:00
RACCOONS IN THE WALLS,2024-11-20T02:34:22+00:00
What do you guys think the admission average will be this year for cs/computer security,2024-11-20T02:32:13+00:00
Tatham residence bug issue ?,2024-11-20T02:06:20+00:00
EECS GPA of 4.33 Will I be removed from courses?,2024-11-20T00:43:31+00:00
AP PHILOSOPHY 1001 ??,2024-11-20T00:42:00+00:00
Is this normal for University?,2024-11-20T00:25:52+00:00
thoughts on Evolutionary Psych with Krista Phillips??,2024-11-19T22:39:22+00:00
Can we do a mini rate my professor thread here?,2024-11-19T22:36:30+00:00
How long does it take to get a York ID card,2024-11-19T22:16:00+00:00
recommendations for new tablet pen,2024-11-19T21:52:12+00:00
"Does School of Continuing Studies give Dean's List, If so where do I check if I got it?",2024-11-19T21:34:45+00:00
Please Help - Missed Test,2024-11-19T21:22:44+00:00
EASY 3 CREDIT CLASS FOR WINTER TERM,2024-11-19T20:34:40+00:00
Is there still good job opportunities in 90 credit BComm Compared to 120 Credit Honours BComm with a Specialized Stream?,2024-11-19T20:04:22+00:00
making friends is ez,2024-11-19T19:04:33+00:00
What do you guys think?,2024-11-19T18:34:13+00:00
Why do people say this place is anti-social?,2024-11-19T18:25:52+00:00
How do I make friends as a 6'5 Guy?,2024-11-19T17:51:21+00:00
"Help needed today, a favour",2024-11-19T17:04:07+00:00
EECS2032 and EECS3451,2024-11-19T16:07:29+00:00
Quad #85 loud noise every night from suite 714,2024-11-19T15:59:25+00:00
I was absent twice in a row,2024-11-19T15:16:32+00:00
BIOL1001 Course Outline,2024-11-19T15:04:11+00:00
you’re the biggest waste of space if you smoke in the washroom,2024-11-19T14:56:22+00:00
Post number 93736 looking to make friends,2024-11-19T12:26:13+00:00
Chem 2020 Final Stress,2024-11-19T03:30:08+00:00
Locations to record a podcast,2024-11-19T03:11:53+00:00
Is OSAP reevaluation possible,2024-11-19T03:03:14+00:00
applying to concurrent education! have a few questions...,2024-11-19T02:18:32+00:00
Inquiry about Eras Tour!,2024-11-18T21:37:07+00:00
Admission in physics graduate program with engineering background,2024-11-18T22:58:23+00:00
Can York know how many exams you’ve deferred through out your entire time.,2024-11-19T00:02:29+00:00
PLEASEEEE SHARE NATS1745 GC - FULL YEAR WITH JESSE ROGERSON/ PARANDI TAJBAKHSH,2024-11-18T23:51:47+00:00
course material complaint,2024-11-18T23:43:14+00:00
Is anyone starting Uni in the winter term? Hey I'm a first year Engineering student who's going to start in the winter due to medical reason and I was hoping to make more friends. If u wanna be friends hit me up or dm me.,2024-11-18T23:07:15+00:00
How to study for an exam that is only essay questions?,2024-11-18T22:33:11+00:00
"BIOL2021 Section N (9:30am), Anyone wanna switch?",2024-11-18T22:29:33+00:00
Math 1300 and Math 1021 notes or helpful resources,2024-11-18T04:43:36+00:00
How do you guys study?,2024-11-18T16:00:20+00:00
"Nats 1560, Understanding Food final test notes/study guide?",2024-11-18T20:40:47+00:00
Is there an investment club at York?,2024-11-18T18:41:45+00:00
Econ Tutor York U Student,2024-11-18T18:29:47+00:00
parking ticket dispute,2024-11-18T18:20:59+00:00
Chem 1000 Section A slides,2024-11-18T18:16:33+00:00
Laptops/computers to use on campus that has camera and mic?,2024-11-18T18:07:07+00:00
"For those who have taken the Accounting GDIP Part-Time, what time/days were classes?",2024-11-18T16:36:41+00:00
What average and pre requisites will I need for software engineering here?,2024-11-18T15:49:41+00:00
Interested in Space and Satellites? Thinking about Design Teams? Well the Lassonde Satellite Club- LASSAT- is having its first general this Friday November 22nd @5pm!,2024-11-18T13:49:52+00:00
KINE 3020 Section N (9:30 AM) - anyone want to switch?,2024-11-18T13:44:07+00:00
Should i switch from CS to economics ?,2024-11-18T10:59:53+00:00
Does anyone know how to resubmit stuff on Turnitin,2024-11-18T06:14:09+00:00
math 1013/ sc math 1013 midterm 2,2024-11-18T05:37:41+00:00
Math for Bio Med After First Year,2024-11-18T03:10:34+00:00
should i give up if i can't pass classes despite studying for them?,2024-11-18T01:53:21+00:00
Unable to use my login/add drop courses,2024-11-18T01:16:06+00:00
Found: Apple Pencil Pro in DB 0014,2024-11-18T00:12:34+00:00
York University has still not accepted me for my Biomedical Sciences Program,2024-11-17T23:44:24+00:00
Transfer from IT to CS,2024-11-17T22:24:05+00:00
Seekikg Poli Sci Advice,2024-11-17T22:09:25+00:00
For mathematics graduates honours/bachelors (2020 to 2021),2024-11-17T22:02:37+00:00
Profs who r only in for the research,2024-11-17T19:02:01+00:00
Uber eats promo code brochures,2024-11-17T18:57:37+00:00
Defended my physics PhD!,2024-11-17T17:25:56+00:00
Physician form sent from personal email,2024-11-17T16:40:41+00:00
What do I do for a missed Test,2024-11-17T15:45:52+00:00
What are my chances.,2024-11-17T05:02:06+00:00
What are you using AI for?,2024-11-17T03:21:06+00:00
Can a prof detect AI on a non-proctored eClass multiple choice exam if using an ipad to take photos?,2024-11-17T02:42:28+00:00
When does overall semester gpa get calculated?,2024-11-17T02:04:02+00:00
How is York on campus and off campus residences? Any advice/recommendations,2024-11-17T01:53:39+00:00
I'm done gatekeeping my fav food spot,2024-11-16T00:44:01+00:00
"Please help, First year inquiring about major change.",2024-11-16T01:19:10+00:00
Smoking Spots on York Keele Campus?,2024-11-16T22:42:51+00:00
Need feedback for project idea before we start building it- platform for students to find CS projects to work on for their coop prep,2024-11-16T20:47:24+00:00
"I have Lassonde Academy 2024 in my Elcass, do i have to finish it before the end of semester?",2024-11-16T17:14:28+00:00
This is for the boyz,2024-11-16T12:11:00+00:00
Changing DLI Number as an International Transfer Student,2024-11-16T07:13:09+00:00
does gpa matter when applying?,2024-11-16T05:40:18+00:00
When life gets tough and you feel like giving up: Here’s something very beautiful that i read,2024-11-16T04:48:13+00:00
Has anyone taken a leave of absence?,2024-11-16T02:08:45+00:00
"Anyone who did UNhack, do I actually have to be here the full 3 days????",2024-11-16T01:30:11+00:00
York University - Design / Communication & Media Studies Programs,2024-11-16T01:10:54+00:00
Give me your advice!! Especially York Bcom alumni!!,2024-11-16T00:44:43+00:00
york - design program / communication & media studies,2024-11-16T00:24:34+00:00
Why does everyone hate YFS?,2024-11-16T00:00:17+00:00
Does anyone have BIOL 2905 notes?,2024-11-15T23:40:34+00:00
Need Help Registering for courses,2024-11-15T23:32:29+00:00
Looking for a Club @ Keele!,2024-11-15T23:15:32+00:00
anyone in psyc 1010 have test 2 study notes?,2024-11-15T21:11:57+00:00
Prof asking for doctor's note,2024-11-15T20:06:30+00:00
Wireless Earbuds Found!,2024-11-15T19:31:32+00:00
Need Advice How to Find Housing (Large Group),2024-11-15T19:28:17+00:00
How to prepare for a exam worth 70% (chem1000),2024-11-15T19:21:25+00:00
Eng 1101: Skipping major experiential activity,2024-11-15T18:47:21+00:00
Interested in MA in Economics Program,2024-11-15T18:38:28+00:00
what would happen if i just waited for the grade then drop the course,2024-11-15T18:36:59+00:00
F NGR for completed deferred exam??,2024-11-15T16:42:33+00:00
How Does York’s BA vs BSc in Psychology Differ?,2024-11-15T16:34:57+00:00
how do i enroll in a summer school course,2024-11-15T16:20:31+00:00
What do I do about a low class average?,2024-11-15T16:05:49+00:00
Guy going up to girls and asking them to buy food for him,2024-11-15T14:59:21+00:00
Need a copy of the book Firekeeper by Katlia,2024-11-15T14:51:50+00:00
Research coordinator position,2024-11-15T11:40:50+00:00
Which degree is better of these two?,2024-11-15T07:48:18+00:00
If YFS is so corrupt why doesn't the university allow another student body to represent the students?,2024-11-15T07:01:31+00:00
chem 1000 previous midterms,2024-11-15T06:55:21+00:00
Glendon Campus Demographics?,2024-11-15T03:56:46+00:00
SOSC COURSE FOR FIRST YEAR,2024-11-15T03:50:27+00:00
Planning ahead to retake,2024-11-15T03:10:36+00:00
Can I drop multiple courses from transcript?,2024-11-15T01:31:02+00:00
Deferred Exam And It Got Moved To This Exam Period,2024-11-15T01:02:06+00:00
LOST BEMO AIRPOD CASE,2024-11-15T00:33:33+00:00
Lost keys found in VC 135,2024-11-14T22:26:14+00:00
I hate this..💀need a muslim friend or need a Christian friend..😭,2024-11-14T22:23:01+00:00
Lost ipad with black cover & apple keyboard - please help.,2024-11-14T20:59:54+00:00
HELP IM ACC SO SCARED,2024-11-14T20:01:21+00:00
Anyone know good spots for a podcast video,2024-11-14T19:19:35+00:00
Worst ta I’ve ever had,2024-11-14T19:18:57+00:00
certificate in DEM or HRM or minor in either: need help,2024-11-14T17:49:09+00:00
Muslim Network Groups on Campus,2024-11-14T17:46:38+00:00
Making New Friends on Campus,2024-11-14T17:44:47+00:00
EECS 2001 Ruth Urner,2024-11-14T16:53:29+00:00
Automatically applied to bursaries,2024-11-14T13:53:20+00:00
Regarding Math 1025 for Cs major,2024-11-14T08:55:59+00:00
Scotiabank Interview Coffee Chat,2024-11-14T11:04:59+00:00
Here to answer 2nd entry questions.,2024-11-14T05:23:52+00:00
Got a 0% on an assignment worth 15% of final Grade,2024-11-14T05:37:53+00:00
Lost My Student ID in Accolade East Building Room 102,2024-11-14T02:08:58+00:00
IS CHEM OR PHYSICS REQUIRED FOR PSYCH BSC?,2024-11-14T04:59:26+00:00
Who's down to be friends?,2024-11-14T03:42:22+00:00
Average to Get into Biomedical Sciences,2024-11-14T03:31:17+00:00
I wanna make new friends!,2024-11-14T03:04:09+00:00
Are we in the end times event,2024-11-14T01:41:52+00:00
Can y’all let me know if York would let me in their computer science program?,2024-11-13T21:48:46+00:00
Hollywood: Old and New,2024-11-13T21:57:27+00:00
Trying to make friends,2024-11-13T21:49:25+00:00
MSW at YorkU - Advance Standing,2024-11-13T18:53:59+00:00
What should i be expecting for MATH 1300 second test?,2024-11-13T18:14:57+00:00
Weird guy on first floor life science building,2024-11-13T17:01:00+00:00
Has anyone used the GoSafe walk feature,2024-11-13T15:05:54+00:00
"Anyone who took MATH 2030 Elementary Probability with EJ Janse van Rensburg in the Fall 2023, Section D?",2024-11-13T06:26:00+00:00
Cultural Psyc 3350 - Cindel,2024-11-13T12:58:38+00:00
Yfs trying to get rid of police on campus??,2024-11-13T11:30:32+00:00
YorkU Track and Field,2024-11-13T10:57:45+00:00
Am I cooked? Idk if I'll be able to pass one of my classes,2024-11-13T08:23:28+00:00
How crazy is this new digital card rule,2024-11-13T04:09:56+00:00
Glendon Campus Annual Fees,2024-11-13T02:59:58+00:00
BIOL 4340 (Fish Biology),2024-11-13T02:42:38+00:00
Dance studios at York,2024-11-13T02:01:09+00:00
Talk to girl in lecture,2024-11-13T01:41:59+00:00
"To anyone who took MATH1013 with Andrew in Winter 2023: since he didn’t provide a practice midterm while other professors did, how was your experience with Midterm 2",2024-11-13T00:49:03+00:00
How common is it for students to get there preferred residence choice?,2024-11-12T23:16:10+00:00
Joining clubs in the middle of the year,2024-11-12T22:46:15+00:00
Stop talking about people behind their backs (or in front of them!),2024-11-12T22:31:50+00:00
Linguistics at Glendon,2024-11-12T22:20:35+00:00
Schulich MBAN worth it?,2024-11-12T22:10:41+00:00
Spark quiz for a course (1341),2024-11-12T20:06:48+00:00
Slow walkers/Unaware walkers,2024-11-12T19:06:30+00:00
Caught Cheating at York University,2024-11-12T18:29:49+00:00
Chat i need help (Math1013),2024-11-12T17:10:33+00:00
Required withdrawal!!,2024-11-12T17:06:47+00:00
Yorku bus car accident,2024-11-12T16:40:12+00:00
No more funding for international student - MA/MSc Digital Media,2024-11-12T14:05:11+00:00
Bird courses at York winter,2024-11-12T13:26:57+00:00
Hamas supporters at york??,2024-11-12T10:26:47+00:00
What is the difference with applying through OUAC and York's application portal ?,2024-11-12T09:21:23+00:00
TAs are discreet life hero’s,2024-11-12T09:19:55+00:00
how to reach out to york psyc profs as a student not from york,2024-11-12T06:41:57+00:00
QUAD Experience 2024,2024-11-12T02:19:44+00:00
"If you are Gerbil_In_Space, please know everyone loves you & never stop shitposting",2024-11-12T02:14:47+00:00
ARTH 1900 midterm help me,2024-11-12T01:22:41+00:00
Bachelor of Education Question on the Application Procedure - Help Appreciated,2024-11-12T00:54:10+00:00
ARE YOU A CS/MATH/SE MAJOR LOOKING FOR AN INTERNSHIP?,2024-11-12T00:07:26+00:00
UX Design Certificates - which one should I apply to?,2024-11-11T23:23:59+00:00
Full refund due to bad prof,2024-11-11T22:01:11+00:00
About School life?,2024-11-11T23:21:24+00:00
How was studyng in human resource management?,2024-11-11T23:17:12+00:00
Acceptance letter expected time?,2024-11-11T22:39:48+00:00
Can y'all stop leaving pre-casted spells in the Vari Hall bathrooms,2024-11-11T22:38:13+00:00
"If you're muslim, don't go to meltwich",2024-11-11T22:20:41+00:00
AP/SOSC 1000 Midterm 1 Grade,2024-11-11T21:44:45+00:00
International Scholarship at YorkU,2024-11-11T21:38:41+00:00
Turn it in similarity score,2024-11-11T20:02:16+00:00
career fit program yorku,2024-11-11T20:42:00+00:00
How does one network with others and make meaning full connections?,2024-11-11T20:41:01+00:00
"I'm so sorry, students of York U",2024-11-11T20:30:50+00:00
Volunteers for my Master’s thesis. please help,2024-11-11T20:28:50+00:00
Enrolment for Winter,2024-11-11T20:20:21+00:00
I have yet to attend a Selfie Event,2024-11-11T19:39:48+00:00
I got 4 hrs til my next lecture,2024-11-11T19:32:48+00:00
Is there anyway to redeem a bad gpa after you’ve graduated?,2024-11-11T19:28:58+00:00
I need financial help,2024-11-11T19:19:25+00:00
How tf do I get a York student ID card (like a physical one not the phone one),2024-11-11T19:15:01+00:00
Crim+Philosophy electives,2024-11-11T18:26:44+00:00
How to use FAAS Awards Portal,2024-11-11T18:21:52+00:00
Transferring to York CS or Computer Engineering?,2024-11-11T18:13:30+00:00
anyone in eecs 1520?,2024-11-11T18:02:36+00:00
can yall stop drilling holes in the washrooms,2024-11-11T17:38:49+00:00
alarm going off on Keele campus today,2024-11-11T17:27:40+00:00
Where to stay for prospective student?,2024-11-11T16:42:02+00:00
Forgot to Pay for parking today and got fined $753,2024-11-11T16:35:39+00:00
Is getting an undergraduate degree in psychology worth it?,2024-11-11T15:50:45+00:00
Anywhere on campus you can print using your own/custom paper?,2024-11-11T15:34:16+00:00
YUSC CRIME MAFIA NGO IN DISGUISE,2024-11-11T14:37:40+00:00
EECS 3342 A* Students,2024-11-11T08:53:34+00:00
Consecutive or Concurrent Education: Pros & Cons,2024-11-11T03:29:23+00:00
Differences in textbook editions,2024-11-11T01:57:01+00:00
I need help with 1019,2024-11-11T00:53:23+00:00
YORKU QUAD PRIVATE ROOM AVAILABLE,2024-11-11T00:14:52+00:00
dance studiossssssss,2024-11-10T23:56:58+00:00
Anyone taken biol4070 or biol3290?,2024-11-10T23:42:14+00:00
Summer 2025 electives,2024-11-10T23:14:59+00:00
Looking for 2 housemates,2024-11-10T22:36:56+00:00
Just wanted to say hi to everyone,2024-11-10T22:04:15+00:00
Need help with the Duo Mobile App,2024-11-10T21:52:36+00:00
Bad idea to get a car?,2024-11-10T21:39:40+00:00
"MBA - Arts, Media & Entertainment Specialization",2024-11-10T21:04:48+00:00
looking for tutoring positions,2024-11-10T18:48:54+00:00
Looking for musician to collaborate on song compositions. (Guitar or piano prefered),2024-11-10T07:04:08+00:00
Interested in running your own server?,2024-11-10T05:50:40+00:00
Help needed regarding BSc Cs math courses !!,2024-11-10T02:31:51+00:00
Jobs around York University,2024-11-10T01:11:11+00:00
york computer science admission average 2024,2024-11-10T00:27:08+00:00
Looking for friends to go clubbing with,2024-11-09T18:44:45+00:00
Webassign for Math 1013,2024-11-10T00:13:57+00:00
Is it normal to be watching videos in the bathroom at full volume,2024-11-09T23:52:13+00:00
Eras tour tickets anyone?,2024-11-09T23:24:58+00:00
Question Regarding the BSW at York,2024-11-09T21:49:52+00:00
Dry cough from dorms?,2024-11-09T21:08:40+00:00
Studying for biol2021 final,2024-11-09T20:32:01+00:00
PSYC 2110 Admission Help,2024-11-09T20:29:13+00:00
remarried parent but they don't live together,2024-11-09T20:23:31+00:00
What graphic design tools are used to make posters for upcoming events at York?,2024-11-09T18:04:08+00:00
York driving in style,2024-11-09T16:47:25+00:00
Would a professor ever allow someone to take a final exam on an earlier date? Family booked me a flight to a wedding before I signed up for the course.,2024-11-09T16:33:22+00:00
how is the criminology program?,2024-11-09T16:25:40+00:00
Second Degree YorkU Lassonde,2024-11-09T16:20:29+00:00
Smokes poutine closed??,2024-11-09T15:42:49+00:00
first year trying to transfer to york,2024-11-09T14:25:13+00:00
Pay for posters | yorku,2024-11-09T06:36:42+00:00
What's up with that homework crew girl on Snapchat?,2024-11-09T06:21:19+00:00
I have evidence of widespread corruption in the B.Com program,2024-11-09T05:31:07+00:00
Accepting part-time high students,2024-11-09T04:12:42+00:00
Trusting TAs to grade,2024-11-09T03:19:55+00:00
is hui wang understanding,2024-11-09T03:16:24+00:00
Chem 2020 Muhammad N Yousef,2024-11-09T02:23:58+00:00
Why are u girls so brutal to each other?,2024-11-09T00:07:42+00:00
Would I get Accepted,2024-11-08T23:26:27+00:00
Anyone else eclass down?,2024-11-08T23:23:10+00:00
Anyone ever had Charles-Edouard Boukaré,2024-11-08T22:48:21+00:00
york university students help!,2024-11-08T22:40:46+00:00
Second entry nursing,2024-11-08T21:51:46+00:00
CS 1st year math courses,2024-11-08T21:41:03+00:00
Dropping a core course,2024-11-08T21:34:14+00:00
York BScN direct entry cutoff,2024-11-08T21:02:35+00:00
graphic and sensational post,2024-11-08T19:10:43+00:00
Keys on a Purple Lanyard (LOST),2024-11-08T17:39:56+00:00
New eClass Dark Mode - Feedback?,2024-11-08T17:14:44+00:00
I lost my Toyota key in VHC,2024-11-08T16:41:01+00:00
Too late for course enrolment?,2024-11-08T16:33:15+00:00
Does ADMS 3530 offer a 2 month course in the summer?,2024-11-08T16:30:38+00:00
Campus security not giving all identifying information is wrong.,2024-11-08T10:07:54+00:00
is the long commute worth it ?,2024-11-08T08:24:17+00:00
Prof hasn't graded any assignments... not sure what to do here,2024-11-08T05:10:54+00:00
Looking for Ukrainians to bring back the Ukrainian Students’ Club at YorkU,2024-11-08T03:51:21+00:00
Poker game on campus (low stakes),2024-11-08T02:40:52+00:00
QUAD SUBLEASE FROM NOVEMBER TO AUGUST 2025,2024-11-08T02:03:30+00:00
Email regarding waiving portfolio review/entry into the design program (BDes),2024-11-08T01:54:20+00:00
Should I register my external internship for co-op or leave it as is?,2024-11-08T01:34:02+00:00
York MSW Statement of Interest Help,2024-11-08T01:15:49+00:00
I’m deciding on York,2024-11-07T23:03:52+00:00
Prospect students - York's BCom program is so garbage and corrupt,2024-11-07T20:32:04+00:00
Does anyone know is the 501 is gonna come at VMC???,2024-11-07T20:10:18+00:00
There is alot of bad bitches on campus,2024-11-07T19:32:45+00:00
New afro spice restaurant is not good,2024-11-07T19:24:33+00:00
Has anyone taken kine 3350 before?,2024-11-07T19:14:52+00:00
How to rizz up Korean girls?,2024-11-07T18:46:35+00:00
extra time denied but letter of accommodations approved?,2024-11-07T18:20:12+00:00
ENTR 4950 SCHULICH COURSE IS EASY OR TOUGH ?,2024-11-07T17:56:20+00:00
Should I take AP/SOSC1340 6.0 M: Introduction to Business and Society,2024-11-07T17:29:25+00:00
Winter 2025 Soccer intramural team,2024-11-07T17:22:18+00:00
HREQ 4650 - SHARE SYLLABUS?,2024-11-07T17:11:21+00:00
Lost tablet pen. Need help,2024-11-07T16:50:21+00:00
eecs 1520 deadline missed,2024-11-07T15:57:07+00:00
how can i print without a yorku card,2024-11-07T07:16:24+00:00
Mech2301 offered in summer,2024-11-07T05:46:38+00:00
Best place to record a project video,2024-11-07T03:34:22+00:00
Have you ever had your exam lost?,2024-11-07T01:33:21+00:00
BIOL 3350 (Comparative Chordate Anatomy),2024-11-07T01:02:34+00:00
Anki deck for biol 1000?,2024-11-07T00:03:00+00:00
Spikeball intramural,2024-11-06T23:39:14+00:00
Beware of guys in cars asking if you want a free tv,2024-11-06T22:53:26+00:00
Quick question! Is Math1506/1507 available in the summer? I'm likely gonna take both during the 2025 summer sem so I'm wondering if those who know could share.,2024-11-06T21:29:00+00:00
"Does anyone had HLST 2010 before with Dennis Raphael? How hard is his exams? Also, if you guy have notes please help and send it :(",2024-11-06T21:16:13+00:00
Papa John’s opening nearby Chipolte,2024-11-06T21:06:18+00:00
Any clubs/sports teams that only meet Friday?,2024-11-06T19:05:22+00:00
HH PSYC 2110 Developmental Psychology Rebbeca Dunk,2024-11-06T18:51:11+00:00
"Science students, are Sunday midterms only a first year thing? Or is it like that for upper year courses as well?",2024-11-06T17:48:28+00:00
Am I cooked? I forgot to pay for parking td,2024-11-06T16:22:51+00:00
Is Yorku Bcom really that bad?,2024-11-06T16:12:56+00:00
Posters posted Around Campus With QR CODE,2024-11-06T13:38:36+00:00
Considering Second Entry Nursing & Science Degrees for Hospital Jobs – Any Recommendations?,2024-11-06T13:17:29+00:00
There HAS to be an easier way to enroll in courses,2024-11-06T12:42:24+00:00
MScN application status,2024-11-06T10:02:28+00:00
Looking For A Tutor (will pay),2024-11-06T04:21:02+00:00
Kind of bummed out tbh,2024-11-06T02:22:50+00:00
Psychotherapy insurance,2024-11-06T00:19:48+00:00
"Met CityboyJJ at York Lanes and Honestly, I'm Underwhelmed",2024-11-05T22:34:03+00:00
Could I pass this course?,2024-11-05T21:21:44+00:00
Free dental cleaning,2024-11-05T20:52:42+00:00
Studying/Internship Abroad for CS,2024-11-05T18:38:10+00:00
"Thoughts on classes that are marked 5-10% assignment, 25-30% mid and rest final",2024-11-05T17:03:16+00:00
Girls Secretly Recording Guys at York Needs to Stop,2024-11-05T16:44:59+00:00
CMA 1400 - please be quiet,2024-11-05T15:34:56+00:00
Founders Carbon Monoxide Detector,2024-11-05T15:11:09+00:00
Experiential placement/ practicum courses for AMPD,2024-11-05T14:00:45+00:00
HELP where can I find the document number for PAL letters (international student),2024-11-05T12:03:02+00:00
Need Advice for my Last Year,2024-11-05T05:15:08+00:00
What happens in this situation for an undecided major?,2024-11-05T05:06:52+00:00
Stop having conversations during lectures 😡,2024-11-05T05:00:49+00:00
nats 1740 or nats 1745?,2024-11-04T04:41:39+00:00
Lost my wallet in Life Science Building,2024-11-05T01:24:23+00:00
Anyone know where i can do an online interview?,2024-11-05T03:17:07+00:00
Why the fuck is the tim hortons line at Vari hall so long all the time,2024-11-05T02:18:29+00:00
Neural physiology module for KINE 2011,2024-11-04T23:58:53+00:00
What happened in a class in vari hall an hour ago,2024-11-04T22:06:16+00:00
Found an Ear bud on campus.,2024-11-04T22:06:02+00:00
Any Scholarships ???,2024-11-04T22:01:33+00:00
Mid term university average,2024-11-04T21:07:24+00:00
why are people so judgemental on fashion?,2024-11-04T19:45:07+00:00
has anyone seen a presto card on the floor in vari hall,2024-11-04T19:34:06+00:00
why the fuck did they change the format of BIOL2040?! 😭,2024-11-04T19:06:34+00:00
Are people more likely to fail 2000 level EECS courses or 3000 level EECS ? I haven’t failed any yet but I’m just deeply scared,2024-11-04T19:02:19+00:00
Private space to take a meeting at YorkU,2024-11-04T18:16:25+00:00
York MyFile question,2024-11-04T18:07:19+00:00
Period products in bathrooms,2024-11-04T17:28:55+00:00
OSAP NEED HELP PLEASE,2024-11-04T16:54:17+00:00
ADMS 1010 MidTerm Grades,2024-11-04T15:39:28+00:00
Help with deferring to next year,2024-11-04T14:33:21+00:00
FAA's Scholarships application,2024-11-04T13:01:37+00:00
what can i do to better my chances at switching from finance major to IT?,2024-11-04T11:59:25+00:00
Biochem or biomedical science for med? High-school student,2024-11-04T07:30:36+00:00
Sororities at York!!,2024-11-04T05:50:40+00:00
YorkU Finance Accounting Department is Corrupt,2024-11-04T05:05:33+00:00
York University Markham Campus featured in background of Google Pixel 9 Ad,2024-11-04T02:44:28+00:00
"Clubs, extra-curriculars, ""hackathons""...?",2024-11-04T02:15:15+00:00
Are there any other professors the teach EECS 1022,2024-11-04T01:45:41+00:00
How do people study on weekends?,2024-11-03T23:55:25+00:00
Frustration and Help,2024-11-03T22:56:09+00:00
Are exams for NATS done on paper or laptop,2024-11-03T22:23:50+00:00
what is the right gym??,2024-11-03T21:46:36+00:00
"Help with Biol2020, Hi which prof should I join Kyle Belozerov or Mark Bayfield for biol2020?? How would the test??",2024-11-03T21:25:55+00:00
HH/PSYC 1010 6.00 Introduction to Psychology,2024-11-03T19:52:26+00:00
Forgot to write the bubble answer sheet,2024-11-03T19:46:58+00:00
EECS 1012 or EECS 1015?,2024-11-03T19:40:16+00:00
HH/PSYC 2120 - Social Psychology,2024-11-03T19:31:48+00:00
Surface Laptop for Sale,2024-11-03T14:09:01+00:00
transfer from seneca@york - graphic design,2024-11-03T10:11:59+00:00
Rate york on a scale of 1-10,2024-11-03T07:07:26+00:00
How does the reassign feature wok on URPP?,2024-11-03T02:20:31+00:00
Online 9-Credit Summer Courses,2024-11-03T02:09:02+00:00
Anyone dropping ADMS 2200 Section O for Online with Prof Lee?,2024-11-03T01:43:41+00:00
York U Visual Arts Studio,2024-11-03T01:03:15+00:00
Tait McKenzie Gym ??,2024-11-02T23:09:50+00:00
Undergrad HRM program,2024-11-02T20:36:03+00:00
