Title,Date
ECN 211 in person or icourse?,2024-12-03T02:36:19+00:00
ASU for science?,2024-12-03T01:13:41+00:00
Zybooks bad or am eye dumb?,2024-12-03T00:43:07+00:00
"Failed De Silvas BIO 340 twice, now what?",2024-12-02T20:59:19+00:00
how hard is geochemistry?,2024-12-02T20:50:18+00:00
Lemme send one of you to Arlington,2024-12-02T18:18:44+00:00
2023 Bachelor of Science Graduation Sash,2024-12-02T15:36:04+00:00
"Weekly /r/ASU Discussion - December 02, 2024",2024-12-02T10:00:18+00:00
CEL 100 Perez,2024-12-02T04:59:39+00:00
CSS profile,2024-12-02T04:21:51+00:00
Cc future transfer student,2024-12-02T03:59:23+00:00
Softwares used for Architecture,2024-12-02T02:56:14+00:00
Yugo terrace Tempe,2024-12-02T02:52:35+00:00
What information do people writing my letters of recommendation need to know,2024-12-02T02:28:54+00:00
"Grader offer, not sure about number of working hours",2024-12-02T02:26:09+00:00
EE Course load for next semester,2024-12-02T02:01:11+00:00
What are fun classes that involve MATLAB,2024-12-02T01:47:29+00:00
Update: thank you for trialing our business!,2024-12-02T00:55:54+00:00
How much cheaper is ASU with the employee Qualified Tuition Reduction?,2024-12-01T23:52:06+00:00
Is this normal advising?,2024-12-01T22:08:18+00:00
Is it too late to apply to ASU online?,2024-12-01T19:51:23+00:00
Time-for-Print Collaboration?,2024-12-01T18:06:28+00:00
"for a bio class with 3 seats left, do i have a fair chance of getting a seat?",2024-12-01T15:27:51+00:00
MKT 300,2024-12-01T01:26:48+00:00
Withdrawal,2024-12-01T01:17:03+00:00
Petition for Increased Access to Water on Campus,2024-12-01T01:00:35+00:00
Tuition Surcharge,2024-11-30T23:59:09+00:00
Ms in AI,2024-11-30T21:14:45+00:00
Neuroscience/Pre-med?,2024-11-30T20:17:47+00:00
What’s on the line today for ASUF,2024-11-30T20:15:38+00:00
Overpayment (? 🤔),2024-11-30T19:31:57+00:00
🔆😈 - 2024 TERRITORIAL CUP PRAYER THREAD 🙏- 🔆😈,2024-11-30T15:30:00+00:00
On Campus Macs with FCP,2024-11-30T14:37:21+00:00
Changing Major,2024-11-30T07:34:27+00:00
Study rooms at library,2024-11-30T06:51:52+00:00
Where to get a good bike,2024-11-30T03:04:30+00:00
How is ASU CS major?,2024-11-30T00:35:56+00:00
Are these classes too much?,2024-11-29T21:20:26+00:00
Is there any jui jitsu clubs or something similar I could join without experience or cost?,2024-11-29T19:19:20+00:00
ASU Passport Office,2024-11-29T17:47:29+00:00
Human System Engineering Careers Questions,2024-11-29T17:45:47+00:00
Want to eat in ASU dining hall?,2024-11-29T09:34:02+00:00
Career Accelerator Workload?,2024-11-29T05:21:52+00:00
"calling all stem majors, those who took the 265 266 and 267 routes of math, along with 343 and 275",2024-11-29T00:52:44+00:00
Looking for someone to do my eee 120 capstone for payment,2024-11-28T21:59:29+00:00
is it worth it,2024-11-28T17:20:01+00:00
Is the CS program worth it?,2024-11-28T16:25:19+00:00
Regarding degree awarded section in application,2024-11-28T14:15:29+00:00
How much student debt would roughly have if i go for 2 years to finish bachelors degree?,2024-11-28T08:51:27+00:00
"UF, ASU, or OSU Online CS Program? Which Is Best for Grad School?",2024-11-28T07:49:17+00:00
IEE380 Project Survey,2024-11-28T06:58:35+00:00
Scholarship offered is less than estimator,2024-11-27T21:28:13+00:00
Away fan Sun Devil Rally in Dirty T for Territorial Cup 🔱🏈,2024-11-27T19:29:56+00:00
Does this mean I didn't get any scholarship??,2024-11-27T17:51:42+00:00
Sun Devil Stadium in Minecraft,2024-11-27T17:41:18+00:00
Class reserved,2024-11-27T17:01:53+00:00
Why are YouTube pranksters like Bigdaws tv the Daily Dropout that was epic tall,2024-11-27T11:03:35+00:00
Reviews on CSE 598 Data Intensive Systems for Machine Learning,2024-11-27T06:38:25+00:00
"Any ASU SCAP students gotten refunds from scholarship money, etc?",2024-11-27T04:14:19+00:00
Business or Math Minor,2024-11-27T03:33:11+00:00
Personal Statement Formatting? One response or four separate responses?,2024-11-27T03:19:58+00:00
arizona state University,2024-11-27T02:36:18+00:00
Can you change how many people you want to bring to graduation?,2024-11-27T02:29:19+00:00
Major,2024-11-27T01:37:48+00:00
Advice/Help: Advisor not answering emails,2024-11-27T00:43:18+00:00
Old Events on ASU Events,2024-11-27T00:38:05+00:00
Urgent Help - Diploma,2024-11-26T22:51:40+00:00
Has anyone else had the …pleasure…. Of having a class “taught” by Darryl Reano?,2024-11-26T22:10:31+00:00
Does anyone know if professor Broberg does + and - or just straight letter grade.,2024-11-26T21:56:34+00:00
Dependency Question,2024-11-26T21:35:57+00:00
meal exchange question,2024-11-26T19:26:06+00:00
Making a Flag football league,2024-11-26T18:28:51+00:00
Does ASU automatically give you merit based scholarships after a certain amount of time?,2024-11-26T18:01:14+00:00
My classes at ASU start on 13th Jan but my visa interview scheduled for 15th Jan. Is it possible for me to attend the classes two weeks late?,2024-11-26T17:58:58+00:00
ASU application payment error,2024-11-26T17:34:53+00:00
Recommendations for good restaurants for lunch in Tempe that ASU students like?,2024-11-26T11:16:37+00:00
Difference between M.S Computer Engineering (Electrical Engineering) vs M.S Computer Engineering (Computer Systems Engineering),2024-11-26T09:26:24+00:00
SCAP to in person,2024-11-26T09:04:34+00:00
Who was the dude dressed as Santa?,2024-11-26T07:50:05+00:00
anyone have the link for the thanksgiving meal sign-up?,2024-11-26T06:18:51+00:00
Anyone know where I can access a drum set on campus?,2024-11-26T01:28:47+00:00
ASU barrett?,2024-11-26T01:19:41+00:00
Chik fil a smaller salads?,2024-11-25T22:33:08+00:00
Has anyone failed Mark Simonson for FIN 461?,2024-11-25T22:12:01+00:00
CSE 310 spring or summer,2024-11-25T20:52:48+00:00
Course selection help needed,2024-11-25T20:41:29+00:00
English 1st year composition,2024-11-25T18:29:01+00:00
Have You Ever Have This Happen? Was looking for Job Before Graduating,2024-11-25T16:58:06+00:00
Has anyone taken cse340 with Claveau?,2024-11-25T16:36:24+00:00
Indoor Gun Range Recommendations in Tempe?,2024-11-25T16:31:45+00:00
"Weekly /r/ASU Discussion - November 25, 2024",2024-11-25T10:00:19+00:00
ASU online program experience,2024-11-25T05:30:44+00:00
CSE 310 final,2024-11-25T05:16:46+00:00
Private mcat tutoring,2024-11-25T04:04:48+00:00
Switching to CHM 114?,2024-11-25T02:15:32+00:00
Business Specializations,2024-11-25T02:11:03+00:00
Question about financial aid refund,2024-11-24T22:07:25+00:00
re: hypothetical fixed esa cat had a hypothetical kitten in asu dorms,2024-11-24T22:01:52+00:00
Cap and Gown,2024-11-24T20:53:03+00:00
Clothing advice,2024-11-24T20:25:54+00:00
"When ASU beats UofA next week, are they DEFINITELY in the BIG 12 champ game? Or can they get screwed in some 3-way tie-breaker?",2024-11-24T16:52:11+00:00
Big 12 Championship Game,2024-11-24T15:45:56+00:00
Writing Center,2024-11-24T06:10:53+00:00
Sports bars to watch the f1 race tonight?,2024-11-24T00:56:51+00:00
THANK YOU JOSEPH SMITH FOR SAVING ASU,2024-11-24T00:22:24+00:00
"Admitted for Engineering Managememt, even though I applied CS?",2024-11-23T22:21:35+00:00
I’m so proud of our football team…,2024-11-23T21:45:51+00:00
Quiet space at the ASU stadium,2024-11-23T21:45:18+00:00
Anyone into Law of Attraction? if yes then lets talk or DM,2024-11-23T21:01:53+00:00
"Born and Raised in AZ, but never followed college football, want to hop on the ASU bandwagon. What do I need to know?",2024-11-23T18:48:23+00:00
Hysa account for student,2024-11-23T16:20:24+00:00
Upper Division Elective Recommendations,2024-11-23T08:11:35+00:00
Is ASU really as bad as everyone says it is?,2024-11-23T04:55:44+00:00
ticket up for grabs,2024-11-23T02:31:41+00:00
Does ASU check student ID’s?,2024-11-23T02:11:11+00:00
ASU Greek life as an underage (19-year old) international student,2024-11-23T01:58:51+00:00
Tickets for game v byu,2024-11-22T23:45:14+00:00
Best place to watch the ASU vs. BYU game,2024-11-22T23:31:07+00:00
Class suggestions for spring,2024-11-22T22:10:59+00:00
cse 205 advice needed,2024-11-22T22:06:25+00:00
Is there anyone who took phy111 before?,2024-11-22T19:43:57+00:00
Tickets for ASU-BYU?,2024-11-22T19:05:00+00:00
Engineering Online Summer Courses,2024-11-22T19:01:10+00:00
Anyone accepted into M.arch? Looking for portfolio help.,2024-11-22T18:58:51+00:00
Are all previous online classes available till graduation and post graduation?,2024-11-22T18:02:51+00:00
Electrical Engineering Online Masters,2024-11-22T17:51:51+00:00
What's going on with canvas.asu.edu?,2024-11-22T17:16:59+00:00
durham,2024-11-22T15:27:16+00:00
BIO 160 with Hyatt,2024-11-22T15:22:53+00:00
Student ID number (online),2024-11-22T12:16:57+00:00
Starbucks ASU Program,2024-11-22T09:12:36+00:00
Justice Studies MS application deadline,2024-11-22T09:00:11+00:00
CSE 300's and DAT minor,2024-11-22T06:45:45+00:00
Send code to another student,2024-11-22T05:11:25+00:00
graded feedback on your papers,2024-11-22T03:10:23+00:00
Fulltime student eligibility,2024-11-22T02:19:04+00:00
Tutoring,2024-11-21T22:42:23+00:00
Best ASU Certification or Minor?,2024-11-21T21:02:39+00:00
Is anyone selling a football ticket?,2024-11-21T20:25:25+00:00
Academic Paper planner (Gannt chat) for any subject 📈📊,2024-11-21T20:18:10+00:00
If you're going to the football game Saturday...,2024-11-21T19:10:27+00:00
Anyone selling football ticket?,2024-11-21T18:12:11+00:00
I got an email saying I received a scholarship but I can't find it under finances.,2024-11-21T17:13:34+00:00
Question about on-campus jobs at ASU,2024-11-21T16:29:03+00:00
Best Honors Credits,2024-11-21T15:53:30+00:00
Best Honors Credits,2024-11-21T15:52:45+00:00
ENG 302 Prof/A or B session?,2024-11-21T14:57:13+00:00
Going out prices in Tempe,2024-11-21T07:39:01+00:00
I'm looking for a comfortable gaming chair that is similar to secretlab.,2024-11-21T07:32:22+00:00
ASU vs BYU game,2024-11-21T06:57:50+00:00
BYU vs ASU tickets,2024-11-21T06:26:04+00:00
Football Tailgates,2024-11-21T06:21:24+00:00
HUAD class,2024-11-21T05:54:58+00:00
Attendance of first week of PHY113 w/ Dolenko,2024-11-21T05:28:41+00:00
How do I go about selling a ticket for the ASU game?,2024-11-21T04:08:40+00:00
"UX Program, MS",2024-11-21T03:15:37+00:00
"I got admit , what to do next",2024-11-21T02:39:33+00:00
Architecture (Online classes),2024-11-21T00:27:12+00:00
American Sign Language (ASL) at Rio Salado for ASU secondary language requirement,2024-11-20T23:45:43+00:00
Thinking about doing Marine Sciences online,2024-11-20T23:39:09+00:00
Anyone selling tickets for game?,2024-11-20T23:12:20+00:00
Grade Replacement on Transcript,2024-11-20T21:34:58+00:00
Nursing DA,2024-11-20T18:29:34+00:00
IB exam/class credits to ASU general studies credit?,2024-11-20T17:47:01+00:00
NEED TO INTERVIEW A PORTUGUESE SPEAKER,2024-11-20T17:09:48+00:00
Off campus living in Tempe,2024-11-20T14:10:33+00:00
I'm confused on the wording of the ECON PhD requirements page,2024-11-20T11:59:57+00:00
pregnant esa cat in asu dorms,2024-11-20T05:45:30+00:00
Undergrad W. P questions,2024-11-20T05:42:20+00:00
ASU vs BYU football game,2024-11-20T03:33:22+00:00
How difficult is Organic Chemistry online?,2024-11-20T02:55:10+00:00
CSE 205 Session C or Session A/B,2024-11-19T22:18:33+00:00
Football ticket,2024-11-19T20:43:30+00:00
How do I transfer someone’s BYU ticket?,2024-11-19T20:35:59+00:00
ANYONE GOT AN EXTRA FOOTBALL TICKET😭,2024-11-19T19:47:01+00:00
Duo Down?,2024-11-19T19:15:06+00:00
CA for Barrett Villas or Upper Division,2024-11-19T18:49:51+00:00
Spring 2025 graduation,2024-11-19T18:14:56+00:00
calc 3,2024-11-19T17:36:17+00:00
ASU v BYU FOOTBALL TICKETS,2024-11-19T04:28:37+00:00
Beware of Wolfie Khaletti (aka WolfieParty): A TikTok/Instagram Influencer Who Crosses the Line,2024-11-18T22:17:03+00:00
URGENT NEED SOMEONE TO SUBLET,2024-11-18T22:02:47+00:00
JOB HUNT HELP,2024-11-18T21:55:59+00:00
Have you ever taken online courses in Riosalado college?,2024-11-18T18:06:31+00:00
CSE 365,2024-11-18T16:52:38+00:00
"Weekly /r/ASU Discussion - November 18, 2024",2024-11-18T10:00:18+00:00
Why do some classes offered A+ and some only A?,2024-11-18T07:16:02+00:00
Badminton and accounting major at ASU,2024-11-18T06:17:25+00:00
No Guest Pass for BYU Game,2024-11-18T06:01:16+00:00
Yoga,2024-11-18T05:46:26+00:00
ASU scholarship cap,2024-11-18T05:18:58+00:00
Did I just get rejected from ASU..,2024-11-18T03:54:50+00:00
Barrett Honors College,2024-11-18T03:17:36+00:00
Pop up Thrift shops,2024-11-18T01:59:02+00:00
Football tickets,2024-11-18T01:30:27+00:00
Skattebo swag,2024-11-17T23:56:00+00:00
Comp Sci MAT,2024-11-17T23:33:20+00:00
Online Master of Human Resources and Employment Law (work load & difficulty),2024-11-17T22:09:35+00:00
We are ranked!!!,2024-11-17T21:51:39+00:00
Best locks for scooter,2024-11-17T20:59:18+00:00
Looking for web/front-end developers and graphic designers at ASU Tempe for a project,2024-11-17T19:07:01+00:00
Apply to both PhD and Masters in computer science,2024-11-17T17:08:58+00:00
So... I just got rejected,2024-11-17T16:08:43+00:00
New to ASU,2024-11-17T14:44:49+00:00
How’s the dating culture in ASU?,2024-11-17T10:13:10+00:00
Nexa apartments noise,2024-11-17T07:59:56+00:00
CSE 240 deficiency but no tutorials on ASU career catalyst course(canvas course).,2024-11-17T05:48:50+00:00
Transfer,2024-11-17T05:28:07+00:00
Do you struggle with ADHD?,2024-11-17T02:57:24+00:00
Critical Paper - English MFA Application,2024-11-16T21:57:23+00:00
STP226 vs SOC390 – Which stats course should I take?,2024-11-16T20:40:58+00:00
Need help in CSE355,2024-11-16T19:19:56+00:00
Deans Medalist Award,2024-11-16T17:50:05+00:00
ASU CSE 110,2024-11-16T17:33:18+00:00
ASU Global Career Accelerator,2024-11-16T15:25:21+00:00
Does a P grade count towards DARS?,2024-11-16T05:17:28+00:00
Nursing test optional.,2024-11-16T03:08:22+00:00
Arizona State vs BYU Football Game Tickets,2024-11-16T01:32:17+00:00
CS major question related to map major,2024-11-16T00:07:20+00:00
Meal plan question,2024-11-15T21:28:48+00:00
What major should I go for if I want to get into the Pharmaceuticals field?,2024-11-15T20:51:29+00:00
Uni 220 & other Academic Support Classes,2024-11-15T18:27:22+00:00
Does MandG dollars reset every semester,2024-11-15T17:37:48+00:00
Union Tempe water,2024-11-15T17:00:31+00:00
classes downtown living in tempe,2024-11-15T16:51:48+00:00
5 programs sleection in one application fee,2024-11-15T14:07:18+00:00
How is the aerospace program? Labs? I am visitong in a couple weeks from IL.,2024-11-15T04:06:47+00:00
Fasfa,2024-11-15T03:52:09+00:00
Personalized Admission Offer Questions?,2024-11-15T02:28:00+00:00
Reynolds for MAT 343,2024-11-15T01:16:21+00:00
I-20 issuance timeline for international students,2024-11-15T01:11:57+00:00
Jake Paul v Mike Tyson,2024-11-15T00:39:32+00:00
The Piedmont,2024-11-15T00:23:55+00:00
"May fail one class, already applied for graduation and bought all regalia",2024-11-14T23:55:26+00:00
Has anyone majored in finance and then gone into investment banking from this school?,2024-11-14T22:07:47+00:00
Withdraw a class,2024-11-14T20:40:53+00:00
URGENT. Meta doesn't sign school CPT forms or evaluation of internship,2024-11-14T20:26:55+00:00
Ecn 315 money and banking,2024-11-14T19:18:22+00:00
Midterms for EEE511 Artificial Neural Computation by Prof. Jennie Si,2024-11-14T18:42:12+00:00
What will the Dept of Education dismantling mean for Colleges/Academics?,2024-11-14T16:50:10+00:00
Firetruck outside Noble Library,2024-11-14T16:47:19+00:00
How to get summer internship??,2024-11-14T05:05:22+00:00
Thoughts on Global Career Accelerator?,2024-11-14T05:01:33+00:00
Master Suite (Bedroom & Private Bath) Available for Spring 2025 near ASU Campus – Ideal for Returning Study Abroad Students or anyone looking for a place to live for the spring semester.,2024-11-14T01:34:46+00:00
Official transcript a,2024-11-13T22:28:23+00:00
Gcu 113,2024-11-13T21:12:18+00:00
Handshake seems like a joke,2024-11-13T18:22:52+00:00
Connecting with Indian Students,2024-11-13T14:27:02+00:00
Class with graduate student as teacher,2024-11-13T08:21:48+00:00
My room smells like liquid chicken,2024-11-13T06:36:50+00:00
Applied to the comp sci program but didn't take any entrance exams.,2024-11-13T04:06:18+00:00
Sending admission,2024-11-13T03:32:57+00:00
does asu PD care about stolen bikes/scooters?,2024-11-13T02:46:18+00:00
Degree Minors,2024-11-13T02:06:43+00:00
Plotting on getting masters w/ thesis/doctorate. How do I cold email professors for this?,2024-11-13T01:56:12+00:00
ACO 201,2024-11-13T01:53:11+00:00
Honors mailer.,2024-11-12T23:50:21+00:00
PhD admissions committee and GRE scores,2024-11-12T23:46:28+00:00
Jobs that Pay Tuition,2024-11-12T23:45:28+00:00
Volunteers for my Master’s thesis. Please help!,2024-11-12T22:26:34+00:00
I cirrently work at Starbucks doing SCAP. I received a direct deposit from ASU. My question is do I need to pay back this money or is it mine to keep??,2024-11-12T22:11:15+00:00
Best Places to Live around Campus?,2024-11-12T20:24:07+00:00
question for changing majors,2024-11-12T19:25:25+00:00
CRJ 450 with Louton,2024-11-12T18:01:57+00:00
Is it weird to buy cap/gown for online degree?,2024-11-12T17:00:49+00:00
Incoming out of state freshman,2024-11-12T12:40:16+00:00
Do any of you skateboard?,2024-11-12T07:45:21+00:00
sports journalism major,2024-11-12T07:16:06+00:00
Boy do I want to drop out….,2024-11-12T03:21:33+00:00
NEED PERSON!!! Subleasing Bedroom Fall 2025,2024-11-12T02:53:49+00:00
Signs of a good interview?,2024-11-12T01:40:39+00:00
looking for co authors for publications,2024-11-11T20:31:28+00:00
"I put AP, instead of honors on my application.",2024-11-11T19:41:19+00:00
scholarships 2025,2024-11-11T19:13:38+00:00
Gender,2024-11-11T13:10:37+00:00
Anyone in the ASU aviation program can you please DM me(wanted to inquire about it) Thank you so much!,2024-11-11T11:32:03+00:00
"Weekly /r/ASU Discussion - November 11, 2024",2024-11-11T10:00:17+00:00
28% in turntitn,2024-11-11T07:10:11+00:00
Makerspace at Hayden,2024-11-11T05:27:31+00:00
Using financial aid/loans on the bookstore,2024-11-11T04:59:33+00:00
New American University Scholarship question,2024-11-11T01:57:58+00:00
how cooked am I,2024-11-11T00:25:11+00:00
Need Help Finding A Job,2024-11-10T21:56:26+00:00
Rental laptop?,2024-11-10T20:37:37+00:00
ASU employees can you share info about the interview process?,2024-11-10T16:17:05+00:00
Online Korean Classes?,2024-11-10T15:24:29+00:00
Best Mobile Plan,2024-11-10T15:00:27+00:00
Out of Towner Review,2024-11-10T05:18:14+00:00
COVID Testing Kits on Campus,2024-11-10T04:13:44+00:00
Apartments,2024-11-10T00:33:04+00:00
To The People Who Shout in Your Study Rooms,2024-11-09T23:36:11+00:00
CSE568 w/ Stephanie Forrest,2024-11-09T22:52:57+00:00
Pavlov wifi,2024-11-09T22:39:40+00:00
MAT 251,2024-11-09T20:41:58+00:00
Course recommendation,2024-11-09T20:29:08+00:00
fulton laser cutting,2024-11-09T17:44:59+00:00
Classes are reserved,2024-11-09T17:35:35+00:00
Transferring from online to in person,2024-11-09T17:05:52+00:00
Taken CSE 510 (Database management system implementation) under Selcuk Candan. Want to know more about this course ...,2024-11-09T14:00:13+00:00
Side projects for CS majors,2024-11-09T10:52:29+00:00
Anyone know what’s going on?,2024-11-09T09:47:40+00:00
Why is W.P.Carey so expensive,2024-11-09T09:11:02+00:00
"Stuck between a Business (Communication) , BA and Digital Audiences , BS",2024-11-08T16:54:54+00:00
Need Web CS or IFT class recs for GIT Full Stack student,2024-11-08T18:07:49+00:00
In town for a golf trip - Looking for a good bar before ASU game,2024-11-09T07:23:40+00:00
MCAT study buddy,2024-11-09T04:34:35+00:00
Off Campus Apartments near Tempe or in Mesa (close to E Main),2024-11-09T02:34:34+00:00
Should I take these classes in the same semester,2024-11-08T21:43:53+00:00
"Transferring from Community college, I don’t think it prepared me for ASU",2024-11-08T21:07:00+00:00
TA's Grading,2024-11-08T20:04:12+00:00
Noble Bathrooms,2024-11-08T19:02:10+00:00
MAE242 Fluids Professors,2024-11-08T18:58:49+00:00
ASU rejected my Bank Statement twice,2024-11-08T18:29:54+00:00
Looking for a female roommate,2024-11-08T18:29:42+00:00
Don't take Universal Pathways (ULC) ECN 211,2024-11-08T17:30:06+00:00
The cost of not being #1 in Innovation,2024-11-08T15:27:47+00:00
How are the classes for Global Logistics Management?,2024-11-08T12:28:21+00:00
How to get the Zoom developer role for my ASU Zoom Account,2024-11-08T09:16:26+00:00
on-campus jobs,2024-11-08T06:15:10+00:00
Question about admissions,2024-11-08T04:49:40+00:00
MAT142 ‘recommended’ for BS communications,2024-11-08T01:47:06+00:00
Is it naïve to do Engineering in Barrett while participating in NGSC,2024-11-08T01:31:47+00:00
EEE 120 with Millman final difficulty,2024-11-08T01:14:28+00:00
CSE 230,2024-11-08T00:23:22+00:00
I’m freezing,2024-11-08T00:20:55+00:00
MATH 142,2024-11-07T21:22:07+00:00
Post your PSY 290 and other research class surveys here! lets help each other!,2024-11-07T20:39:32+00:00
Help! How do I handle a situation with group member that is not contributing,2024-11-07T19:19:11+00:00
MS in SCM from ASU,2024-11-07T18:35:41+00:00
Library aide timeline,2024-11-07T18:27:28+00:00
Ain’t no way the entire east weight room is closed for five days,2024-11-07T17:59:46+00:00
Certificate “not active”,2024-11-07T17:41:28+00:00
"Anyone who too. Thesis route, can you guide/help me.",2024-11-07T15:35:03+00:00
Scholarship,2024-11-07T15:00:09+00:00
Land an internship from Global Career Accelerator?,2024-11-07T07:01:20+00:00
Did aramark stop hiring,2024-11-07T06:26:35+00:00
GEO 101 tips,2024-11-07T04:34:39+00:00
Comm 316 gender and communications,2024-11-06T22:55:03+00:00
Does anyone dropping CHM 234 . Gary Moore in spring 2025 semester?,2024-11-06T21:26:42+00:00
Advisor fucked up advice and now tells me to do an extra semester for one class.,2024-11-06T20:57:17+00:00
Just saw a student with a MAGA hat on,2024-11-06T20:16:59+00:00
Group Projects,2024-11-06T19:39:05+00:00
Sukitha math 266,2024-11-06T19:37:55+00:00
Class full,2024-11-06T19:01:26+00:00
what is the reason for not having classes on monday,2024-11-06T18:27:17+00:00
PHD Query.,2024-11-06T17:43:58+00:00
Internations students Internships,2024-11-06T17:42:03+00:00
Should i drop MAT 117,2024-11-06T17:36:40+00:00
Does anyone else think dreamscape learn is fucking useless?,2024-11-06T17:10:38+00:00
selling tickets to 6 flags and hurricane harbour,2024-11-06T17:06:07+00:00
Would an online undergrad from ASU be valued?,2024-11-06T15:31:54+00:00
Am I Screwed?,2024-11-06T14:50:15+00:00
D.J.Trump won. Bombard ur views.,2024-11-06T14:22:33+00:00
COM 308,2024-11-06T14:14:30+00:00
Attending Different Gen. Chem Lecture Than the One I Signed Up For,2024-11-06T13:45:47+00:00
Australia,2024-11-06T07:42:38+00:00
Muscle Factory Gym,2024-11-06T06:51:59+00:00
Do ALL CC credits transfer to ASU?,2024-11-06T06:16:36+00:00
Need a lower division lab science help!,2024-11-06T01:51:16+00:00
BIO 201,2024-11-05T23:53:44+00:00
Med school admissions requirements,2024-11-05T23:28:27+00:00
I’m hating English 102,2024-11-05T22:06:08+00:00
GLG 110/111 vs BIO 160,2024-11-05T22:03:38+00:00
How good are ASU biology degrees?,2024-11-05T21:27:27+00:00
Fan-funded NIL deals,2024-11-05T20:07:21+00:00
Skip classes and go to vote. This country is in your hand.,2024-11-05T19:54:51+00:00
missing ti-84,2024-11-05T18:57:11+00:00
Some fun Spatial/AR/VR classes to take,2024-11-05T18:22:59+00:00
How hard is EEE120 ?,2024-11-05T18:09:51+00:00
withdrawing ON the drop deadline day?,2024-11-05T14:13:49+00:00
SOP Length for Masters in CS program,2024-11-05T09:25:57+00:00
Just asking,2024-11-05T07:41:32+00:00
SCN classes,2024-11-05T04:50:57+00:00
Has anyone taken IFT 300?,2024-11-05T04:17:22+00:00
How to effectively approach pwn.college challenges?,2024-11-05T03:55:40+00:00
Math 270,2024-11-05T03:22:54+00:00
Psy290 surveys,2024-11-05T03:07:48+00:00
Thoughts on transferring,2024-11-05T02:44:49+00:00
Thoughts,2024-11-05T00:43:44+00:00
gammage cross-park?,2024-11-04T23:29:41+00:00
Stp 226 Exam 3,2024-11-04T22:05:50+00:00
Applying to ASU,2024-11-04T21:17:59+00:00
Hacking history and culture class,2024-11-04T21:12:49+00:00
Nightlife,2024-11-04T21:10:01+00:00
Help on choosing subjects…..,2024-11-04T20:35:19+00:00
Vacancy for a private room with attached bathroom in ten 01,2024-11-04T20:09:18+00:00
ASU Shuttles,2024-11-04T19:50:51+00:00
Regarding scholarships for international students,2024-11-04T19:47:24+00:00
Tailgating for Canadians?,2024-11-04T19:25:58+00:00
Men Should get Vaccinated to Protect Themselves and Their Partners,2024-11-04T19:11:44+00:00
Class withdrawl question,2024-11-04T19:10:19+00:00
Looking for advice,2024-11-04T18:49:28+00:00
Being removed from a Major,2024-11-04T18:06:46+00:00
Department head and advisor suggested I drop out,2024-11-04T16:32:36+00:00
Switching Majors,2024-11-04T15:21:36+00:00
Clarity on MSBA Spring 2025 program,2024-11-04T15:20:43+00:00
Roommate Issues,2024-11-04T12:29:29+00:00
Aussie Exchange Student—Thoughts on ASU Experience?,2024-11-04T12:20:21+00:00
Ease of registering for upper-level Marketing classes at Tempe,2024-11-04T12:14:21+00:00
"Weekly /r/ASU Discussion - November 04, 2024",2024-11-04T10:00:19+00:00
Applied Linear Algebra | Zoe Wellner,2024-11-04T08:59:20+00:00
ASU or SDSU for entrepreneurship undergrad,2024-11-04T08:32:29+00:00
DAT402,2024-11-04T07:15:10+00:00
Why do CS students keep adding me on LinkedIn,2024-11-04T06:37:27+00:00
acceptance into masters programs ?,2024-11-04T05:50:55+00:00
Should I switch my major from CS to data science?,2024-11-04T05:43:45+00:00
kamala vs trump,2024-11-04T05:05:23+00:00
Volunteering Opportunities,2024-11-04T05:02:23+00:00
