Title,Date
One card not working,2024-12-02T21:22:28+00:00
Gap year info,2024-12-02T02:03:34+00:00
Pre-Health Adv to Paramedic,2024-11-28T15:38:28+00:00
Guelph campus,2024-11-28T15:30:03+00:00
"Driving on, and off campus.",2024-11-28T01:36:10+00:00
ATTN All Part-time Students: You are being scammed by CSI,2024-11-26T21:14:32+00:00
Culinary education,2024-11-26T16:34:23+00:00
Looking to sell a laptop used for Bachelors of Computer Science program.,2024-11-24T19:48:44+00:00
Looking to Connect With Current Software Engineering students at conestoga college.,2024-11-23T18:02:37+00:00
Concern about my course next semester is my last and I have failed in one subject in my second sem I haven't taken that subject in third sem because of schedule issues now I want to take that subject in last semester but I already have 8 subject can I add that subject or not? If not what should I do,2024-11-20T03:19:19+00:00
Osap application deadline,2024-11-14T12:49:20+00:00
Question about elective costs,2024-11-13T23:14:13+00:00
Aggressive PDA seen at door 6 on doon campus.,2024-11-11T23:53:35+00:00
Anyone Coming for Jan2025 doon campus,2024-11-10T14:40:13+00:00
Medical Laboratory Assistant/Technician Program,2024-11-07T00:56:27+00:00
Speed Spanish Course,2024-11-06T03:49:35+00:00
Renting headphones from library,2024-11-05T11:12:50+00:00
Need some honest answers,2024-11-04T20:43:33+00:00
