Title,Date
Robert S. Harrison College Scholar Program,2024-12-01T19:09:34+00:00
Post grad plans- seniors,2024-12-01T18:22:22+00:00
"Anyone living in Storrs, Hartford, Vernon, etc in CT",2024-12-01T15:05:33+00:00
indoor tennis,2024-12-01T14:12:07+00:00
GMAT Wavier for MBA,2024-12-01T09:42:34+00:00
Housing in Ithaca,2024-12-01T07:03:45+00:00
There is no way it’s already December,2024-12-01T06:50:17+00:00
MSG,2024-12-01T00:36:29+00:00
Student section,2024-12-01T00:35:30+00:00
2 Last Minute Frozen Apple Tickets For Sale - Amazing seats,2024-12-01T00:13:35+00:00
Tix,2024-11-30T23:53:00+00:00
WE NEED YOU to help us study college loneliness!,2024-11-30T22:07:06+00:00
MSG,2024-11-30T22:00:47+00:00
Need two frozen apple tickets for tn does anyone have last minute tickets,2024-11-30T21:59:38+00:00
Anyone need Frozen Apple tickets for tonight?,2024-11-30T21:27:20+00:00
"Looking for old magazines, books, and materials for collages",2024-11-30T21:21:21+00:00
🏒 Cornell vs. Quinnipiac at MSG – 2 Frozen Apple Tickets Available Tonight! 🎟️,2024-11-30T19:50:11+00:00
Lifted Submissions Due 12/1!,2024-11-30T18:08:37+00:00
MSG hockey game,2024-11-30T17:57:41+00:00
What if you go to Cornell and end up a nobody?,2024-11-30T17:50:15+00:00
Bear necessities over break,2024-11-30T13:56:08+00:00
Math 1910,2024-11-29T23:10:27+00:00
Anyone selling two tickets for Frozen Apple Cornell Hockey game at MSG Saturday 11/30?,2024-11-29T21:50:10+00:00
CS2800,2024-11-29T03:53:30+00:00
Selling Megabus Ticket back to Ith from NYC,2024-11-29T03:51:51+00:00
Thanksgiving Day Reading about Cornell's Alleged Debt to Indigenous Americans,2024-11-28T21:22:18+00:00
The empty lot at the corner of Dryden and College at C-town,2024-11-28T18:11:27+00:00
Experience with Maplewood apartments? Incoming grad student,2024-11-28T17:25:09+00:00
"M.Eng in EP vs MS in applied physics, or both?",2024-11-28T02:25:40+00:00
5 person house 960$/month,2024-11-27T23:22:01+00:00
How Does thanksgiving dining hall schedule work?,2024-11-27T23:05:57+00:00
Is this the Cornell in Iowa,2024-11-27T22:19:06+00:00
Cornell GPA Conversion,2024-11-27T20:59:57+00:00
Jay Bhattacharya to lead NIH,2024-11-27T16:23:25+00:00
Maplewood Lease Transfer,2024-11-27T16:17:29+00:00
Skeptical of e-Cornell program. Is the content actually practical?,2024-11-27T00:58:44+00:00
HPAC Struggles,2024-11-27T00:58:39+00:00
Study Places on Cornell Campus during Thanksgiving,2024-11-26T18:02:35+00:00
Wild non-stem class suggestions,2024-11-26T08:36:37+00:00
advice for a hopeful incoming transfer,2024-11-26T03:17:18+00:00
Lost wallet on TCAT 30,2024-11-25T22:44:18+00:00
Harris Rosen '61 (1939-2024),2024-11-25T22:05:28+00:00
Lost id at Appel dining,2024-11-25T21:36:24+00:00
Crossfit resources?,2024-11-25T16:54:12+00:00
Intensive Intermediate Italian,2024-11-25T15:54:43+00:00
Cornell where’s the WiFi ?!,2024-11-25T14:07:00+00:00
Carpool to NYC?,2024-11-25T13:17:01+00:00
HD 2150 Thursday Notes,2024-11-25T03:00:30+00:00
Anyone selling red hot hockey tickets?,2024-11-25T02:56:56+00:00
Having trouble subletting my 2b2b for spring,2024-11-24T23:11:27+00:00
Greek Peak Student Discount,2024-11-24T21:27:54+00:00
Pokemon Club Interest?,2024-11-24T20:10:22+00:00
Do we have a tennis club?,2024-11-24T19:39:11+00:00
Looking for a Ride to NYC on Monday,2024-11-24T16:55:55+00:00
looking for public health/epi/disparity research,2024-11-24T16:44:53+00:00
Is it too late to compost my pumpkin?,2024-11-24T05:20:00+00:00
If you need one hockey ticket for tonight DM me.,2024-11-23T22:47:24+00:00
Where do grad students go out for drinks?,2024-11-23T21:26:03+00:00
Carpooling to Syracuse Airport for thanksgiving?,2024-11-23T20:06:51+00:00
fake businesses,2024-11-23T18:09:10+00:00
3 tixs available for sale for tonight against Princeton.,2024-11-23T17:59:02+00:00
Cornell Fitness Center alternatives during thanksgiving break,2024-11-23T17:13:32+00:00
Cornell Store Electronics,2024-11-23T16:51:44+00:00
Uber splitting to JFK on 18th December,2024-11-23T15:07:05+00:00
Linear Algebra 2210 final help,2024-11-23T05:09:33+00:00
Reaching out to professors about research as freshman,2024-11-22T23:22:57+00:00
Cornell vs Princeton Ice Hockey Game Tickets!,2024-11-22T21:20:08+00:00
Most commonly used dating app,2024-11-22T20:30:41+00:00
Anyone have the video of the fight in Morrison,2024-11-22T18:42:25+00:00
Carpool to nyc,2024-11-22T18:16:39+00:00
Uber to Newark NJ 2:30 pm Today,2024-11-22T18:04:13+00:00
Road block?,2024-11-22T17:16:34+00:00
Uber splitting to SYR on 11/23,2024-11-22T17:09:53+00:00
Update: child care grant,2024-11-22T16:40:38+00:00
Anyone selling an extra ticket to the MSG hockey game?,2024-11-22T16:32:27+00:00
PSA: For those with cars who’s don’t do winter driving,2024-11-22T16:04:28+00:00
Ticket Available for Quinnipiac Game Tonight in Section B,2024-11-22T11:58:34+00:00
MPS in Global Development,2024-11-22T07:37:04+00:00
"Orgo students, what do you think the prelim 3 average was?",2024-11-22T04:12:11+00:00
Calc 1 curve?,2024-11-22T03:46:13+00:00
Chem 2070 prelim 2,2024-11-22T03:32:27+00:00
Cornell/Ivy secret society,2024-11-21T23:05:24+00:00
"Two extra hockey tickets for Princeton this Saturday, Nov 23!",2024-11-21T22:35:24+00:00
Two extra hockey tickets for this weekend Nov 23 w Princeton!,2024-11-21T22:31:18+00:00
Brand of goggles used in the chemistry labs?,2024-11-21T22:25:24+00:00
U-Hall Photos?,2024-11-21T20:21:07+00:00
Selling 1 ticket for Frozen Apple,2024-11-21T20:04:57+00:00
Looking for off-campus lease roommates (M) on North,2024-11-21T18:25:32+00:00
Elmira airport rideshare,2024-11-21T16:09:54+00:00
Selling 2 tickets for Cornell v Princeton hockey game this Saturday,2024-11-21T05:45:24+00:00
Software engineering jobs,2024-11-21T02:32:06+00:00
How to expand the social circle and make friends from other countries?,2024-11-21T01:49:04+00:00
Why is the Cornell Sun the worst newspaper ever?,2024-11-21T01:19:16+00:00
TO EVERYONE ESCAPING THURSDAY OR FRIDAY TO NYC - CHECK THE WEATHER,2024-11-20T22:10:08+00:00
Canvas link for CHEM 1058? (CHEM 3580 support class)?,2024-11-20T18:26:15+00:00
Latin Placement Test,2024-11-20T14:56:38+00:00
Cornellians Appointed to Trump Administration Roles,2024-11-20T14:55:46+00:00
Should I come here for any exchange year?,2024-11-20T12:37:32+00:00
looking for roommate for spring semester,2024-11-20T02:01:17+00:00
Nov 30th Carpool Ithaca <-> NYC,2024-11-20T00:44:27+00:00
Anyone female students still looking for a roommate for next school year?,2024-11-19T22:23:47+00:00
take advantage!,2024-11-19T21:27:06+00:00
Are there any South Indian food options in Ithaca?,2024-11-19T18:43:39+00:00
Cornell Curve Fallacy,2024-11-19T17:46:30+00:00
Subletting Collegetown Apartment for Spring Semester,2024-11-19T16:21:26+00:00
Clock tower renovations,2024-11-19T14:32:56+00:00
Anyone driving to nyc this Friday from Ithaca ?,2024-11-19T03:00:48+00:00
A Soulful Recollection of Time Spent at Cornell,2024-11-19T02:12:31+00:00
Uber splitting to Syracuse Thursday morning,2024-11-19T01:27:49+00:00
Anyone here a former Loco employee?,2024-11-19T00:06:47+00:00
Math 1920 Final Questions,2024-11-19T00:05:36+00:00
Staff with kids: anyone know whats going on with the cornell child care grant?,2024-11-18T23:31:36+00:00
Anyone driving to nyc this Thursday/Friday?,2024-11-18T23:11:35+00:00
Subletting a room in a 7br for $495 for Spring,2024-11-18T22:57:26+00:00
Quiet places to run around campus?,2024-11-18T22:11:57+00:00
Subletting Room For Spring Semester,2024-11-18T20:47:12+00:00
Subletting my room for Spring Semester - 400 Oak Ave,2024-11-18T19:12:49+00:00
What are y'all doing for Thanksgiving break?,2024-11-18T17:00:01+00:00
Relationships at Cornell,2024-11-18T16:55:26+00:00
Anyone going to the Kiss Of Life Concert on Friday,2024-11-18T05:57:09+00:00
"Cornell staff selling 1 Nordstrom gc and 1 FLX (footlocker, champs) gc",2024-11-18T05:03:46+00:00
Looking for roommate(s) for next year‼️,2024-11-18T04:28:29+00:00
Physics upperclass student mentoring,2024-11-18T01:16:44+00:00
Cornell Tech Video Interview Tips?,2024-11-17T23:59:09+00:00
Major prereqs in summer?,2024-11-17T23:23:13+00:00
How are the Cornell Mens Hockey games?,2024-11-17T20:07:08+00:00
After Intro to Backend Development cornellappdev,2024-11-17T19:04:46+00:00
Communal Kitchen in Apartment?,2024-11-17T19:00:00+00:00
cornell building puns,2024-11-17T17:00:54+00:00
Found Key Near University Ave,2024-11-17T16:30:52+00:00
Collegetown Apartment for Spring 2025 Sublet - $900/month,2024-11-17T14:52:43+00:00
Seeking Advice: MEng CS vs MS CS at Cornell Tech.,2024-11-17T11:08:18+00:00
Cornell poem by desperate prospective student,2024-11-17T10:25:29+00:00
Info 1200 Key terms banks,2024-11-17T00:30:24+00:00
Cornell Connections,2024-11-16T23:50:16+00:00
Football team won today,2024-11-16T22:33:17+00:00
Keys Found on University Ave?,2024-11-16T15:03:18+00:00
"Sports' Season Ticket Holder ""Exclusive Online Store""",2024-11-16T02:28:51+00:00
Cornell ILR Dublin program,2024-11-16T01:45:30+00:00
Fun things to do in Ithaca,2024-11-16T01:10:05+00:00
Beginner Acapella Group?,2024-11-16T00:45:52+00:00
Big red barn grad students guests,2024-11-15T19:32:52+00:00
Hopeless at Cornell,2024-11-15T17:19:55+00:00
How to break a lease,2024-11-15T15:48:02+00:00
Fairview manor thoughts,2024-11-15T14:17:50+00:00
"Advice Needed: J-1 Visa, Unpaid Internship, and Living Costs at Cornell",2024-11-15T10:42:33+00:00
Several Questions about PhD programs,2024-11-15T04:03:29+00:00
Is Statistics and Data Science minor available for undergraduates?,2024-11-15T02:48:09+00:00
Selling Used Macbook,2024-11-15T00:44:57+00:00
"to the girl in morrill hall who said ""everyone who wants a break is fucking lazy and stupid"":",2024-11-14T22:04:40+00:00
Can we create a flair for events that will hand out free merch,2024-11-14T22:03:31+00:00
Need a drummer for student rock band,2024-11-14T21:03:53+00:00
Missing keys,2024-11-14T20:52:47+00:00
Sublet for spring 2025 close to campus,2024-11-14T20:35:02+00:00
co-ops as a transfer?,2024-11-14T19:47:44+00:00
Difficulty of ILR to CAS transfer?,2024-11-14T17:35:04+00:00
RA Applications,2024-11-14T17:07:00+00:00
Survey for class,2024-11-14T14:37:13+00:00
Does anyone remember what the curve was like in ECON 3801 last sem/year? Thanks!,2024-11-14T08:31:56+00:00
"(off-campus housing, College 312) Rent my bedroom in CT for Spring/summer 25",2024-11-14T06:02:52+00:00
"Have you transferred into or out of Cornell, and how did it go?",2024-11-13T21:42:42+00:00
energy drink recommendations,2024-11-13T18:52:26+00:00
Does anyone know approximately how big Ho Plaza is?,2024-11-13T16:43:06+00:00
Cornell Daily Crime Log (Recommended Resource),2024-11-13T16:35:45+00:00
GDEV 1102 Final,2024-11-13T16:07:15+00:00
Vandalism isn't the answer,2024-11-13T14:27:47+00:00
Things you look forward to,2024-11-13T05:49:20+00:00
Algo grade question,2024-11-13T05:16:52+00:00
Is it always this rainy,2024-11-13T05:15:42+00:00
Graduate courses at Cornell.,2024-11-13T04:42:22+00:00
Sublet for 2025 Spring,2024-11-13T00:25:23+00:00
Beyond 2024: Envisioning Just Futures & Equitable Democracy,2024-11-12T23:27:11+00:00
CHEM 2070 Spring 2025,2024-11-12T22:09:45+00:00
Run/exercise club,2024-11-12T20:04:21+00:00
sublet for jan-aug 2025!,2024-11-12T15:24:08+00:00
Sign Petition to Have a Psychiatrist at Cornell Health,2024-11-12T13:13:35+00:00
What engineering math class is the hardest?,2024-11-12T05:30:32+00:00
Furnished 2b2b in Ithaca Commons with Gym,2024-11-12T04:33:39+00:00
What are somethings about Cornell that shocked you.,2024-11-12T01:12:52+00:00
Show Kindness,2024-11-11T20:21:00+00:00
Dinner Places,2024-11-11T20:07:14+00:00
Racist assault in Ithaca/downtown,2024-11-11T20:01:22+00:00
Full Time Referral Offer,2024-11-11T17:24:39+00:00
Renting Parking Spot near Campus,2024-11-11T16:47:28+00:00
Seriously! Are you guys doing okay?,2024-11-11T16:45:05+00:00
FWS with Prof.Colin Stragar-Rice?,2024-11-11T15:08:37+00:00
"Combatting Antisemitism through the Arts, on Campus and Beyond - Tonight at 7pm, Free Tickets",2024-11-11T14:53:10+00:00
gratefulness,2024-11-11T14:24:40+00:00
Is Cornell really such a bad place?,2024-11-11T13:43:32+00:00
Apocalypse Debate 2024!,2024-11-11T13:13:42+00:00
"Seeking Housemates- 5-bed house in Collegetown, 5 minutes from campus, $1,005/person/month, 2 free parking spots, in-unit washer/dryer",2024-11-11T04:14:12+00:00
Do you have a good TA?,2024-11-11T03:30:51+00:00
About TA for Grads,2024-11-11T01:52:44+00:00
Genuinely what is wrong with this school,2024-11-11T01:09:35+00:00
Question about Getting to the Airport,2024-11-11T00:32:23+00:00
carpool to Rhode Island/Worcester for Thanksgiving,2024-11-10T23:46:35+00:00
Carpool to NYC,2024-11-10T20:41:07+00:00
Gorge Death/Injury?,2024-11-10T20:14:23+00:00
Why is the last day of class December 9th/Monday?,2024-11-10T15:34:47+00:00
room swap after move in?,2024-11-10T06:54:00+00:00
Election result opinions,2024-11-10T05:45:05+00:00
random violence in collegetown,2024-11-10T04:07:16+00:00
Is anyone interested in a 4 person ($1075 per person) apartment for next year?,2024-11-10T00:11:13+00:00
what are some of the less obvious big cultural differences between here / where you're from,2024-11-09T22:40:24+00:00
creekwood apartment,2024-11-09T19:57:52+00:00
PSA,2024-11-09T19:42:48+00:00
Anyone here good at design?,2024-11-09T19:25:53+00:00
Has anyone had jacob walters for FWS? I literally have no idea how difficult he is please help,2024-11-09T01:08:59+00:00
Anybody know which frat is the one that got suspended?,2024-11-09T00:03:13+00:00
Econ Minor,2024-11-08T23:50:59+00:00
Cornell women’s basketball looks good,2024-11-08T23:34:23+00:00
MILR Spring 2025,2024-11-08T23:32:58+00:00
Info 1200 Prelim,2024-11-08T22:32:44+00:00
LETS GO BIG RED!!,2024-11-08T22:18:10+00:00
found air pods pro (lightning type),2024-11-08T21:14:12+00:00
Pokemon TCG League - November Schedule,2024-11-08T20:23:28+00:00
Spring Parking Lot Sublet,2024-11-08T18:18:58+00:00
chem2070 study group,2024-11-08T17:51:04+00:00
ORIE Minor,2024-11-08T17:27:36+00:00
"Im in CALS, is a double major in biology and biological engineering possible?",2024-11-08T15:27:55+00:00
HADM 2230 vs. AEM 2210,2024-11-08T14:26:32+00:00
Implications for international students,2024-11-08T12:56:24+00:00
Anyone interested in buying a ticket for Saturday's (11/9) hockey game against Brown?,2024-11-08T05:07:47+00:00
Can someone send me the CHEM 3590 (Honors Organic Chem 1) syllabus? Interested to see how different it is from 3570.,2024-11-08T02:04:18+00:00
"Interested in computational psychology, cs + psych double major or cognitive science?",2024-11-08T01:46:13+00:00
Why Cornell stinky?,2024-11-08T01:21:23+00:00
Geriatric Dog Sitting - Vet school students?,2024-11-08T00:57:13+00:00
Transferring with 70+ units?,2024-11-07T23:41:22+00:00
Business minor without econ,2024-11-07T21:27:12+00:00
Anybody seen lost Sony XM5 headphones in Kennedy hall 116 auditorium,2024-11-07T20:10:43+00:00
Anyone want 11.15 calc 2 for any other time,2024-11-07T19:58:08+00:00
Finding other polyglots and multilingual people at Cornell,2024-11-07T19:16:59+00:00
ID,2024-11-07T19:05:53+00:00
cs 5220,2024-11-07T18:57:01+00:00
Project team credit,2024-11-07T18:51:52+00:00
Students who drink coffee?,2024-11-07T18:07:16+00:00
LOOKING FOR PEOPLE/MODELS FOR MUSIC VIDEO,2024-11-07T17:41:39+00:00
"Some people live in the library. When you arrive, they’re already there; when you leave, they’re still there. You never even see them have lunch or dinner. Do they ever have time to socialize or have any fun?",2024-11-07T16:53:11+00:00
Math 1920 with CS 3110,2024-11-07T13:08:55+00:00
Which color tassel?,2024-11-07T07:34:07+00:00
Tutoring rates,2024-11-07T05:48:37+00:00
Looking for Collegetown Sublet from January 2025 (Spring 2025),2024-11-07T05:19:20+00:00
Harvard Hockey tickets,2024-11-07T04:33:08+00:00
Ride to Syracuse,2024-11-07T02:06:22+00:00
Haven’t seen Cornell Sidechat so divided since the student assembly president was also a racist/rapist,2024-11-07T00:54:02+00:00
Anyone wanna swap 11.15 calc 2 for 9.05am (I have 11.15),2024-11-06T22:40:04+00:00
InfoSci Data Science Concentration Category D Petition,2024-11-06T22:37:19+00:00
Hosea Wondo for calc I,2024-11-06T22:34:25+00:00
Can I buy Tax Free Mac in Cornell store?,2024-11-06T21:15:34+00:00
READ THE ROSTER NOTES,2024-11-06T20:42:27+00:00
CHEM 2080 Case,2024-11-06T19:52:54+00:00
Is anyone selling hockey tickets for this Friday (11/8),2024-11-06T19:39:41+00:00
Ok is anyone going to New York?,2024-11-06T19:38:04+00:00
is there CommuniTEA at Dairy Bar still?,2024-11-06T19:13:43+00:00
Transfer students… when do course requirements have to be done by?,2024-11-06T18:41:29+00:00
Swap phys 1112 discussion,2024-11-06T17:39:52+00:00
Btry 3020 stats methods 2,2024-11-06T17:35:07+00:00
Course recommendation to explore engineering mqjor,2024-11-06T16:07:39+00:00
Odds of getting into CS 4410 during add/drop?,2024-11-06T15:45:10+00:00
Adding Cornell BRB Card to Apple Pay?,2024-11-06T15:44:50+00:00
GOVT 1623: samurai to superpower? Has anyone taken this class with Roebuck?,2024-11-06T15:37:45+00:00
Is attendance taken in phys 1110 lectures?,2024-11-06T15:27:34+00:00
ECON 3030 with Prof Philipp Kircher,2024-11-06T13:43:52+00:00
Kihoon Seong for Calc I,2024-11-06T13:29:14+00:00
Are we fuc*ed after last nights results? Or how do you all see it?,2024-11-06T13:15:43+00:00
"Has anyone taken Hist1200: History of the future, or had Jacob Walters as a prof?",2024-11-06T13:10:13+00:00
writing the environment fws (engl 1130),2024-11-06T13:05:12+00:00
Has anyone had jacob walters for FWS?,2024-11-06T12:56:52+00:00
Lightskin dude w twists and a superdry backpack,2024-11-06T12:53:57+00:00
"Interested in Patent Law, not sure if to major in ECE or MechEng.",2024-11-06T05:34:28+00:00
Best WiFi spots on campus for preenroll,2024-11-06T01:57:25+00:00
Math Classes? Math 4740?,2024-11-05T23:58:26+00:00
ECE 3100,2024-11-05T20:59:29+00:00
We should be allowed to vote for Cornell’s president,2024-11-05T19:56:23+00:00
What kind of humanoid robot club vision you would be interested in working on,2024-11-05T19:28:01+00:00
Collegetown Dispensary Now Open!,2024-11-05T17:59:47+00:00
Workload of CHIN1109 or CHIN2209,2024-11-05T17:32:57+00:00
Offering rides to/from SYR for thanksgiving,2024-11-05T17:16:29+00:00
Fun activities near ithaca?,2024-11-05T14:28:15+00:00
AEM 2020/ PSYCH 2940,2024-11-05T13:46:01+00:00
"Remember, Remember, the Fifth of November",2024-11-05T11:50:03+00:00
Project Team Update,2024-11-05T06:29:26+00:00
I can’t believe it’s already Election Day,2024-11-05T05:09:18+00:00
Question about Internal Transfer to Nolan,2024-11-05T05:00:34+00:00
What are the best psych courses to take as a psych major?,2024-11-05T04:51:46+00:00
Looking for physics tutor,2024-11-05T04:15:19+00:00
Any easy Ethics or D&I courses to take?,2024-11-05T03:02:09+00:00
ILRGL 1200,2024-11-04T22:27:27+00:00
Should I retake Calc 1?,2024-11-04T21:13:19+00:00
PHIL/COGST 2310 Intro to Deductive Logic with Prof. Korzukhin?,2024-11-04T20:22:19+00:00
GOVT 2605,2024-11-04T20:13:01+00:00
Sublet Spring 2025,2024-11-04T18:01:48+00:00
Will there be more seats added for CS 4782 Deep Learning?,2024-11-04T17:38:46+00:00
Fws help,2024-11-04T16:45:23+00:00
What should I take: HIST 2581 Environmental History or BSOC 2061 Ethics and the Environment?,2024-11-04T16:05:35+00:00
Making Friends and Memories as a Senior,2024-11-04T15:58:51+00:00
"Selling iPhone 13 (used, perfect condition)",2024-11-04T14:21:51+00:00
Easy AEM 3000+ 3 credit courses for External Specialization?,2024-11-04T13:34:15+00:00
Phys 1102 vs Phys 2208 for pre-meds and level of difficulty,2024-11-04T12:58:53+00:00
A note today about pre-enroll,2024-11-04T12:13:48+00:00
Relearning Calc and Stats,2024-11-04T05:13:13+00:00
