Title,Date
I am panicking,2024-12-04T02:30:24+00:00
anyone starting on spring at Armstrong campus?,2024-12-03T16:10:47+00:00
Do room changes for spring exist?,2024-12-01T23:44:41+00:00
r/GASouthernfootball has been created for all interested parties,2024-12-01T20:39:40+00:00
International,2024-11-29T10:45:11+00:00
Southern Downs apartment available,2024-11-27T19:10:24+00:00
A question for those who take the Armstrong shuttle,2024-11-27T04:46:56+00:00
Off campus housing,2024-11-24T18:57:50+00:00
Private room available for rent,2024-11-23T03:42:59+00:00
Graduation Tickets (Enmarket Arena),2024-11-20T16:06:42+00:00
Anybody take Chem 1310,2024-11-19T02:17:40+00:00
Cambridge vs. Axis,2024-11-18T02:21:37+00:00
"Can I take classes at the Statesboro campus while my main campus is Armstrong? Also, how many classes am I required to physically take at Armstrong since it's my main campus?",2024-11-18T00:54:47+00:00
a little help?,2024-11-17T00:02:49+00:00
Incoming transfer interested in rushing,2024-11-15T21:38:04+00:00
Does any body else take manufacturing processes laboratory?,2024-11-13T22:53:52+00:00
BIOL 2260K. Fully online?,2024-11-13T22:45:34+00:00
political science program?,2024-11-13T17:39:29+00:00
"incoming freshman, best dorm?",2024-11-12T21:15:21+00:00
Housing,2024-11-12T01:06:08+00:00
GA in biology and English requirement,2024-11-11T03:09:54+00:00
what is the sociology program at gsu like?,2024-11-10T13:26:31+00:00
Sublease at One Eleven South – Available December 2024!,2024-11-10T01:47:37+00:00
Anyone have any luck subletting their apartment?,2024-11-09T05:04:13+00:00
Anyone done the Eagles in DC internship?,2024-11-07T06:04:22+00:00
returning charger?,2024-11-06T19:26:33+00:00
Need help deciding housing,2024-11-06T17:56:32+00:00
"Confused about how ""InQuizitive"" is graded in online classes, can someone ELI5",2024-11-05T23:15:25+00:00
