Title,Date
Finding a roommate,2024-11-26T21:16:34+00:00
Turner house,2024-11-26T21:14:59+00:00
how does dean’s list help me?,2024-11-26T18:05:24+00:00
Portfolio Deadline,2024-11-25T19:03:11+00:00
atlanta or savannah campus for a film major?,2024-11-25T22:54:57+00:00
How can I login the touchnet,2024-11-25T21:51:41+00:00
Mail during break,2024-11-25T20:52:40+00:00
RV/trailer life as a SCAD student,2024-11-25T14:32:51+00:00
Student Web Space,2024-11-24T20:18:13+00:00
List of documents need to bring for registration day,2024-11-23T22:52:41+00:00
My mental health cannot take it,2024-11-24T01:43:07+00:00
fall 2025 admissions deadline?,2024-11-23T22:37:21+00:00
Parking between campuses,2024-11-23T18:41:23+00:00
Badminton club in Savannah?,2024-11-23T12:05:54+00:00
Is there any late registration in SCAD Savannah?,2024-11-22T21:46:34+00:00
Questions about the Hive,2024-11-22T03:23:14+00:00
Is a 4.0 GPA easy to get and maintain in an MBI?,2024-11-22T09:40:20+00:00
Community College Business I & II,2024-11-22T01:42:38+00:00
best major for makeup design?,2024-11-21T20:31:40+00:00
Jen Library Hours,2024-11-22T00:26:36+00:00
Safe places to live - atl,2024-11-21T03:45:47+00:00
Double major vs minor,2024-11-21T07:54:01+00:00
MFA Rejection Help!,2024-11-20T21:49:33+00:00
how do you create your portfolio,2024-11-21T01:51:20+00:00
Loan and Bill Due Date,2024-11-21T01:36:55+00:00
Final Grades,2024-11-21T00:50:48+00:00
International Student Aiming for Masters in Interior Design,2024-11-20T19:07:50+00:00
MA Advertising,2024-11-20T14:57:39+00:00
Grades?,2024-11-20T14:16:15+00:00
Need help with SCAD courses.,2024-11-19T22:01:52+00:00
Tips/advice,2024-11-19T17:30:38+00:00
Community college recommendations for CTXT classes,2024-11-19T05:06:23+00:00
Architectural History,2024-11-19T04:18:40+00:00
Advice About Industrial Design at SCAD,2024-11-19T01:06:52+00:00
Professor Rating?,2024-11-19T00:04:09+00:00
Housing Cancellation Request,2024-11-18T23:55:58+00:00
scad alc found in dorm ❌,2024-11-18T20:35:20+00:00
scholarships,2024-11-18T16:42:54+00:00
Advice in getting over fear of the arts,2024-11-18T03:43:25+00:00
Room swap river to ohouse,2024-11-16T00:36:25+00:00
savannah or atlanta?,2024-11-15T18:19:52+00:00
Sequential Art or Animation?,2024-11-15T01:31:10+00:00
Where to donate misc stuff?,2024-11-14T19:00:01+00:00
Tips for spending the holidays alone,2024-11-14T08:50:16+00:00
Just venting but also advice,2024-11-14T04:24:40+00:00
Sophomore housing,2024-11-14T09:12:40+00:00
In Coming Freshmen Questions,2024-11-14T04:18:46+00:00
Colloge parties at SCAD,2024-11-14T01:42:43+00:00
Hive Security Report,2024-11-14T00:01:35+00:00
Looking for a Room Near SCAD (Savannah) - January to March 2025,2024-11-13T22:43:59+00:00
Illustration or Sequential art,2024-11-13T15:43:07+00:00
Any advice on getting into scad’s Sequential art course as an international student?,2024-11-13T10:49:11+00:00
Just a Sound Editor with some free time!,2024-11-13T04:03:59+00:00
Vegetarian Dining Options At SCAD,2024-11-12T23:58:15+00:00
First-years required to for on campus living... how to find a way out of that?,2024-11-12T19:38:47+00:00
Are they’re any SCAD specific scholarships you have to actively apply to?,2024-11-12T18:43:21+00:00
"Im a foreign student looking to possibly go to SCAD, but need help with learning my financial options",2024-11-11T10:29:28+00:00
Should I learn how to skateboard?,2024-11-11T16:06:46+00:00
What is a good Laptop to run AfterEffects program?,2024-11-11T15:18:08+00:00
Parking for winter break,2024-11-10T22:24:32+00:00
SCADFit for First Years Only?,2024-11-10T16:46:19+00:00
IN NEED OF A CRICUT!!!,2024-11-10T04:01:06+00:00
Questions about Sequential Art Master Program,2024-11-09T19:47:28+00:00
The Hue - Looking for someone to take over my lease,2024-11-09T18:10:13+00:00
is the atlanta or savannah campus better?,2024-11-09T07:54:47+00:00
Transfer vs in state tuition?,2024-11-09T05:58:47+00:00
Animation Degree Questions,2024-11-09T04:01:39+00:00
"Recieving mail to PMB during break, what happens to packages?",2024-11-09T04:29:16+00:00
Which portfolio category should I pick for undergraduate admission?,2024-11-08T17:30:03+00:00
Prospective Student with Questions about SCAD Life and Academics!,2024-11-08T20:42:54+00:00
"Registered for Scad day this Saturday, but haven't gotten anything other than a registration confirmation.",2024-11-08T02:31:27+00:00
how important are my gpa and SATs??,2024-11-08T00:14:34+00:00
Why is Herstand so Cold,2024-11-06T23:22:27+00:00
SCAD ADR Labs,2024-11-06T02:13:00+00:00
Accepted,2024-11-05T21:49:13+00:00
Anybody looking to get into the Content Creation scene?,2024-11-05T15:33:47+00:00
Any insight on the M.A. in cinematography?,2024-11-05T14:41:44+00:00
Sequential Art and Animation,2024-11-04T23:12:27+00:00
SCADpro or no?,2024-11-04T19:25:51+00:00
Question for scad fashion students? Please!,2024-11-04T19:09:05+00:00
Portfolio Review,2024-11-04T14:26:01+00:00
