Title,Date
Comp. Linear Algebra makeup exam,2024-12-04T03:28:28+00:00
How difficult is Warrington MBA?,2024-12-04T02:30:41+00:00
buckman single,2024-12-04T02:16:23+00:00
Do I have a chance at getting into UF despite my low SAT score?,2024-12-04T01:58:43+00:00
MAN 3025 Textbook,2024-12-03T21:18:43+00:00
COP 3530 Textbook,2024-12-03T21:17:32+00:00
CDA 3101 Textbook,2024-12-03T21:16:50+00:00
bio gillooy exam 3,2024-12-03T20:36:47+00:00
Are Bs bad in critical tracking courses?,2024-12-03T20:07:43+00:00
On20 vs. Varsity House Apartments,2024-12-03T18:45:36+00:00
"Advice for pre (medical malpractice) law - should I do a math minor and a philosophy minor, just math or just philosophy?",2024-12-03T18:32:40+00:00
What happens if I drop my spring research seminar class?,2024-12-03T16:13:32+00:00
What are your favorite kind of freebies from events on campus?,2024-12-03T15:54:16+00:00
Tips on uf small animal hospital volunteer program,2024-12-03T15:41:43+00:00
what to expect from ALP projects,2024-12-03T15:25:20+00:00
Test scores,2024-12-03T14:52:39+00:00
Grammarly Pro,2024-12-03T14:45:39+00:00
linguistics test subject,2024-12-03T13:02:05+00:00
Who is starting the EDGE MSc ECE program in Spring 2025,2024-12-03T07:43:09+00:00
How hard is it to get into MS in CS at UF?,2024-12-03T05:07:44+00:00
Pharmacy School Interview,2024-12-03T04:53:21+00:00
ISO Beat Tees For Project,2024-12-03T04:14:20+00:00
International Student Seeking Advice on Completing Prerequisites for UF Online Computer Science Program (Before Application),2024-12-03T03:33:13+00:00
Housing cancellation fee,2024-12-03T02:48:08+00:00
gatorevals,2024-12-03T02:04:12+00:00
Am I cooked,2024-12-03T01:37:23+00:00
How does relative grading system works?,2024-12-02T23:24:32+00:00
Can someone drop Lakeside housing pls,2024-12-02T21:02:57+00:00
Are parking restrictions lifted during exams?,2024-12-02T20:40:40+00:00
Has anyone taken PCO 4930: Seminar in Counseling Psychology? Is it worth it?,2024-12-02T18:52:28+00:00
Looking to borrow someones airpod case,2024-12-02T16:52:48+00:00
Dilemma,2024-12-02T15:40:55+00:00
Fall 2025 Roomate,2024-12-02T15:34:02+00:00
UF Professor/Lecturer Question: Changcheng Song,2024-12-02T15:26:37+00:00
Looking to sublease for spring,2024-12-02T13:48:47+00:00
UF final exam?,2024-12-02T08:05:30+00:00
Success Stories: Online Graduates Getting into Ivy League Grad Schools?,2024-12-02T07:19:06+00:00
Prolonging graduation?,2024-12-02T05:29:47+00:00
Tf happened to House of Tans,2024-12-02T05:02:30+00:00
any graduate students looking to date?,2024-12-02T04:51:26+00:00
Did that guy with the stolen electric bike ever get it back?,2024-12-02T04:34:50+00:00
Are parking restrictions enforced during reading days/finals week?,2024-12-02T03:59:38+00:00
I flipping hate the bike owners,2024-12-02T02:03:27+00:00
Has anyone participated in UF in Japan: Communication in Business?,2024-12-02T01:42:31+00:00
Is my spring 2025 schedule too much for a freshman?,2024-12-02T01:26:05+00:00
Heating up dorms?,2024-12-02T01:05:26+00:00
I fucking hate the bike stealers,2024-12-02T00:56:00+00:00
Are you able to get into the southwest rec room with a santa fe I.D? Or would you have to pay for a guest pass?,2024-12-02T00:24:59+00:00
studio apartment,2024-12-02T00:00:55+00:00
eduroam not working,2024-12-01T23:46:23+00:00
Reliable parking near turlington for a night exam?,2024-12-01T22:32:07+00:00
Will I be considered for merit based scholarships if I apply today?,2024-12-01T22:12:51+00:00
Transfer rules,2024-12-01T21:33:24+00:00
Infinity hall,2024-12-01T20:35:35+00:00
Is $80K a Good Salary for Living in Gainesville as a Full-Time UF Employee?,2024-12-01T19:14:11+00:00
Do I have to take summer classes?,2024-12-01T17:58:07+00:00
Looking for a roommate!,2024-12-01T16:53:53+00:00
Fundamentals of machine learning (EEL5840),2024-12-01T16:53:09+00:00
Sublease!,2024-12-01T15:00:57+00:00
Anyone who is willing to sublet a room!!,2024-12-01T08:59:18+00:00
To the guy I saw wearing a maid dress at Dunkin' Donuts,2024-12-01T03:59:57+00:00
College park at midtown 303? (Central place 1/1),2024-12-01T03:59:18+00:00
What GPA do I need to get in?,2024-12-01T03:46:36+00:00
BSC2010L Waitlist: Am I Toast Yet?,2024-12-01T03:35:20+00:00
"How good is smoking notes, study edge, etc and what classes is it good for",2024-12-01T03:31:34+00:00
Can I end up with probation if I fail one class but still meet critical tracking GPA in CLAS,2024-12-01T01:22:57+00:00
emerging scholars decisions,2024-12-01T00:58:13+00:00
Apartments/Parking,2024-11-30T23:13:04+00:00
MCAT Estimate,2024-11-30T22:31:57+00:00
Double major in psychology and engineering?,2024-11-30T20:24:13+00:00
History of Jazz,2024-11-30T17:53:36+00:00
Should I apply to UF and FSU early action or regular?,2024-11-30T15:50:24+00:00
Dining locations today,2024-11-30T13:43:40+00:00
CHM 2051 in place of CHM 2046 for pre-professional track,2024-11-30T07:05:12+00:00
BSC3096 Compared to APK2100c,2024-11-30T05:35:20+00:00
physical key/alternative to duo push?,2024-11-30T04:06:00+00:00
Sublease for Summer 2025,2024-11-30T03:36:12+00:00
strikemagazinegnv,2024-11-30T03:04:10+00:00
Taking Summer Class Before Graduation,2024-11-30T02:24:43+00:00
Dating scene for UF graduate students?,2024-11-30T02:22:54+00:00
Music building practice rooms,2024-11-30T02:01:58+00:00
Questions about UF,2024-11-30T01:10:09+00:00
Looking for a roommate spring semester,2024-11-30T00:37:19+00:00
Anyone who has taken MHF3202 with Pilyugin: how hard was the last exam?,2024-11-29T23:39:23+00:00
ALP4940 Email,2024-11-29T22:42:50+00:00
What is the passing grade for a class that goes towards the electives 3000+ level section of degree audit and towards the 120 credits? (CLAS),2024-11-29T21:26:58+00:00
MacBook libraries?,2024-11-29T20:31:56+00:00
What’s social life like for 22-24 year old grad students?,2024-11-29T17:36:39+00:00
where to donate a mini fridge?,2024-11-29T17:34:24+00:00
Can I take classes over summer break online and have it count as a summer semester?,2024-11-29T16:40:48+00:00
Good physics tutor,2024-11-29T12:48:18+00:00
Dating as a 33(M) MBA student at UFL,2024-11-29T08:01:04+00:00
Honors Camps / Retreats,2024-11-29T06:48:47+00:00
Summer A/B in Person as a UF Online Student,2024-11-29T06:18:24+00:00
How quick and fair are college petitions?,2024-11-29T06:06:50+00:00
model un,2024-11-29T05:16:20+00:00
Programming Tutor Needed - Willing to pay $$,2024-11-29T05:13:11+00:00
"any toy/food drives, fundraisers, or charity things going on at/around uf in December?",2024-11-29T05:00:42+00:00
Help me with my Pickleball Company!,2024-11-29T03:55:43+00:00
Help me with my Pickleball company!,2024-11-29T03:54:25+00:00
Social life/scene at UF for graduate students,2024-11-29T02:08:23+00:00
Online classes during study abroad,2024-11-29T01:00:38+00:00
transfer english,2024-11-28T23:42:46+00:00
Should I go to law school early,2024-11-28T23:04:54+00:00
Are there any study abroad programs in Japan that don’t have a language requirement? And what has your experience been with them? (I’m a Business major),2024-11-28T21:30:44+00:00
Looking For a Roommate for a 2/2.5 Townhouse!!,2024-11-28T21:12:30+00:00
URGENTLY SEEKING TO SUBLET Spring and Summer 2025!,2024-11-28T19:00:58+00:00
Research Project on tracking device survey,2024-11-28T18:48:51+00:00
Entrepreneurship resources available at UF,2024-11-28T18:01:35+00:00
Linguistics major?,2024-11-28T12:06:34+00:00
"UF, ASU, or OSU Online CS Program? Which Is Best for Grad School?",2024-11-28T07:39:10+00:00
How long for a decision,2024-11-28T07:28:05+00:00
chances of transferring to uf?,2024-11-28T06:28:45+00:00
Events/places in Florida where I can meet a lot of bizarre or crazy people?,2024-11-28T03:51:07+00:00
need help w revenge,2024-11-28T03:38:55+00:00
Any insights on UF Warrington MBA?,2024-11-28T03:11:55+00:00
MAS4105 Turull,2024-11-28T02:50:21+00:00
lark vs alight?,2024-11-28T00:20:18+00:00
How crazy am I?,2024-11-27T21:14:19+00:00
Assigning work during Thanksgiving break,2024-11-27T19:45:57+00:00
Best Room Sublet Avenues,2024-11-27T19:36:42+00:00
Lakeside Double,2024-11-27T18:13:23+00:00
anyone get into the DNP FNP program?,2024-11-27T14:44:55+00:00
Dorm room,2024-11-27T10:04:41+00:00
Can someone give me the cs discord link,2024-11-27T07:26:16+00:00
How long before my flight can I enter terminal C of the MCO airport?,2024-11-27T03:49:21+00:00
For people with “bad” extracurriculars accepted between 2023 and 2024:,2024-11-27T03:23:46+00:00
Where can I find pickup basketball games on campus?,2024-11-27T03:16:17+00:00
Sociology summer courses,2024-11-27T02:43:13+00:00
Looking to sublease,2024-11-27T02:10:05+00:00
Easy science credit recommendations? (Bio or physical),2024-11-27T01:33:30+00:00
(Architecture) Do I transfer from UF to FIU?,2024-11-27T01:24:32+00:00
Transfer major switch,2024-11-27T01:20:19+00:00
symphonic band auditions,2024-11-27T00:52:22+00:00
Does uf have rolling admissions?,2024-11-26T23:57:23+00:00
parking pass?,2024-11-26T23:03:55+00:00
Would January 2025 be too late to sign a lease for off-campus housing?,2024-11-26T21:26:27+00:00
Help with getting scholarship money after graduation,2024-11-26T21:03:45+00:00
What happens if I reach the end of my 4th year without having taken all of my major requirement classes?,2024-11-26T20:09:00+00:00
Architecture transfer chances,2024-11-26T18:40:17+00:00
Internship question,2024-11-26T17:11:19+00:00
Good Asian Vegetarian Restaurants?,2024-11-26T17:00:23+00:00
MA in Mass Communication worth it?,2024-11-26T16:05:53+00:00
MDU4061,2024-11-26T15:29:57+00:00
transferring from santa fe going gator program - stuck on what major to take,2024-11-26T15:16:41+00:00
Will UF consider my middle school courses in their GPA calculations?,2024-11-26T06:42:08+00:00
roommate has loud sex every night,2024-11-26T05:37:49+00:00
stats department,2024-11-26T03:38:34+00:00
Can you use flex to get into dining halls,2024-11-26T02:32:10+00:00
How hard would it be to switch my major from philosophy to architecture?,2024-11-26T01:01:42+00:00
Premed advising/MCAT planning/Admissions Consultations from MD student,2024-11-25T23:02:37+00:00
criminology research at uf,2024-11-25T22:43:24+00:00
Looking for team members for a sports-related CISE Senior Design Project!,2024-11-25T20:03:57+00:00
Any free or cheap dance performances coming up?,2024-11-25T19:29:52+00:00
feels like i've wasted my time somehow,2024-11-25T18:12:28+00:00
Easy Classes?,2024-11-25T17:54:00+00:00
Is gator mail down?,2024-11-25T17:48:14+00:00
Rock Climbing on Campus,2024-11-25T17:33:48+00:00
WHY IS IT SO HARD TO GET A JOB?,2024-11-25T16:51:42+00:00
"Found a Disposable Camera 3 Years Ago, Just Developed It – Looking to Reunite Photos with Their Owners",2024-11-25T16:17:51+00:00
Could face academic suspension or expulsion…,2024-11-25T16:10:39+00:00
Spring Sublease,2024-11-25T16:08:56+00:00
"International students, do I have a chance at getting 'Gator Nation Scholarship'?",2024-11-25T15:45:41+00:00
Majors,2024-11-25T14:41:25+00:00
UF Teams Employee Question,2024-11-25T14:17:49+00:00
Looking for Auto Detailer (Either Mobile or I can drop off),2024-11-25T05:14:00+00:00
Any friends here ^^,2024-11-25T04:33:14+00:00
Private mcat tutoring,2024-11-25T04:07:15+00:00
bio transfer,2024-11-25T02:53:26+00:00
UF Online,2024-11-24T23:13:41+00:00
tailgate,2024-11-24T19:45:37+00:00
Alight or hub,2024-11-24T21:38:03+00:00
Shot in the dark but funny,2024-11-24T20:13:14+00:00
anyone good at gen chem that can answer this questions for me pls,2024-11-24T20:04:03+00:00
Tips for subleasing in the summer,2024-11-24T19:42:37+00:00
PHA6850 Proctored Exam Study Tips,2024-11-24T19:38:25+00:00
Finals tutoring!,2024-11-24T19:32:03+00:00
Giving away gator shirts,2024-11-24T19:17:46+00:00
financial aid revision dispersion,2024-11-24T18:11:31+00:00
Roomate Wanted,2024-11-24T15:48:44+00:00
"Bars, clubs?",2024-11-24T15:17:33+00:00
CHM 2045,2024-11-24T12:30:18+00:00
Doing Ethics: Moral reasoning theory and contemporary issues 5E,2024-11-24T06:34:14+00:00
study abroad academic advising form,2024-11-24T04:33:39+00:00
PACE Chances,2024-11-24T03:50:41+00:00
Hesi Exam help,2024-11-24T03:29:16+00:00
Spring/Summer 2025 Subleasing at Gainesville Place,2024-11-24T00:27:23+00:00
Doctors who will sign ESA paperwork?,2024-11-23T23:28:34+00:00
furries during game day???,2024-11-23T22:18:26+00:00
fafsa,2024-11-23T21:52:03+00:00
Is there an event going on today?,2024-11-23T20:34:51+00:00
volleyball game parking,2024-11-23T16:28:20+00:00
has anyone ever done the transiete student process? how does it look like?,2024-11-23T16:08:22+00:00
COP4600 question: How long did p3 take you?,2024-11-23T06:53:38+00:00
Tailgating,2024-11-23T06:01:30+00:00
PSY2012 grading scale,2024-11-23T05:16:43+00:00
Is the ACT Required for admissions,2024-11-23T02:40:06+00:00
Disposable camera film development,2024-11-23T02:29:05+00:00
Internship questions,2024-11-23T02:06:32+00:00
10 dollar game ticket!,2024-11-23T01:48:23+00:00
Did anyone take EEL 3701C,2024-11-22T23:08:45+00:00
Statement of Intent Format,2024-11-22T22:37:07+00:00
Is It just me or the water on Marston's 5th floor tastes funky,2024-11-22T21:23:01+00:00
Roomate Wanted,2024-11-22T21:14:57+00:00
Happy Birthday,2024-11-22T20:15:57+00:00
Anyone know about chm3217,2024-11-22T19:21:37+00:00
Retail Meal Swipes are Mathematically Not Worth it,2024-11-22T18:47:05+00:00
Lost my DL near Turlington.,2024-11-22T18:07:06+00:00
Steven Bruner UF Orgo 2,2024-11-22T17:32:09+00:00
Choir group in GNV/UFL,2024-11-22T17:21:07+00:00
canvas is down?,2024-11-22T17:20:56+00:00
GLY3163 with Ryan Wilhelmi,2024-11-22T17:08:31+00:00
Wifi at the baughman center?,2024-11-22T16:53:54+00:00
mhf3202,2024-11-22T16:01:42+00:00
found lost keys and dorm fob,2024-11-22T15:36:35+00:00
Classes for 19 credit semester,2024-11-22T14:48:45+00:00
Forgot my gatorlink username,2024-11-22T14:22:05+00:00
Graduate program,2024-11-22T13:59:16+00:00
Business hiring in the butler plaza area?,2024-11-22T13:13:14+00:00
Where can I get the Paradamedical fit ?,2024-11-22T12:51:30+00:00
How easy is MAP4305 online (Martacheva)?,2024-11-22T12:42:29+00:00
SELLING OLE MISS TICKET FOR CHEAP,2024-11-22T06:23:39+00:00
Study sources for Chem 2045 Final,2024-11-22T05:01:44+00:00
"When is winter break, and how long is it?",2024-11-22T04:33:37+00:00
Professor not responding to emails,2024-11-22T04:08:01+00:00
Getting from east to west side of campus?,2024-11-22T03:48:48+00:00
Question from married grad student,2024-11-22T02:59:25+00:00
MGF1130 Mathematical Thinking Online,2024-11-22T02:30:11+00:00
How does undergrad research work?,2024-11-22T01:38:12+00:00
Ole Miss Ticket,2024-11-22T00:53:27+00:00
Someone please help! Advice,2024-11-22T00:23:49+00:00
Minimum Grade to Pass Business Finance,2024-11-22T00:17:03+00:00
Looking for someone who might be willing to pick up and keep a dog until this Saturday?,2024-11-21T19:31:55+00:00
Should I take CHM2045 if I have a 75% in CHM1025?,2024-11-21T22:56:55+00:00
book club!!,2024-11-21T22:52:25+00:00
PHY2020 exam tips,2024-11-21T22:24:26+00:00
IDS2154 facets of sustainability final exam,2024-11-21T22:12:04+00:00
What if I do not get a B in FIN3403,2024-11-21T22:03:12+00:00
What are your top 5 UF merch under 50$ from the UF bookstore?,2024-11-21T20:56:23+00:00
Getting Student Tickets,2024-11-21T20:44:48+00:00
Apartment Recommendations,2024-11-21T18:46:11+00:00
Gainesville Place vs Cabana Beach vs The Canopy vs Hub 3rd ave,2024-11-21T18:41:57+00:00
survey for quest class,2024-11-21T18:34:46+00:00
Student Tickets,2024-11-21T17:56:00+00:00
Chances of getting in?,2024-11-21T17:52:23+00:00
Can't recommend getting a meal plan anymore...,2024-11-21T17:51:46+00:00
GTA/TA Question,2024-11-21T17:00:53+00:00
Am I cooked?,2024-11-21T16:50:30+00:00
Help accessing the Connect account for Beginners French,2024-11-21T14:05:27+00:00
"On the wait list for every single class, all STEM",2024-11-21T13:44:37+00:00
Ole Miss Ticket,2024-11-21T13:30:11+00:00
Dual Enrollment Classes?,2024-11-21T12:44:18+00:00
Medico looking for shorterm shared accomodation.,2024-11-21T09:18:20+00:00
Would UF rescind me for 2 Cs and 2 Bs senior year?,2024-11-21T06:07:56+00:00
Selling ole miss ticket!,2024-11-21T03:53:43+00:00
Thoughts on ALP ?,2024-11-21T03:30:09+00:00
Lost a book i borrowed from library,2024-11-21T03:03:09+00:00
Redcoach Stop,2024-11-21T01:38:27+00:00
Anyone else feel like giving up sometimes,2024-11-21T01:29:35+00:00
Resources for prospective students?,2024-11-21T00:05:28+00:00
Holiday Gator,2024-11-20T23:16:42+00:00
Opinions/info on Fletcher Hall,2024-11-20T22:56:55+00:00
MMA/Kickboxing gyms in gainseville,2024-11-20T20:58:26+00:00
Admissions,2024-11-20T20:10:38+00:00
"FIRST MONTH'S RENT FREE/Reletting at 2nd Avenue Apartments in Gainesville, FL",2024-11-20T18:26:21+00:00
2 Bedroom 1 Bath Spring and Summer 2025 Sublet,2024-11-20T17:00:29+00:00
Am I cooked?,2024-11-20T15:56:25+00:00
I wanna form a discussion group,2024-11-20T15:46:39+00:00
Looking for a Fall 2025 roommate off campus!,2024-11-20T14:45:24+00:00
Sorry another chances post 😅,2024-11-20T12:56:13+00:00
"Starting a 2 year on-campus MBA next year. What are the best nightlife spots for grad students? Also, are there clubs on campus I could join?",2024-11-20T08:25:21+00:00
How many of yall transferred from UCF?,2024-11-20T07:49:45+00:00
Transfer Decisions for (CALS) Fall 2025,2024-11-20T04:22:21+00:00
New UF student package/swag?,2024-11-20T04:05:09+00:00
Do I need math Up To Calc III and Physics with Calc II finished as prerequisites before transferring to UF?,2024-11-20T03:37:36+00:00
BME4632 Jamal Lewis,2024-11-20T03:26:09+00:00
What should I do??,2024-11-20T03:15:37+00:00
Transfer Appeal Advice,2024-11-20T02:50:56+00:00
Do I need to take symbolic logic for philosophy major?,2024-11-20T02:03:22+00:00
The lark,2024-11-20T01:29:50+00:00
"OoS students, what do y’all think got you in?",2024-11-20T01:09:35+00:00
Bright futures,2024-11-20T00:42:37+00:00
Opinions/Experiences with Trimark?,2024-11-20T00:20:42+00:00
CHM2046 (Christou) vs CHM2051 (Angerhofer),2024-11-19T23:22:51+00:00
Looking for sublease near UF,2024-11-19T22:33:59+00:00
Has anyone has heard back on whether they’ve been accepted into the online entomology masters program?,2024-11-19T22:04:18+00:00
Is intro to ASL an easy class?,2024-11-19T21:38:10+00:00
What C grade is passing? 75% or better?,2024-11-19T21:32:49+00:00
"3.65 gpa , 1360 sat, First Gen, low income , varsity sports and clubs and job, took 9 ap classes throughout highschool, applied summer term. Am I getting in?",2024-11-19T20:14:44+00:00
take my survey for a uf quest class pls 🙏🏽 it’s super quick,2024-11-19T19:13:14+00:00
Marston 3rd floor is the LA of Marston,2024-11-19T18:59:31+00:00
Should I drop Chem I,2024-11-19T18:57:40+00:00
Apartments for fall 2025,2024-11-19T17:48:40+00:00
Can I push back graduation to do another certificate?,2024-11-19T16:23:32+00:00
Masters in Management,2024-11-19T16:21:05+00:00
Would I be able to get into the promise program at UF?,2024-11-19T15:09:07+00:00
Has anyone used the Florida FASTER system for transcripts?,2024-11-19T14:17:24+00:00
I have a question about applying to Lexington,2024-11-19T06:29:10+00:00
GUYS I MESSED UP HELP (INNOVATION ACADEMY) 💀🙏🏼,2024-11-19T04:06:04+00:00
4x4 apartments,2024-11-19T02:46:54+00:00
Where to take physics 1 and 2 over summer,2024-11-19T02:27:16+00:00
take my 7 question survey for class!,2024-11-19T02:07:25+00:00
Looking for Sublease Jan2025,2024-11-19T01:06:37+00:00
are financial aid & CLAS advising offices open during finals week,2024-11-19T00:56:24+00:00
Where to park at Varsity House?,2024-11-19T00:16:28+00:00
studying physics,2024-11-19T00:12:55+00:00
uf dual enrollment effect on application/admission,2024-11-18T22:10:23+00:00
Gpa and sat,2024-11-18T21:59:30+00:00
Chance me for Public Health,2024-11-18T21:45:13+00:00
Roommate for Large Triple,2024-11-18T21:30:48+00:00
Im going to UF on spring and wanted to know apartment suggestions,2024-11-18T21:24:46+00:00
Alight Off Campus Housing Thoughts,2024-11-18T20:53:52+00:00
plz take my survey for class,2024-11-18T20:20:49+00:00
UF flex learning vs online classes?,2024-11-18T19:23:44+00:00
Do i have a chance of getting in?,2024-11-18T19:20:16+00:00
Networking for students,2024-11-18T19:03:16+00:00
Summer Online Courses,2024-11-18T18:34:11+00:00
EML2023 full,2024-11-18T16:39:19+00:00
Digital Public History,2024-11-18T16:34:15+00:00
Is UF Online smart for a first time college student?,2024-11-18T16:07:42+00:00
"Diff eq, sets and logic, programming with data in R and stats 2?",2024-11-18T15:00:48+00:00
What happens if I’m sick for review?,2024-11-18T14:00:34+00:00
Thoughts on Cabana Beach Apts?,2024-11-18T07:47:45+00:00
We are creating notetaking app for students.,2024-11-18T04:51:15+00:00
UF online or FIU online?,2024-11-18T03:50:36+00:00
$600/month (including utilities) apartment available for the spring,2024-11-18T00:15:37+00:00
Limited course selection,2024-11-17T23:26:51+00:00
Any graduation photographers?,2024-11-17T22:56:47+00:00
allergy accomodations,2024-11-17T21:36:27+00:00
Bio 2 lab,2024-11-17T17:43:43+00:00
Is the eduroam internet acting up for anyone else right now?,2024-11-17T16:50:35+00:00
Greek life opinions,2024-11-17T16:02:59+00:00
Any Grad Students Looking for New Friends?,2024-11-17T15:11:40+00:00
PaCE - FL Shines,2024-11-17T13:03:04+00:00
LOST PURSE!!!!!,2024-11-17T06:44:37+00:00
I heard a Delta Upsilon brother passed away today? Anyone have more info,2024-11-17T06:12:21+00:00
Time to print poster?,2024-11-17T05:01:48+00:00
Honors housing,2024-11-17T04:19:42+00:00
class availability?,2024-11-17T04:08:31+00:00
Found 3DS,2024-11-17T03:48:32+00:00
College decision,2024-11-17T03:15:43+00:00
WST 3415 v WST2322,2024-11-17T02:59:36+00:00
Anyone not want a lakeside single?,2024-11-17T02:58:43+00:00
Tortilla Chip Seasoning at Broward Dining Hall,2024-11-17T02:34:05+00:00
Sledd Single Suite swap,2024-11-17T01:59:59+00:00
Lakeside Single Swap?,2024-11-17T01:18:44+00:00
STA3032 - Worth it for the minor?,2024-11-16T23:49:47+00:00
Could EA decisions come early?,2024-11-16T23:49:04+00:00
marston bathrooms,2024-11-16T23:35:23+00:00
Starting to regret my major,2024-11-16T23:05:40+00:00
Murphree Hall,2024-11-16T22:10:03+00:00
What’s so wrong with On20?,2024-11-16T22:08:58+00:00
Phy2048,2024-11-16T21:33:11+00:00
anyone interested in joining a book club?,2024-11-16T18:34:41+00:00
CRW1301 for non-native speakers,2024-11-16T17:19:29+00:00
Can I buy someone’s campus parking spot if i’m living off campus and not get in trouble?,2024-11-16T15:06:18+00:00
s3lling tix!,2024-11-16T14:36:41+00:00
Housing Confusion room’s,2024-11-16T14:34:30+00:00
UF Law School- Releting,2024-11-16T13:14:14+00:00
Honors village,2024-11-16T09:04:36+00:00
Can I transfer more than 60 credits to UF?,2024-11-16T07:45:50+00:00
Can’t transfer football ticket,2024-11-16T05:25:30+00:00
Temporary Roommate,2024-11-16T04:19:21+00:00
Questions about midtown apartments,2024-11-16T04:10:15+00:00
2025 Spring Transfer Admissions,2024-11-16T02:20:56+00:00
Summer Credit Limits,2024-11-16T01:48:45+00:00
Museum walk or alight?,2024-11-16T01:23:03+00:00
Do I have chance to get in?,2024-11-16T01:07:19+00:00
Engineering Clubs,2024-11-16T00:38:21+00:00
Easy electives at 3000 level,2024-11-15T22:48:15+00:00
Anyone subleasing for Spring?,2024-11-15T22:31:14+00:00
How to ask for over 18 credits?,2024-11-15T22:03:37+00:00
Cooked or burnt to the core????,2024-11-15T21:53:37+00:00
Reading habits survey !!!,2024-11-15T21:35:22+00:00
uf admissions,2024-11-15T20:53:43+00:00
As an International Student how much of the cost do scholarships cover for Grad School?,2024-11-15T18:22:03+00:00
lakeside apartment style single,2024-11-15T17:33:12+00:00
Spring 2025 transfer decision.. today is deadline,2024-11-15T17:01:45+00:00
Courses with certifications,2024-11-15T16:02:33+00:00
Need Bar Suggestions!,2024-11-15T15:27:11+00:00
uf scheduling is so 💩,2024-11-15T15:18:03+00:00
sellling one LSU student ticket,2024-11-15T14:03:46+00:00
Anyone have a lakeside single or keys they want to switch out of?,2024-11-15T13:43:32+00:00
UF schedule stuff type 💩,2024-11-15T11:44:08+00:00
Online CS course recommendations,2024-11-15T10:07:03+00:00
removed from major,2024-11-14T20:33:29+00:00
Transferring to civil engineering,2024-11-15T07:25:57+00:00
Lost keysssss,2024-11-15T05:18:43+00:00
Transfer question,2024-11-15T05:02:56+00:00
nursing transfer,2024-11-15T05:02:35+00:00
Spring 2025 schedule am I cooked?,2024-11-15T04:18:37+00:00
lakeside dorm double,2024-11-15T03:52:07+00:00
Should I submit my ACT?,2024-11-15T02:23:29+00:00
room swap reid single,2024-11-15T01:46:33+00:00
Chances of Acceptance,2024-11-15T01:44:58+00:00
Changing to computer engineering major…,2024-11-15T00:35:27+00:00
Poll: Should 'Quiet Floors' allow whispering,2024-11-15T00:29:37+00:00
PSY3213L - Laboratory Methods in Psychology with Nicholas Coles?,2024-11-15T00:13:32+00:00
How many shower/bathroom stalls in Riker?,2024-11-14T22:44:17+00:00
Low commitment orchestra groups,2024-11-14T22:23:20+00:00
help ??,2024-11-14T22:16:51+00:00
Where do i get gator merch for the game,2024-11-14T21:57:28+00:00
Lakeside Updated Buildings?,2024-11-14T21:22:26+00:00
what course do i take? business/finance,2024-11-14T21:10:54+00:00
Bio 2 Lab Availability,2024-11-14T21:02:40+00:00
In the class but not the lab,2024-11-14T20:43:31+00:00
Has anyone had Jennifer Wooten for SPN1131 (beginning spanish 2) ONLINE and can tell me about their experience?,2024-11-14T20:23:57+00:00
HELP what classes do i take (finance/business),2024-11-14T19:39:09+00:00
No Single or Double Room Options?,2024-11-14T19:31:58+00:00
housing options,2024-11-14T19:19:44+00:00
Can anybody tell me about the easiest Quest 1 courses??,2024-11-14T19:00:59+00:00
Mobile Outreach Clinic,2024-11-14T18:53:45+00:00
